
         /\      Grafana   /‾‾/  
    /\  /  \     |\  __   /  /   
   /  \/    \    | |/ /  /   ‾‾\ 
  /          \   |   (  |  (‾)  |
 / __________ \  |_|\_\  \_____/ 

     execution: local
        script: ./script.js
        output: -

     scenarios: (100.00%) 1 scenario, 500 max VUs, 10m30s max duration (incl. graceful stop):
              * fixed_iterations: 200 iterations for each of 500 VUs (maxDuration: 10m0s, gracefulStop: 30s)


running (00m00.9s), 500/500 VUs, 2163 complete and 0 interrupted iterations
fixed_iterations   [   2% ] 500 VUs  00m00.9s/10m0s  002163/100000 iters, 200 per VU

running (00m01.9s), 500/500 VUs, 4320 complete and 0 interrupted iterations
fixed_iterations   [   4% ] 500 VUs  00m01.9s/10m0s  004320/100000 iters, 200 per VU

running (00m02.9s), 500/500 VUs, 6226 complete and 0 interrupted iterations
fixed_iterations   [   6% ] 500 VUs  00m02.9s/10m0s  006226/100000 iters, 200 per VU

running (00m03.9s), 500/500 VUs, 8265 complete and 0 interrupted iterations
fixed_iterations   [   8% ] 500 VUs  00m03.9s/10m0s  008265/100000 iters, 200 per VU

running (00m04.9s), 500/500 VUs, 10215 complete and 0 interrupted iterations
fixed_iterations   [  10% ] 500 VUs  00m04.9s/10m0s  010215/100000 iters, 200 per VU

running (00m05.9s), 500/500 VUs, 12298 complete and 0 interrupted iterations
fixed_iterations   [  12% ] 500 VUs  00m05.9s/10m0s  012298/100000 iters, 200 per VU

running (00m06.9s), 500/500 VUs, 14164 complete and 0 interrupted iterations
fixed_iterations   [  14% ] 500 VUs  00m06.9s/10m0s  014164/100000 iters, 200 per VU

running (00m07.9s), 500/500 VUs, 16115 complete and 0 interrupted iterations
fixed_iterations   [  16% ] 500 VUs  00m07.9s/10m0s  016115/100000 iters, 200 per VU

running (00m08.9s), 500/500 VUs, 17988 complete and 0 interrupted iterations
fixed_iterations   [  18% ] 500 VUs  00m08.9s/10m0s  017988/100000 iters, 200 per VU

running (00m09.9s), 500/500 VUs, 19728 complete and 0 interrupted iterations
fixed_iterations   [  20% ] 500 VUs  00m09.9s/10m0s  019728/100000 iters, 200 per VU

running (00m11.1s), 500/500 VUs, 21907 complete and 0 interrupted iterations
fixed_iterations   [  22% ] 500 VUs  00m11.2s/10m0s  021907/100000 iters, 200 per VU

running (00m11.9s), 500/500 VUs, 23569 complete and 0 interrupted iterations
fixed_iterations   [  24% ] 500 VUs  00m11.9s/10m0s  023569/100000 iters, 200 per VU

running (00m12.9s), 500/500 VUs, 25582 complete and 0 interrupted iterations
fixed_iterations   [  26% ] 500 VUs  00m12.9s/10m0s  025582/100000 iters, 200 per VU

running (00m13.9s), 500/500 VUs, 27504 complete and 0 interrupted iterations
fixed_iterations   [  28% ] 500 VUs  00m13.9s/10m0s  027504/100000 iters, 200 per VU

running (00m14.9s), 500/500 VUs, 29602 complete and 0 interrupted iterations
fixed_iterations   [  30% ] 500 VUs  00m14.9s/10m0s  029602/100000 iters, 200 per VU

running (00m15.9s), 500/500 VUs, 31444 complete and 0 interrupted iterations
fixed_iterations   [  31% ] 500 VUs  00m15.9s/10m0s  031444/100000 iters, 200 per VU

running (00m16.9s), 500/500 VUs, 33275 complete and 0 interrupted iterations
fixed_iterations   [  33% ] 500 VUs  00m16.9s/10m0s  033275/100000 iters, 200 per VU

running (00m18.0s), 500/500 VUs, 34964 complete and 0 interrupted iterations
fixed_iterations   [  35% ] 500 VUs  00m18.0s/10m0s  034964/100000 iters, 200 per VU

running (00m18.9s), 500/500 VUs, 36914 complete and 0 interrupted iterations
fixed_iterations   [  37% ] 500 VUs  00m18.9s/10m0s  036914/100000 iters, 200 per VU

running (00m19.9s), 500/500 VUs, 39044 complete and 0 interrupted iterations
fixed_iterations   [  39% ] 500 VUs  00m19.9s/10m0s  039044/100000 iters, 200 per VU

running (00m21.0s), 500/500 VUs, 40827 complete and 0 interrupted iterations
fixed_iterations   [  41% ] 500 VUs  00m21.0s/10m0s  040827/100000 iters, 200 per VU

running (00m21.9s), 500/500 VUs, 42866 complete and 0 interrupted iterations
fixed_iterations   [  43% ] 500 VUs  00m21.9s/10m0s  042866/100000 iters, 200 per VU

running (00m22.9s), 500/500 VUs, 44654 complete and 0 interrupted iterations
fixed_iterations   [  45% ] 500 VUs  00m22.9s/10m0s  044654/100000 iters, 200 per VU

running (00m23.9s), 500/500 VUs, 46596 complete and 0 interrupted iterations
fixed_iterations   [  47% ] 500 VUs  00m23.9s/10m0s  046596/100000 iters, 200 per VU

running (00m24.9s), 500/500 VUs, 48500 complete and 0 interrupted iterations
fixed_iterations   [  48% ] 500 VUs  00m24.9s/10m0s  048500/100000 iters, 200 per VU

running (00m25.9s), 500/500 VUs, 50377 complete and 0 interrupted iterations
fixed_iterations   [  50% ] 500 VUs  00m25.9s/10m0s  050377/100000 iters, 200 per VU

running (00m26.9s), 500/500 VUs, 52233 complete and 0 interrupted iterations
fixed_iterations   [  52% ] 500 VUs  00m26.9s/10m0s  052233/100000 iters, 200 per VU

running (00m27.9s), 500/500 VUs, 54033 complete and 0 interrupted iterations
fixed_iterations   [  54% ] 500 VUs  00m27.9s/10m0s  054033/100000 iters, 200 per VU

running (00m28.9s), 500/500 VUs, 55991 complete and 0 interrupted iterations
fixed_iterations   [  56% ] 500 VUs  00m28.9s/10m0s  055991/100000 iters, 200 per VU

running (00m30.0s), 500/500 VUs, 58004 complete and 0 interrupted iterations
fixed_iterations   [  58% ] 500 VUs  00m30.0s/10m0s  058004/100000 iters, 200 per VU

running (00m30.9s), 500/500 VUs, 59758 complete and 0 interrupted iterations
fixed_iterations   [  60% ] 500 VUs  00m30.9s/10m0s  059758/100000 iters, 200 per VU

running (00m31.9s), 500/500 VUs, 61716 complete and 0 interrupted iterations
fixed_iterations   [  62% ] 500 VUs  00m31.9s/10m0s  061716/100000 iters, 200 per VU

running (00m32.9s), 500/500 VUs, 63876 complete and 0 interrupted iterations
fixed_iterations   [  64% ] 500 VUs  00m32.9s/10m0s  063876/100000 iters, 200 per VU

running (00m33.9s), 500/500 VUs, 66007 complete and 0 interrupted iterations
fixed_iterations   [  66% ] 500 VUs  00m33.9s/10m0s  066008/100000 iters, 200 per VU

running (00m34.9s), 500/500 VUs, 68206 complete and 0 interrupted iterations
fixed_iterations   [  68% ] 500 VUs  00m34.9s/10m0s  068206/100000 iters, 200 per VU

running (00m35.9s), 500/500 VUs, 70249 complete and 0 interrupted iterations
fixed_iterations   [  70% ] 500 VUs  00m35.9s/10m0s  070249/100000 iters, 200 per VU

running (00m36.9s), 500/500 VUs, 72199 complete and 0 interrupted iterations
fixed_iterations   [  72% ] 500 VUs  00m36.9s/10m0s  072199/100000 iters, 200 per VU

running (00m37.9s), 500/500 VUs, 74384 complete and 0 interrupted iterations
fixed_iterations   [  74% ] 500 VUs  00m37.9s/10m0s  074384/100000 iters, 200 per VU

running (00m38.9s), 500/500 VUs, 76527 complete and 0 interrupted iterations
fixed_iterations   [  77% ] 500 VUs  00m38.9s/10m0s  076527/100000 iters, 200 per VU

running (00m39.9s), 500/500 VUs, 78732 complete and 0 interrupted iterations
fixed_iterations   [  79% ] 500 VUs  00m39.9s/10m0s  078732/100000 iters, 200 per VU

running (00m40.9s), 500/500 VUs, 80903 complete and 0 interrupted iterations
fixed_iterations   [  81% ] 500 VUs  00m40.9s/10m0s  080903/100000 iters, 200 per VU

running (00m41.9s), 500/500 VUs, 83203 complete and 0 interrupted iterations
fixed_iterations   [  83% ] 500 VUs  00m41.9s/10m0s  083203/100000 iters, 200 per VU

running (00m42.9s), 500/500 VUs, 85458 complete and 0 interrupted iterations
fixed_iterations   [  85% ] 500 VUs  00m42.9s/10m0s  085458/100000 iters, 200 per VU

running (00m43.9s), 500/500 VUs, 87191 complete and 0 interrupted iterations
fixed_iterations   [  87% ] 500 VUs  00m43.9s/10m0s  087191/100000 iters, 200 per VU

running (00m44.9s), 500/500 VUs, 89701 complete and 0 interrupted iterations
fixed_iterations   [  90% ] 500 VUs  00m44.9s/10m0s  089701/100000 iters, 200 per VU

running (00m45.9s), 500/500 VUs, 91848 complete and 0 interrupted iterations
fixed_iterations   [  92% ] 500 VUs  00m45.9s/10m0s  091848/100000 iters, 200 per VU

running (00m46.9s), 500/500 VUs, 93681 complete and 0 interrupted iterations
fixed_iterations   [  94% ] 500 VUs  00m46.9s/10m0s  093682/100000 iters, 200 per VU

running (00m47.9s), 500/500 VUs, 95232 complete and 0 interrupted iterations
fixed_iterations   [  95% ] 500 VUs  00m47.9s/10m0s  095232/100000 iters, 200 per VU

running (00m48.9s), 500/500 VUs, 95232 complete and 0 interrupted iterations
fixed_iterations   [  95% ] 500 VUs  00m48.9s/10m0s  095232/100000 iters, 200 per VU

running (00m49.9s), 500/500 VUs, 95959 complete and 0 interrupted iterations
fixed_iterations   [  96% ] 500 VUs  00m49.9s/10m0s  095959/100000 iters, 200 per VU

running (00m50.9s), 496/500 VUs, 97977 complete and 0 interrupted iterations
fixed_iterations   [  98% ] 500 VUs  00m50.9s/10m0s  097977/100000 iters, 200 per VU

running (00m51.9s), 254/500 VUs, 99573 complete and 0 interrupted iterations
fixed_iterations   [ 100% ] 500 VUs  00m51.9s/10m0s  099573/100000 iters, 200 per VU


  █ TOTAL RESULTS 

    checks_total.......: 100000  1916.461082/s
    checks_succeeded...: 100.00% 100000 out of 100000
    checks_failed......: 0.00%   0 out of 100000

    ✓ status is 200

    HTTP
    http_req_duration..............: avg=258.63ms min=1.25ms med=245.8ms  max=2.04s p(90)=309.85ms p(95)=335.78ms
      { expected_response:true }...: avg=258.63ms min=1.25ms med=245.8ms  max=2.04s p(90)=309.85ms p(95)=335.78ms
    http_req_failed................: 0.00%  0 out of 100000
    http_reqs......................: 100000 1916.461082/s

    EXECUTION
    iteration_duration.............: avg=259.07ms min=1.33ms med=246.13ms max=2.04s p(90)=310.31ms p(95)=336.17ms
    iterations.....................: 100000 1916.461082/s
    vus............................: 254    min=254         max=500
    vus_max........................: 500    min=500         max=500

    NETWORK
    data_received..................: 22 MB  414 kB/s
    data_sent......................: 14 MB  261 kB/s




running (00m52.2s), 000/500 VUs, 100000 complete and 0 interrupted iterations
fixed_iterations ✓ [ 100% ] 500 VUs  00m52.2s/10m0s  100000/100000 iters, 200 per VU
