
         /\      Grafana   /‾‾/  
    /\  /  \     |\  __   /  /   
   /  \/    \    | |/ /  /   ‾‾\ 
  /          \   |   (  |  (‾)  |
 / __________ \  |_|\_\  \_____/ 

     execution: local
        script: ./script.js
        output: -

     scenarios: (100.00%) 1 scenario, 500 max VUs, 10m30s max duration (incl. graceful stop):
              * fixed_iterations: 200 iterations for each of 500 VUs (maxDuration: 10m0s, gracefulStop: 30s)


running (00m01.0s), 500/500 VUs, 535 complete and 0 interrupted iterations
fixed_iterations   [   1% ] 500 VUs  00m01.0s/10m0s  000535/100000 iters, 200 per VU

running (00m02.0s), 500/500 VUs, 1181 complete and 0 interrupted iterations
fixed_iterations   [   1% ] 500 VUs  00m02.0s/10m0s  001181/100000 iters, 200 per VU

running (00m03.0s), 500/500 VUs, 1554 complete and 0 interrupted iterations
fixed_iterations   [   2% ] 500 VUs  00m03.0s/10m0s  001554/100000 iters, 200 per VU

running (00m04.0s), 500/500 VUs, 1914 complete and 0 interrupted iterations
fixed_iterations   [   2% ] 500 VUs  00m04.0s/10m0s  001914/100000 iters, 200 per VU

running (00m05.0s), 500/500 VUs, 2281 complete and 0 interrupted iterations
fixed_iterations   [   2% ] 500 VUs  00m05.0s/10m0s  002281/100000 iters, 200 per VU

running (00m06.0s), 500/500 VUs, 2665 complete and 0 interrupted iterations
fixed_iterations   [   3% ] 500 VUs  00m06.0s/10m0s  002665/100000 iters, 200 per VU

running (00m07.0s), 500/500 VUs, 3343 complete and 0 interrupted iterations
fixed_iterations   [   3% ] 500 VUs  00m07.0s/10m0s  003343/100000 iters, 200 per VU

running (00m08.0s), 500/500 VUs, 3877 complete and 0 interrupted iterations
fixed_iterations   [   4% ] 500 VUs  00m08.0s/10m0s  003877/100000 iters, 200 per VU

running (00m09.0s), 500/500 VUs, 4248 complete and 0 interrupted iterations
fixed_iterations   [   4% ] 500 VUs  00m09.0s/10m0s  004248/100000 iters, 200 per VU

running (00m10.0s), 500/500 VUs, 4857 complete and 0 interrupted iterations
fixed_iterations   [   5% ] 500 VUs  00m10.0s/10m0s  004857/100000 iters, 200 per VU

running (00m11.0s), 500/500 VUs, 5248 complete and 0 interrupted iterations
fixed_iterations   [   5% ] 500 VUs  00m11.0s/10m0s  005248/100000 iters, 200 per VU

running (00m12.0s), 500/500 VUs, 5890 complete and 0 interrupted iterations
fixed_iterations   [   6% ] 500 VUs  00m12.0s/10m0s  005890/100000 iters, 200 per VU

running (00m13.0s), 500/500 VUs, 6254 complete and 0 interrupted iterations
fixed_iterations   [   6% ] 500 VUs  00m13.0s/10m0s  006254/100000 iters, 200 per VU

running (00m14.0s), 500/500 VUs, 6623 complete and 0 interrupted iterations
fixed_iterations   [   7% ] 500 VUs  00m14.0s/10m0s  006623/100000 iters, 200 per VU

running (00m15.0s), 500/500 VUs, 6998 complete and 0 interrupted iterations
fixed_iterations   [   7% ] 500 VUs  00m15.0s/10m0s  006998/100000 iters, 200 per VU

running (00m16.0s), 500/500 VUs, 7379 complete and 0 interrupted iterations
fixed_iterations   [   7% ] 500 VUs  00m16.0s/10m0s  007379/100000 iters, 200 per VU

running (00m17.0s), 500/500 VUs, 8031 complete and 0 interrupted iterations
fixed_iterations   [   8% ] 500 VUs  00m17.0s/10m0s  008031/100000 iters, 200 per VU

running (00m18.0s), 500/500 VUs, 8395 complete and 0 interrupted iterations
fixed_iterations   [   8% ] 500 VUs  00m18.0s/10m0s  008395/100000 iters, 200 per VU

running (00m19.0s), 500/500 VUs, 8773 complete and 0 interrupted iterations
fixed_iterations   [   9% ] 500 VUs  00m19.0s/10m0s  008773/100000 iters, 200 per VU

running (00m20.0s), 500/500 VUs, 9156 complete and 0 interrupted iterations
fixed_iterations   [   9% ] 500 VUs  00m20.0s/10m0s  009156/100000 iters, 200 per VU

running (00m21.0s), 500/500 VUs, 9527 complete and 0 interrupted iterations
fixed_iterations   [  10% ] 500 VUs  00m21.0s/10m0s  009527/100000 iters, 200 per VU

running (00m22.0s), 500/500 VUs, 10142 complete and 0 interrupted iterations
fixed_iterations   [  10% ] 500 VUs  00m22.0s/10m0s  010142/100000 iters, 200 per VU

running (00m23.0s), 500/500 VUs, 10517 complete and 0 interrupted iterations
fixed_iterations   [  11% ] 500 VUs  00m23.0s/10m0s  010517/100000 iters, 200 per VU

running (00m24.0s), 500/500 VUs, 10879 complete and 0 interrupted iterations
fixed_iterations   [  11% ] 500 VUs  00m24.0s/10m0s  010879/100000 iters, 200 per VU

running (00m25.0s), 500/500 VUs, 11253 complete and 0 interrupted iterations
fixed_iterations   [  11% ] 500 VUs  00m25.0s/10m0s  011253/100000 iters, 200 per VU

running (00m26.0s), 500/500 VUs, 11646 complete and 0 interrupted iterations
fixed_iterations   [  12% ] 500 VUs  00m26.0s/10m0s  011646/100000 iters, 200 per VU

running (00m27.0s), 500/500 VUs, 12235 complete and 0 interrupted iterations
fixed_iterations   [  12% ] 500 VUs  00m27.0s/10m0s  012235/100000 iters, 200 per VU

running (00m28.0s), 500/500 VUs, 12601 complete and 0 interrupted iterations
fixed_iterations   [  13% ] 500 VUs  00m28.0s/10m0s  012601/100000 iters, 200 per VU

running (00m29.0s), 500/500 VUs, 13113 complete and 0 interrupted iterations
fixed_iterations   [  13% ] 500 VUs  00m29.0s/10m0s  013113/100000 iters, 200 per VU

running (00m30.0s), 500/500 VUs, 13528 complete and 0 interrupted iterations
fixed_iterations   [  14% ] 500 VUs  00m30.0s/10m0s  013528/100000 iters, 200 per VU

running (00m31.0s), 500/500 VUs, 13914 complete and 0 interrupted iterations
fixed_iterations   [  14% ] 500 VUs  00m31.0s/10m0s  013914/100000 iters, 200 per VU

running (00m32.0s), 500/500 VUs, 14547 complete and 0 interrupted iterations
fixed_iterations   [  15% ] 500 VUs  00m32.0s/10m0s  014547/100000 iters, 200 per VU

running (00m33.0s), 500/500 VUs, 14929 complete and 0 interrupted iterations
fixed_iterations   [  15% ] 500 VUs  00m33.0s/10m0s  014929/100000 iters, 200 per VU

running (00m34.0s), 500/500 VUs, 15309 complete and 0 interrupted iterations
fixed_iterations   [  15% ] 500 VUs  00m34.0s/10m0s  015309/100000 iters, 200 per VU

running (00m35.0s), 500/500 VUs, 15696 complete and 0 interrupted iterations
fixed_iterations   [  16% ] 500 VUs  00m35.0s/10m0s  015696/100000 iters, 200 per VU

running (00m36.0s), 500/500 VUs, 16078 complete and 0 interrupted iterations
fixed_iterations   [  16% ] 500 VUs  00m36.0s/10m0s  016078/100000 iters, 200 per VU

running (00m37.0s), 500/500 VUs, 16686 complete and 0 interrupted iterations
fixed_iterations   [  17% ] 500 VUs  00m37.0s/10m0s  016686/100000 iters, 200 per VU

running (00m38.0s), 500/500 VUs, 17067 complete and 0 interrupted iterations
fixed_iterations   [  17% ] 500 VUs  00m38.0s/10m0s  017067/100000 iters, 200 per VU

running (00m39.0s), 500/500 VUs, 17448 complete and 0 interrupted iterations
fixed_iterations   [  17% ] 500 VUs  00m39.0s/10m0s  017448/100000 iters, 200 per VU

running (00m40.0s), 500/500 VUs, 17837 complete and 0 interrupted iterations
fixed_iterations   [  18% ] 500 VUs  00m40.0s/10m0s  017837/100000 iters, 200 per VU

running (00m41.0s), 500/500 VUs, 18222 complete and 0 interrupted iterations
fixed_iterations   [  18% ] 500 VUs  00m41.0s/10m0s  018222/100000 iters, 200 per VU

running (00m42.0s), 500/500 VUs, 18853 complete and 0 interrupted iterations
fixed_iterations   [  19% ] 500 VUs  00m42.0s/10m0s  018853/100000 iters, 200 per VU

running (00m43.0s), 500/500 VUs, 19225 complete and 0 interrupted iterations
fixed_iterations   [  19% ] 500 VUs  00m43.0s/10m0s  019225/100000 iters, 200 per VU

running (00m44.0s), 500/500 VUs, 19596 complete and 0 interrupted iterations
fixed_iterations   [  20% ] 500 VUs  00m44.0s/10m0s  019596/100000 iters, 200 per VU

running (00m45.0s), 500/500 VUs, 19964 complete and 0 interrupted iterations
fixed_iterations   [  20% ] 500 VUs  00m45.0s/10m0s  019964/100000 iters, 200 per VU

running (00m46.0s), 500/500 VUs, 20351 complete and 0 interrupted iterations
fixed_iterations   [  20% ] 500 VUs  00m46.0s/10m0s  020351/100000 iters, 200 per VU

running (00m47.0s), 500/500 VUs, 20961 complete and 0 interrupted iterations
fixed_iterations   [  21% ] 500 VUs  00m47.0s/10m0s  020961/100000 iters, 200 per VU

running (00m48.0s), 500/500 VUs, 21339 complete and 0 interrupted iterations
fixed_iterations   [  21% ] 500 VUs  00m48.0s/10m0s  021339/100000 iters, 200 per VU

running (00m49.0s), 500/500 VUs, 21861 complete and 0 interrupted iterations
fixed_iterations   [  22% ] 500 VUs  00m49.0s/10m0s  021861/100000 iters, 200 per VU

running (00m50.0s), 500/500 VUs, 22245 complete and 0 interrupted iterations
fixed_iterations   [  22% ] 500 VUs  00m50.0s/10m0s  022245/100000 iters, 200 per VU

running (00m51.0s), 500/500 VUs, 22637 complete and 0 interrupted iterations
fixed_iterations   [  23% ] 500 VUs  00m51.0s/10m0s  022637/100000 iters, 200 per VU

running (00m52.0s), 500/500 VUs, 23292 complete and 0 interrupted iterations
fixed_iterations   [  23% ] 500 VUs  00m52.0s/10m0s  023292/100000 iters, 200 per VU

running (00m53.0s), 500/500 VUs, 23679 complete and 0 interrupted iterations
fixed_iterations   [  24% ] 500 VUs  00m53.0s/10m0s  023679/100000 iters, 200 per VU

running (00m54.0s), 500/500 VUs, 24055 complete and 0 interrupted iterations
fixed_iterations   [  24% ] 500 VUs  00m54.0s/10m0s  024055/100000 iters, 200 per VU

running (00m55.0s), 500/500 VUs, 24428 complete and 0 interrupted iterations
fixed_iterations   [  24% ] 500 VUs  00m55.0s/10m0s  024428/100000 iters, 200 per VU

running (00m56.0s), 500/500 VUs, 24798 complete and 0 interrupted iterations
fixed_iterations   [  25% ] 500 VUs  00m56.0s/10m0s  024798/100000 iters, 200 per VU

running (00m57.0s), 500/500 VUs, 25447 complete and 0 interrupted iterations
fixed_iterations   [  25% ] 500 VUs  00m57.0s/10m0s  025447/100000 iters, 200 per VU

running (00m58.0s), 500/500 VUs, 25839 complete and 0 interrupted iterations
fixed_iterations   [  26% ] 500 VUs  00m58.0s/10m0s  025839/100000 iters, 200 per VU

running (00m59.0s), 500/500 VUs, 26240 complete and 0 interrupted iterations
fixed_iterations   [  26% ] 500 VUs  00m59.0s/10m0s  026240/100000 iters, 200 per VU

running (01m00.0s), 500/500 VUs, 26630 complete and 0 interrupted iterations
fixed_iterations   [  27% ] 500 VUs  01m00.0s/10m0s  026630/100000 iters, 200 per VU

running (01m01.0s), 500/500 VUs, 27164 complete and 0 interrupted iterations
fixed_iterations   [  27% ] 500 VUs  01m01.0s/10m0s  027164/100000 iters, 200 per VU

running (01m02.0s), 500/500 VUs, 27961 complete and 0 interrupted iterations
fixed_iterations   [  28% ] 500 VUs  01m02.0s/10m0s  027961/100000 iters, 200 per VU

running (01m03.0s), 500/500 VUs, 28349 complete and 0 interrupted iterations
fixed_iterations   [  28% ] 500 VUs  01m03.0s/10m0s  028349/100000 iters, 200 per VU

running (01m04.0s), 500/500 VUs, 28727 complete and 0 interrupted iterations
fixed_iterations   [  29% ] 500 VUs  01m04.0s/10m0s  028727/100000 iters, 200 per VU

running (01m05.0s), 500/500 VUs, 29109 complete and 0 interrupted iterations
fixed_iterations   [  29% ] 500 VUs  01m05.0s/10m0s  029109/100000 iters, 200 per VU

running (01m06.0s), 500/500 VUs, 29644 complete and 0 interrupted iterations
fixed_iterations   [  30% ] 500 VUs  01m06.0s/10m0s  029644/100000 iters, 200 per VU

running (01m07.0s), 500/500 VUs, 30210 complete and 0 interrupted iterations
fixed_iterations   [  30% ] 500 VUs  01m07.0s/10m0s  030210/100000 iters, 200 per VU

running (01m08.0s), 500/500 VUs, 30592 complete and 0 interrupted iterations
fixed_iterations   [  31% ] 500 VUs  01m08.0s/10m0s  030592/100000 iters, 200 per VU

running (01m09.0s), 500/500 VUs, 30977 complete and 0 interrupted iterations
fixed_iterations   [  31% ] 500 VUs  01m09.0s/10m0s  030977/100000 iters, 200 per VU

running (01m10.0s), 500/500 VUs, 31362 complete and 0 interrupted iterations
fixed_iterations   [  31% ] 500 VUs  01m10.0s/10m0s  031362/100000 iters, 200 per VU

running (01m11.0s), 500/500 VUs, 31752 complete and 0 interrupted iterations
fixed_iterations   [  32% ] 500 VUs  01m11.0s/10m0s  031752/100000 iters, 200 per VU

running (01m12.0s), 500/500 VUs, 32455 complete and 0 interrupted iterations
fixed_iterations   [  32% ] 500 VUs  01m12.0s/10m0s  032455/100000 iters, 200 per VU

running (01m13.0s), 500/500 VUs, 32838 complete and 0 interrupted iterations
fixed_iterations   [  33% ] 500 VUs  01m13.0s/10m0s  032838/100000 iters, 200 per VU

running (01m14.0s), 500/500 VUs, 33243 complete and 0 interrupted iterations
fixed_iterations   [  33% ] 500 VUs  01m14.0s/10m0s  033243/100000 iters, 200 per VU

running (01m15.0s), 500/500 VUs, 33624 complete and 0 interrupted iterations
fixed_iterations   [  34% ] 500 VUs  01m15.0s/10m0s  033624/100000 iters, 200 per VU

running (01m16.0s), 500/500 VUs, 34029 complete and 0 interrupted iterations
fixed_iterations   [  34% ] 500 VUs  01m16.0s/10m0s  034029/100000 iters, 200 per VU

running (01m17.0s), 500/500 VUs, 34703 complete and 0 interrupted iterations
fixed_iterations   [  35% ] 500 VUs  01m17.0s/10m0s  034703/100000 iters, 200 per VU

running (01m18.0s), 500/500 VUs, 35091 complete and 0 interrupted iterations
fixed_iterations   [  35% ] 500 VUs  01m18.0s/10m0s  035091/100000 iters, 200 per VU

running (01m19.0s), 500/500 VUs, 35474 complete and 0 interrupted iterations
fixed_iterations   [  35% ] 500 VUs  01m19.0s/10m0s  035474/100000 iters, 200 per VU

running (01m20.0s), 500/500 VUs, 35875 complete and 0 interrupted iterations
fixed_iterations   [  36% ] 500 VUs  01m20.0s/10m0s  035875/100000 iters, 200 per VU

running (01m21.0s), 500/500 VUs, 36263 complete and 0 interrupted iterations
fixed_iterations   [  36% ] 500 VUs  01m21.0s/10m0s  036263/100000 iters, 200 per VU

running (01m22.0s), 500/500 VUs, 36883 complete and 0 interrupted iterations
fixed_iterations   [  37% ] 500 VUs  01m22.0s/10m0s  036883/100000 iters, 200 per VU

running (01m23.0s), 500/500 VUs, 37272 complete and 0 interrupted iterations
fixed_iterations   [  37% ] 500 VUs  01m23.0s/10m0s  037272/100000 iters, 200 per VU

running (01m24.0s), 500/500 VUs, 37802 complete and 0 interrupted iterations
fixed_iterations   [  38% ] 500 VUs  01m24.0s/10m0s  037802/100000 iters, 200 per VU

running (01m25.0s), 500/500 VUs, 38193 complete and 0 interrupted iterations
fixed_iterations   [  38% ] 500 VUs  01m25.0s/10m0s  038193/100000 iters, 200 per VU

running (01m26.0s), 500/500 VUs, 38582 complete and 0 interrupted iterations
fixed_iterations   [  39% ] 500 VUs  01m26.0s/10m0s  038582/100000 iters, 200 per VU

running (01m27.0s), 500/500 VUs, 39232 complete and 0 interrupted iterations
fixed_iterations   [  39% ] 500 VUs  01m27.0s/10m0s  039232/100000 iters, 200 per VU

running (01m28.0s), 500/500 VUs, 39633 complete and 0 interrupted iterations
fixed_iterations   [  40% ] 500 VUs  01m28.0s/10m0s  039633/100000 iters, 200 per VU

running (01m29.0s), 500/500 VUs, 40111 complete and 0 interrupted iterations
fixed_iterations   [  40% ] 500 VUs  01m29.0s/10m0s  040111/100000 iters, 200 per VU

running (01m30.0s), 500/500 VUs, 40495 complete and 0 interrupted iterations
fixed_iterations   [  40% ] 500 VUs  01m30.0s/10m0s  040495/100000 iters, 200 per VU

running (01m31.0s), 500/500 VUs, 40876 complete and 0 interrupted iterations
fixed_iterations   [  41% ] 500 VUs  01m31.0s/10m0s  040876/100000 iters, 200 per VU

running (01m32.0s), 500/500 VUs, 41496 complete and 0 interrupted iterations
fixed_iterations   [  41% ] 500 VUs  01m32.0s/10m0s  041496/100000 iters, 200 per VU

running (01m33.0s), 500/500 VUs, 41879 complete and 0 interrupted iterations
fixed_iterations   [  42% ] 500 VUs  01m33.0s/10m0s  041879/100000 iters, 200 per VU

running (01m34.0s), 500/500 VUs, 42269 complete and 0 interrupted iterations
fixed_iterations   [  42% ] 500 VUs  01m34.0s/10m0s  042269/100000 iters, 200 per VU

running (01m35.0s), 500/500 VUs, 42665 complete and 0 interrupted iterations
fixed_iterations   [  43% ] 500 VUs  01m35.0s/10m0s  042665/100000 iters, 200 per VU

running (01m36.0s), 500/500 VUs, 43057 complete and 0 interrupted iterations
fixed_iterations   [  43% ] 500 VUs  01m36.0s/10m0s  043057/100000 iters, 200 per VU

running (01m37.0s), 500/500 VUs, 43687 complete and 0 interrupted iterations
fixed_iterations   [  44% ] 500 VUs  01m37.0s/10m0s  043687/100000 iters, 200 per VU

running (01m38.0s), 500/500 VUs, 44070 complete and 0 interrupted iterations
fixed_iterations   [  44% ] 500 VUs  01m38.0s/10m0s  044070/100000 iters, 200 per VU

running (01m39.0s), 500/500 VUs, 44463 complete and 0 interrupted iterations
fixed_iterations   [  44% ] 500 VUs  01m39.0s/10m0s  044463/100000 iters, 200 per VU

running (01m40.0s), 500/500 VUs, 44861 complete and 0 interrupted iterations
fixed_iterations   [  45% ] 500 VUs  01m40.0s/10m0s  044861/100000 iters, 200 per VU

running (01m41.0s), 500/500 VUs, 45417 complete and 0 interrupted iterations
fixed_iterations   [  45% ] 500 VUs  01m41.0s/10m0s  045417/100000 iters, 200 per VU

running (01m42.0s), 500/500 VUs, 46035 complete and 0 interrupted iterations
fixed_iterations   [  46% ] 500 VUs  01m42.0s/10m0s  046035/100000 iters, 200 per VU

running (01m43.0s), 500/500 VUs, 46431 complete and 0 interrupted iterations
fixed_iterations   [  46% ] 500 VUs  01m43.0s/10m0s  046431/100000 iters, 200 per VU

running (01m44.0s), 500/500 VUs, 46834 complete and 0 interrupted iterations
fixed_iterations   [  47% ] 500 VUs  01m44.0s/10m0s  046834/100000 iters, 200 per VU

running (01m45.0s), 500/500 VUs, 47217 complete and 0 interrupted iterations
fixed_iterations   [  47% ] 500 VUs  01m45.0s/10m0s  047217/100000 iters, 200 per VU

running (01m46.0s), 500/500 VUs, 47610 complete and 0 interrupted iterations
fixed_iterations   [  48% ] 500 VUs  01m46.0s/10m0s  047610/100000 iters, 200 per VU

running (01m47.0s), 500/500 VUs, 48256 complete and 0 interrupted iterations
fixed_iterations   [  48% ] 500 VUs  01m47.0s/10m0s  048256/100000 iters, 200 per VU

running (01m48.0s), 500/500 VUs, 48663 complete and 0 interrupted iterations
fixed_iterations   [  49% ] 500 VUs  01m48.0s/10m0s  048663/100000 iters, 200 per VU

running (01m49.0s), 500/500 VUs, 49053 complete and 0 interrupted iterations
fixed_iterations   [  49% ] 500 VUs  01m49.0s/10m0s  049053/100000 iters, 200 per VU

running (01m50.0s), 500/500 VUs, 49442 complete and 0 interrupted iterations
fixed_iterations   [  49% ] 500 VUs  01m50.0s/10m0s  049442/100000 iters, 200 per VU

running (01m51.0s), 500/500 VUs, 49835 complete and 0 interrupted iterations
fixed_iterations   [  50% ] 500 VUs  01m51.0s/10m0s  049835/100000 iters, 200 per VU

running (01m52.0s), 500/500 VUs, 50520 complete and 0 interrupted iterations
fixed_iterations   [  51% ] 500 VUs  01m52.0s/10m0s  050520/100000 iters, 200 per VU

running (01m53.0s), 500/500 VUs, 50923 complete and 0 interrupted iterations
fixed_iterations   [  51% ] 500 VUs  01m53.0s/10m0s  050923/100000 iters, 200 per VU

running (01m54.0s), 500/500 VUs, 51311 complete and 0 interrupted iterations
fixed_iterations   [  51% ] 500 VUs  01m54.0s/10m0s  051311/100000 iters, 200 per VU

running (01m55.0s), 500/500 VUs, 51705 complete and 0 interrupted iterations
fixed_iterations   [  52% ] 500 VUs  01m55.0s/10m0s  051705/100000 iters, 200 per VU

running (01m56.0s), 500/500 VUs, 52104 complete and 0 interrupted iterations
fixed_iterations   [  52% ] 500 VUs  01m56.0s/10m0s  052104/100000 iters, 200 per VU

running (01m57.0s), 500/500 VUs, 52754 complete and 0 interrupted iterations
fixed_iterations   [  53% ] 500 VUs  01m57.0s/10m0s  052754/100000 iters, 200 per VU

running (01m58.0s), 500/500 VUs, 53147 complete and 0 interrupted iterations
fixed_iterations   [  53% ] 500 VUs  01m58.0s/10m0s  053147/100000 iters, 200 per VU

running (01m59.0s), 500/500 VUs, 53683 complete and 0 interrupted iterations
fixed_iterations   [  54% ] 500 VUs  01m59.0s/10m0s  053683/100000 iters, 200 per VU

running (02m00.0s), 500/500 VUs, 54067 complete and 0 interrupted iterations
fixed_iterations   [  54% ] 500 VUs  02m00.0s/10m0s  054067/100000 iters, 200 per VU

running (02m01.0s), 500/500 VUs, 54837 complete and 0 interrupted iterations
fixed_iterations   [  55% ] 500 VUs  02m01.0s/10m0s  054837/100000 iters, 200 per VU

running (02m02.0s), 500/500 VUs, 55520 complete and 0 interrupted iterations
fixed_iterations   [  56% ] 500 VUs  02m02.0s/10m0s  055520/100000 iters, 200 per VU

running (02m03.0s), 500/500 VUs, 55915 complete and 0 interrupted iterations
fixed_iterations   [  56% ] 500 VUs  02m03.0s/10m0s  055915/100000 iters, 200 per VU

running (02m04.0s), 500/500 VUs, 56308 complete and 0 interrupted iterations
fixed_iterations   [  56% ] 500 VUs  02m04.0s/10m0s  056308/100000 iters, 200 per VU

running (02m05.0s), 500/500 VUs, 56706 complete and 0 interrupted iterations
fixed_iterations   [  57% ] 500 VUs  02m05.0s/10m0s  056706/100000 iters, 200 per VU

running (02m06.0s), 500/500 VUs, 57129 complete and 0 interrupted iterations
fixed_iterations   [  57% ] 500 VUs  02m06.0s/10m0s  057129/100000 iters, 200 per VU

running (02m07.0s), 500/500 VUs, 57765 complete and 0 interrupted iterations
fixed_iterations   [  58% ] 500 VUs  02m07.0s/10m0s  057765/100000 iters, 200 per VU

running (02m08.0s), 500/500 VUs, 58155 complete and 0 interrupted iterations
fixed_iterations   [  58% ] 500 VUs  02m08.0s/10m0s  058155/100000 iters, 200 per VU

running (02m09.0s), 500/500 VUs, 58546 complete and 0 interrupted iterations
fixed_iterations   [  59% ] 500 VUs  02m09.0s/10m0s  058546/100000 iters, 200 per VU

running (02m10.0s), 500/500 VUs, 58924 complete and 0 interrupted iterations
fixed_iterations   [  59% ] 500 VUs  02m10.0s/10m0s  058924/100000 iters, 200 per VU

running (02m11.0s), 500/500 VUs, 59331 complete and 0 interrupted iterations
fixed_iterations   [  59% ] 500 VUs  02m11.0s/10m0s  059331/100000 iters, 200 per VU

running (02m12.0s), 500/500 VUs, 59948 complete and 0 interrupted iterations
fixed_iterations   [  60% ] 500 VUs  02m12.0s/10m0s  059948/100000 iters, 200 per VU

running (02m13.0s), 500/500 VUs, 60348 complete and 0 interrupted iterations
fixed_iterations   [  60% ] 500 VUs  02m13.0s/10m0s  060348/100000 iters, 200 per VU

running (02m14.0s), 500/500 VUs, 60741 complete and 0 interrupted iterations
fixed_iterations   [  61% ] 500 VUs  02m14.0s/10m0s  060741/100000 iters, 200 per VU

running (02m15.0s), 500/500 VUs, 61134 complete and 0 interrupted iterations
fixed_iterations   [  61% ] 500 VUs  02m15.0s/10m0s  061134/100000 iters, 200 per VU

running (02m16.0s), 500/500 VUs, 61685 complete and 0 interrupted iterations
fixed_iterations   [  62% ] 500 VUs  02m16.0s/10m0s  061685/100000 iters, 200 per VU

running (02m17.0s), 500/500 VUs, 62244 complete and 0 interrupted iterations
fixed_iterations   [  62% ] 500 VUs  02m17.0s/10m0s  062244/100000 iters, 200 per VU

running (02m18.0s), 500/500 VUs, 62632 complete and 0 interrupted iterations
fixed_iterations   [  63% ] 500 VUs  02m18.0s/10m0s  062632/100000 iters, 200 per VU

running (02m19.0s), 500/500 VUs, 63033 complete and 0 interrupted iterations
fixed_iterations   [  63% ] 500 VUs  02m19.0s/10m0s  063033/100000 iters, 200 per VU

running (02m20.0s), 500/500 VUs, 63433 complete and 0 interrupted iterations
fixed_iterations   [  63% ] 500 VUs  02m20.0s/10m0s  063433/100000 iters, 200 per VU

running (02m21.0s), 500/500 VUs, 63839 complete and 0 interrupted iterations
fixed_iterations   [  64% ] 500 VUs  02m21.0s/10m0s  063839/100000 iters, 200 per VU

running (02m22.0s), 500/500 VUs, 64454 complete and 0 interrupted iterations
fixed_iterations   [  64% ] 500 VUs  02m22.0s/10m0s  064454/100000 iters, 200 per VU

running (02m23.0s), 500/500 VUs, 64854 complete and 0 interrupted iterations
fixed_iterations   [  65% ] 500 VUs  02m23.0s/10m0s  064854/100000 iters, 200 per VU

running (02m24.0s), 500/500 VUs, 65245 complete and 0 interrupted iterations
fixed_iterations   [  65% ] 500 VUs  02m24.0s/10m0s  065245/100000 iters, 200 per VU

running (02m25.0s), 500/500 VUs, 65647 complete and 0 interrupted iterations
fixed_iterations   [  66% ] 500 VUs  02m25.0s/10m0s  065647/100000 iters, 200 per VU

running (02m26.0s), 500/500 VUs, 66054 complete and 0 interrupted iterations
fixed_iterations   [  66% ] 500 VUs  02m26.0s/10m0s  066054/100000 iters, 200 per VU

running (02m27.0s), 500/500 VUs, 66686 complete and 0 interrupted iterations
fixed_iterations   [  67% ] 500 VUs  02m27.0s/10m0s  066686/100000 iters, 200 per VU

running (02m28.0s), 500/500 VUs, 67081 complete and 0 interrupted iterations
fixed_iterations   [  67% ] 500 VUs  02m28.0s/10m0s  067081/100000 iters, 200 per VU

running (02m29.0s), 500/500 VUs, 67485 complete and 0 interrupted iterations
fixed_iterations   [  67% ] 500 VUs  02m29.0s/10m0s  067485/100000 iters, 200 per VU

running (02m30.0s), 500/500 VUs, 67890 complete and 0 interrupted iterations
fixed_iterations   [  68% ] 500 VUs  02m30.0s/10m0s  067890/100000 iters, 200 per VU

running (02m30.2s), 500/500 VUs, 68004 complete and 0 interrupted iterations
fixed_iterations   [  68% ] 500 VUs  02m30.2s/10m0s  068004/100000 iters, 200 per VU

running (02m31.0s), 500/500 VUs, 68809 complete and 0 interrupted iterations
fixed_iterations   [  69% ] 500 VUs  02m31.0s/10m0s  068809/100000 iters, 200 per VU

running (02m32.0s), 500/500 VUs, 69462 complete and 0 interrupted iterations
fixed_iterations   [  69% ] 500 VUs  02m32.0s/10m0s  069462/100000 iters, 200 per VU

running (02m33.0s), 500/500 VUs, 70050 complete and 0 interrupted iterations
fixed_iterations   [  70% ] 500 VUs  02m33.0s/10m0s  070050/100000 iters, 200 per VU

running (02m34.0s), 500/500 VUs, 70434 complete and 0 interrupted iterations
fixed_iterations   [  70% ] 500 VUs  02m34.0s/10m0s  070434/100000 iters, 200 per VU

running (02m35.0s), 500/500 VUs, 70820 complete and 0 interrupted iterations
fixed_iterations   [  71% ] 500 VUs  02m35.0s/10m0s  070820/100000 iters, 200 per VU

running (02m36.0s), 500/500 VUs, 71199 complete and 0 interrupted iterations
fixed_iterations   [  71% ] 500 VUs  02m36.0s/10m0s  071199/100000 iters, 200 per VU

running (02m37.0s), 500/500 VUs, 71886 complete and 0 interrupted iterations
fixed_iterations   [  72% ] 500 VUs  02m37.0s/10m0s  071886/100000 iters, 200 per VU

running (02m38.0s), 500/500 VUs, 72302 complete and 0 interrupted iterations
fixed_iterations   [  72% ] 500 VUs  02m38.0s/10m0s  072302/100000 iters, 200 per VU

running (02m39.0s), 500/500 VUs, 72734 complete and 0 interrupted iterations
fixed_iterations   [  73% ] 500 VUs  02m39.0s/10m0s  072734/100000 iters, 200 per VU

running (02m40.0s), 500/500 VUs, 73382 complete and 0 interrupted iterations
fixed_iterations   [  73% ] 500 VUs  02m40.0s/10m0s  073382/100000 iters, 200 per VU

running (02m41.0s), 500/500 VUs, 73782 complete and 0 interrupted iterations
fixed_iterations   [  74% ] 500 VUs  02m41.0s/10m0s  073782/100000 iters, 200 per VU

running (02m41.2s), 500/500 VUs, 73859 complete and 0 interrupted iterations
fixed_iterations   [  74% ] 500 VUs  02m41.2s/10m0s  073859/100000 iters, 200 per VU

running (02m42.0s), 500/500 VUs, 74453 complete and 0 interrupted iterations
fixed_iterations   [  74% ] 500 VUs  02m42.0s/10m0s  074453/100000 iters, 200 per VU

running (02m43.0s), 500/500 VUs, 74875 complete and 0 interrupted iterations
fixed_iterations   [  75% ] 500 VUs  02m43.0s/10m0s  074875/100000 iters, 200 per VU

running (02m44.0s), 500/500 VUs, 75288 complete and 0 interrupted iterations
fixed_iterations   [  75% ] 500 VUs  02m44.0s/10m0s  075288/100000 iters, 200 per VU

running (02m45.0s), 500/500 VUs, 75694 complete and 0 interrupted iterations
fixed_iterations   [  76% ] 500 VUs  02m45.0s/10m0s  075694/100000 iters, 200 per VU

running (02m46.0s), 500/500 VUs, 76093 complete and 0 interrupted iterations
fixed_iterations   [  76% ] 500 VUs  02m46.0s/10m0s  076093/100000 iters, 200 per VU

running (02m47.0s), 500/500 VUs, 76720 complete and 0 interrupted iterations
fixed_iterations   [  77% ] 500 VUs  02m47.0s/10m0s  076720/100000 iters, 200 per VU

running (02m48.0s), 500/500 VUs, 77126 complete and 0 interrupted iterations
fixed_iterations   [  77% ] 500 VUs  02m48.0s/10m0s  077126/100000 iters, 200 per VU

running (02m49.0s), 500/500 VUs, 77587 complete and 0 interrupted iterations
fixed_iterations   [  78% ] 500 VUs  02m49.0s/10m0s  077587/100000 iters, 200 per VU

running (02m50.0s), 500/500 VUs, 78148 complete and 0 interrupted iterations
fixed_iterations   [  78% ] 500 VUs  02m50.0s/10m0s  078148/100000 iters, 200 per VU

running (02m51.0s), 500/500 VUs, 78589 complete and 0 interrupted iterations
fixed_iterations   [  79% ] 500 VUs  02m51.0s/10m0s  078589/100000 iters, 200 per VU

running (02m52.0s), 500/500 VUs, 79179 complete and 0 interrupted iterations
fixed_iterations   [  79% ] 500 VUs  02m52.0s/10m0s  079179/100000 iters, 200 per VU

running (02m53.0s), 500/500 VUs, 79582 complete and 0 interrupted iterations
fixed_iterations   [  80% ] 500 VUs  02m53.0s/10m0s  079582/100000 iters, 200 per VU

running (02m54.0s), 500/500 VUs, 79983 complete and 0 interrupted iterations
fixed_iterations   [  80% ] 500 VUs  02m54.0s/10m0s  079983/100000 iters, 200 per VU

running (02m55.0s), 500/500 VUs, 80397 complete and 0 interrupted iterations
fixed_iterations   [  80% ] 500 VUs  02m55.0s/10m0s  080397/100000 iters, 200 per VU

running (02m56.0s), 500/500 VUs, 80824 complete and 0 interrupted iterations
fixed_iterations   [  81% ] 500 VUs  02m56.0s/10m0s  080824/100000 iters, 200 per VU

running (02m57.0s), 500/500 VUs, 81439 complete and 0 interrupted iterations
fixed_iterations   [  81% ] 500 VUs  02m57.0s/10m0s  081439/100000 iters, 200 per VU

running (02m58.0s), 500/500 VUs, 81833 complete and 0 interrupted iterations
fixed_iterations   [  82% ] 500 VUs  02m58.0s/10m0s  081833/100000 iters, 200 per VU

running (02m59.0s), 500/500 VUs, 82239 complete and 0 interrupted iterations
fixed_iterations   [  82% ] 500 VUs  02m59.0s/10m0s  082239/100000 iters, 200 per VU

running (03m00.0s), 500/500 VUs, 82642 complete and 0 interrupted iterations
fixed_iterations   [  83% ] 500 VUs  03m00.0s/10m0s  082642/100000 iters, 200 per VU

running (03m01.0s), 500/500 VUs, 83142 complete and 0 interrupted iterations
fixed_iterations   [  83% ] 500 VUs  03m01.0s/10m0s  083142/100000 iters, 200 per VU

running (03m02.0s), 500/500 VUs, 83773 complete and 0 interrupted iterations
fixed_iterations   [  84% ] 500 VUs  03m02.0s/10m0s  083773/100000 iters, 200 per VU

running (03m03.0s), 500/500 VUs, 84207 complete and 0 interrupted iterations
fixed_iterations   [  84% ] 500 VUs  03m03.0s/10m0s  084207/100000 iters, 200 per VU

running (03m04.0s), 500/500 VUs, 84614 complete and 0 interrupted iterations
fixed_iterations   [  85% ] 500 VUs  03m04.0s/10m0s  084614/100000 iters, 200 per VU

running (03m05.0s), 500/500 VUs, 85011 complete and 0 interrupted iterations
fixed_iterations   [  85% ] 500 VUs  03m05.0s/10m0s  085011/100000 iters, 200 per VU

running (03m06.0s), 500/500 VUs, 85492 complete and 0 interrupted iterations
fixed_iterations   [  85% ] 500 VUs  03m06.0s/10m0s  085492/100000 iters, 200 per VU

running (03m07.0s), 500/500 VUs, 86262 complete and 0 interrupted iterations
fixed_iterations   [  86% ] 500 VUs  03m07.0s/10m0s  086262/100000 iters, 200 per VU

running (03m08.0s), 500/500 VUs, 86673 complete and 0 interrupted iterations
fixed_iterations   [  87% ] 500 VUs  03m08.0s/10m0s  086673/100000 iters, 200 per VU

running (03m09.0s), 500/500 VUs, 87078 complete and 0 interrupted iterations
fixed_iterations   [  87% ] 500 VUs  03m09.0s/10m0s  087078/100000 iters, 200 per VU

running (03m10.0s), 500/500 VUs, 87480 complete and 0 interrupted iterations
fixed_iterations   [  87% ] 500 VUs  03m10.0s/10m0s  087480/100000 iters, 200 per VU

running (03m11.0s), 500/500 VUs, 87908 complete and 0 interrupted iterations
fixed_iterations   [  88% ] 500 VUs  03m11.0s/10m0s  087908/100000 iters, 200 per VU

running (03m12.0s), 500/500 VUs, 88487 complete and 0 interrupted iterations
fixed_iterations   [  88% ] 500 VUs  03m12.0s/10m0s  088487/100000 iters, 200 per VU

running (03m13.0s), 500/500 VUs, 88898 complete and 0 interrupted iterations
fixed_iterations   [  89% ] 500 VUs  03m13.0s/10m0s  088898/100000 iters, 200 per VU

running (03m14.0s), 500/500 VUs, 89310 complete and 0 interrupted iterations
fixed_iterations   [  89% ] 500 VUs  03m14.0s/10m0s  089310/100000 iters, 200 per VU

running (03m15.0s), 500/500 VUs, 89713 complete and 0 interrupted iterations
fixed_iterations   [  90% ] 500 VUs  03m15.0s/10m0s  089713/100000 iters, 200 per VU

running (03m16.0s), 500/500 VUs, 90192 complete and 0 interrupted iterations
fixed_iterations   [  90% ] 500 VUs  03m16.0s/10m0s  090192/100000 iters, 200 per VU

running (03m17.0s), 500/500 VUs, 90860 complete and 0 interrupted iterations
fixed_iterations   [  91% ] 500 VUs  03m17.0s/10m0s  090860/100000 iters, 200 per VU

running (03m18.0s), 500/500 VUs, 91257 complete and 0 interrupted iterations
fixed_iterations   [  91% ] 500 VUs  03m18.0s/10m0s  091257/100000 iters, 200 per VU

running (03m19.0s), 500/500 VUs, 91665 complete and 0 interrupted iterations
fixed_iterations   [  92% ] 500 VUs  03m19.0s/10m0s  091665/100000 iters, 200 per VU

running (03m20.0s), 500/500 VUs, 92089 complete and 0 interrupted iterations
fixed_iterations   [  92% ] 500 VUs  03m20.0s/10m0s  092089/100000 iters, 200 per VU

running (03m21.0s), 500/500 VUs, 92555 complete and 0 interrupted iterations
fixed_iterations   [  93% ] 500 VUs  03m21.0s/10m0s  092555/100000 iters, 200 per VU

running (03m22.0s), 500/500 VUs, 93251 complete and 0 interrupted iterations
fixed_iterations   [  93% ] 500 VUs  03m22.0s/10m0s  093251/100000 iters, 200 per VU

running (03m23.0s), 500/500 VUs, 93666 complete and 0 interrupted iterations
fixed_iterations   [  94% ] 500 VUs  03m23.0s/10m0s  093666/100000 iters, 200 per VU

running (03m24.0s), 500/500 VUs, 94356 complete and 0 interrupted iterations
fixed_iterations   [  94% ] 500 VUs  03m24.0s/10m0s  094356/100000 iters, 200 per VU

running (03m25.0s), 500/500 VUs, 94812 complete and 0 interrupted iterations
fixed_iterations   [  95% ] 500 VUs  03m25.0s/10m0s  094812/100000 iters, 200 per VU

running (03m26.0s), 500/500 VUs, 95243 complete and 0 interrupted iterations
fixed_iterations   [  95% ] 500 VUs  03m26.0s/10m0s  095243/100000 iters, 200 per VU

running (03m27.0s), 500/500 VUs, 95850 complete and 0 interrupted iterations
fixed_iterations   [  96% ] 500 VUs  03m27.0s/10m0s  095850/100000 iters, 200 per VU

running (03m28.0s), 500/500 VUs, 96334 complete and 0 interrupted iterations
fixed_iterations   [  96% ] 500 VUs  03m28.0s/10m0s  096334/100000 iters, 200 per VU

running (03m29.0s), 500/500 VUs, 96817 complete and 0 interrupted iterations
fixed_iterations   [  97% ] 500 VUs  03m29.0s/10m0s  096817/100000 iters, 200 per VU

running (03m30.0s), 500/500 VUs, 97230 complete and 0 interrupted iterations
fixed_iterations   [  97% ] 500 VUs  03m30.0s/10m0s  097230/100000 iters, 200 per VU

running (03m31.0s), 500/500 VUs, 97667 complete and 0 interrupted iterations
fixed_iterations   [  98% ] 500 VUs  03m31.0s/10m0s  097667/100000 iters, 200 per VU

running (03m32.0s), 500/500 VUs, 98338 complete and 0 interrupted iterations
fixed_iterations   [  98% ] 500 VUs  03m32.0s/10m0s  098338/100000 iters, 200 per VU

running (03m33.0s), 499/500 VUs, 98755 complete and 0 interrupted iterations
fixed_iterations   [  99% ] 500 VUs  03m33.0s/10m0s  098755/100000 iters, 200 per VU

running (03m34.0s), 479/500 VUs, 99161 complete and 0 interrupted iterations
fixed_iterations   [  99% ] 500 VUs  03m34.0s/10m0s  099161/100000 iters, 200 per VU

running (03m35.0s), 353/500 VUs, 99598 complete and 0 interrupted iterations
fixed_iterations   [ 100% ] 500 VUs  03m35.0s/10m0s  099598/100000 iters, 200 per VU

running (03m35.9s), 000/500 VUs, 100000 complete and 0 interrupted iterations
fixed_iterations ✓ [ 100% ] 500 VUs  03m35.9s/10m0s  100000/100000 iters, 200 per VU


  █ TOTAL RESULTS 

    checks_total.......: 100000  463.161634/s
    checks_succeeded...: 100.00% 100000 out of 100000
    checks_failed......: 0.00%   0 out of 100000

    ✓ status is 200

    HTTP
    http_req_duration..............: avg=1.07s min=21.61ms med=1.18s max=1.47s p(90)=1.3s p(95)=1.31s
      { expected_response:true }...: avg=1.07s min=21.61ms med=1.18s max=1.47s p(90)=1.3s p(95)=1.31s
    http_req_failed................: 0.00%  0 out of 100000
    http_reqs......................: 100000 463.161634/s

    EXECUTION
    iteration_duration.............: avg=1.07s min=47.12ms med=1.18s max=1.47s p(90)=1.3s p(95)=1.31s
    iterations.....................: 100000 463.161634/s
    vus............................: 353    min=353         max=500
    vus_max........................: 500    min=500         max=500

    NETWORK
    data_received..................: 22 MB  100 kB/s
    data_sent......................: 14 MB  63 kB/s




running (03m35.9s), 000/500 VUs, 100000 complete and 0 interrupted iterations
fixed_iterations ✓ [ 100% ] 500 VUs  03m35.9s/10m0s  100000/100000 iters, 200 per VU
