
         /\      Grafana   /‾‾/  
    /\  /  \     |\  __   /  /   
   /  \/    \    | |/ /  /   ‾‾\ 
  /          \   |   (  |  (‾)  |
 / __________ \  |_|\_\  \_____/ 

     execution: local
        script: ./script.js
        output: -

     scenarios: (100.00%) 1 scenario, 500 max VUs, 10m30s max duration (incl. graceful stop):
              * fixed_iterations: 200 iterations for each of 500 VUs (maxDuration: 10m0s, gracefulStop: 30s)


running (00m00.9s), 500/500 VUs, 415 complete and 0 interrupted iterations
fixed_iterations   [   0% ] 500 VUs  00m00.9s/10m0s  000415/100000 iters, 200 per VU

running (00m01.9s), 500/500 VUs, 796 complete and 0 interrupted iterations
fixed_iterations   [   1% ] 500 VUs  00m01.9s/10m0s  000796/100000 iters, 200 per VU

running (00m02.9s), 500/500 VUs, 1186 complete and 0 interrupted iterations
fixed_iterations   [   1% ] 500 VUs  00m02.9s/10m0s  001186/100000 iters, 200 per VU

running (00m03.9s), 500/500 VUs, 1578 complete and 0 interrupted iterations
fixed_iterations   [   2% ] 500 VUs  00m03.9s/10m0s  001578/100000 iters, 200 per VU

running (00m04.9s), 500/500 VUs, 2077 complete and 0 interrupted iterations
fixed_iterations   [   2% ] 500 VUs  00m04.9s/10m0s  002077/100000 iters, 200 per VU

running (00m05.9s), 500/500 VUs, 2451 complete and 0 interrupted iterations
fixed_iterations   [   2% ] 500 VUs  00m05.9s/10m0s  002451/100000 iters, 200 per VU

running (00m06.9s), 500/500 VUs, 2825 complete and 0 interrupted iterations
fixed_iterations   [   3% ] 500 VUs  00m06.9s/10m0s  002825/100000 iters, 200 per VU

running (00m07.9s), 500/500 VUs, 3194 complete and 0 interrupted iterations
fixed_iterations   [   3% ] 500 VUs  00m07.9s/10m0s  003194/100000 iters, 200 per VU

running (00m08.9s), 500/500 VUs, 3587 complete and 0 interrupted iterations
fixed_iterations   [   4% ] 500 VUs  00m08.9s/10m0s  003587/100000 iters, 200 per VU

running (00m09.9s), 500/500 VUs, 4106 complete and 0 interrupted iterations
fixed_iterations   [   4% ] 500 VUs  00m09.9s/10m0s  004106/100000 iters, 200 per VU

running (00m10.9s), 500/500 VUs, 4491 complete and 0 interrupted iterations
fixed_iterations   [   4% ] 500 VUs  00m10.9s/10m0s  004491/100000 iters, 200 per VU

running (00m11.9s), 500/500 VUs, 4873 complete and 0 interrupted iterations
fixed_iterations   [   5% ] 500 VUs  00m11.9s/10m0s  004873/100000 iters, 200 per VU

running (00m12.9s), 500/500 VUs, 5244 complete and 0 interrupted iterations
fixed_iterations   [   5% ] 500 VUs  00m12.9s/10m0s  005244/100000 iters, 200 per VU

running (00m13.9s), 500/500 VUs, 5610 complete and 0 interrupted iterations
fixed_iterations   [   6% ] 500 VUs  00m13.9s/10m0s  005610/100000 iters, 200 per VU

running (00m14.9s), 500/500 VUs, 6166 complete and 0 interrupted iterations
fixed_iterations   [   6% ] 500 VUs  00m14.9s/10m0s  006166/100000 iters, 200 per VU

running (00m15.9s), 500/500 VUs, 6547 complete and 0 interrupted iterations
fixed_iterations   [   7% ] 500 VUs  00m15.9s/10m0s  006547/100000 iters, 200 per VU

running (00m16.9s), 500/500 VUs, 6917 complete and 0 interrupted iterations
fixed_iterations   [   7% ] 500 VUs  00m16.9s/10m0s  006917/100000 iters, 200 per VU

running (00m17.9s), 500/500 VUs, 7280 complete and 0 interrupted iterations
fixed_iterations   [   7% ] 500 VUs  00m17.9s/10m0s  007280/100000 iters, 200 per VU

running (00m18.9s), 500/500 VUs, 7749 complete and 0 interrupted iterations
fixed_iterations   [   8% ] 500 VUs  00m18.9s/10m0s  007749/100000 iters, 200 per VU

running (00m19.9s), 500/500 VUs, 8284 complete and 0 interrupted iterations
fixed_iterations   [   8% ] 500 VUs  00m19.9s/10m0s  008284/100000 iters, 200 per VU

running (00m20.9s), 500/500 VUs, 8663 complete and 0 interrupted iterations
fixed_iterations   [   9% ] 500 VUs  00m20.9s/10m0s  008663/100000 iters, 200 per VU

running (00m21.9s), 500/500 VUs, 9037 complete and 0 interrupted iterations
fixed_iterations   [   9% ] 500 VUs  00m21.9s/10m0s  009037/100000 iters, 200 per VU

running (00m22.9s), 500/500 VUs, 9419 complete and 0 interrupted iterations
fixed_iterations   [   9% ] 500 VUs  00m22.9s/10m0s  009419/100000 iters, 200 per VU

running (00m23.9s), 500/500 VUs, 9792 complete and 0 interrupted iterations
fixed_iterations   [  10% ] 500 VUs  00m23.9s/10m0s  009792/100000 iters, 200 per VU

running (00m24.9s), 500/500 VUs, 10335 complete and 0 interrupted iterations
fixed_iterations   [  10% ] 500 VUs  00m24.9s/10m0s  010335/100000 iters, 200 per VU

running (00m25.9s), 500/500 VUs, 10711 complete and 0 interrupted iterations
fixed_iterations   [  11% ] 500 VUs  00m25.9s/10m0s  010711/100000 iters, 200 per VU

running (00m26.9s), 500/500 VUs, 11077 complete and 0 interrupted iterations
fixed_iterations   [  11% ] 500 VUs  00m26.9s/10m0s  011077/100000 iters, 200 per VU

running (00m27.9s), 500/500 VUs, 11526 complete and 0 interrupted iterations
fixed_iterations   [  12% ] 500 VUs  00m27.9s/10m0s  011526/100000 iters, 200 per VU

running (00m28.9s), 500/500 VUs, 11925 complete and 0 interrupted iterations
fixed_iterations   [  12% ] 500 VUs  00m28.9s/10m0s  011925/100000 iters, 200 per VU

running (00m29.9s), 500/500 VUs, 12432 complete and 0 interrupted iterations
fixed_iterations   [  12% ] 500 VUs  00m29.9s/10m0s  012432/100000 iters, 200 per VU

running (00m30.9s), 500/500 VUs, 12808 complete and 0 interrupted iterations
fixed_iterations   [  13% ] 500 VUs  00m30.9s/10m0s  012808/100000 iters, 200 per VU

running (00m31.9s), 500/500 VUs, 13175 complete and 0 interrupted iterations
fixed_iterations   [  13% ] 500 VUs  00m31.9s/10m0s  013175/100000 iters, 200 per VU

running (00m32.9s), 500/500 VUs, 13556 complete and 0 interrupted iterations
fixed_iterations   [  14% ] 500 VUs  00m32.9s/10m0s  013556/100000 iters, 200 per VU

running (00m33.9s), 500/500 VUs, 13982 complete and 0 interrupted iterations
fixed_iterations   [  14% ] 500 VUs  00m33.9s/10m0s  013982/100000 iters, 200 per VU

running (00m34.9s), 500/500 VUs, 14533 complete and 0 interrupted iterations
fixed_iterations   [  15% ] 500 VUs  00m34.9s/10m0s  014533/100000 iters, 200 per VU

running (00m35.9s), 500/500 VUs, 14910 complete and 0 interrupted iterations
fixed_iterations   [  15% ] 500 VUs  00m35.9s/10m0s  014910/100000 iters, 200 per VU

running (00m36.9s), 500/500 VUs, 15268 complete and 0 interrupted iterations
fixed_iterations   [  15% ] 500 VUs  00m36.9s/10m0s  015268/100000 iters, 200 per VU

running (00m37.9s), 500/500 VUs, 15646 complete and 0 interrupted iterations
fixed_iterations   [  16% ] 500 VUs  00m37.9s/10m0s  015646/100000 iters, 200 per VU

running (00m38.9s), 500/500 VUs, 16020 complete and 0 interrupted iterations
fixed_iterations   [  16% ] 500 VUs  00m38.9s/10m0s  016020/100000 iters, 200 per VU

running (00m39.9s), 500/500 VUs, 16588 complete and 0 interrupted iterations
fixed_iterations   [  17% ] 500 VUs  00m39.9s/10m0s  016588/100000 iters, 200 per VU

running (00m40.9s), 500/500 VUs, 16965 complete and 0 interrupted iterations
fixed_iterations   [  17% ] 500 VUs  00m40.9s/10m0s  016965/100000 iters, 200 per VU

running (00m41.9s), 500/500 VUs, 17346 complete and 0 interrupted iterations
fixed_iterations   [  17% ] 500 VUs  00m41.9s/10m0s  017346/100000 iters, 200 per VU

running (00m42.9s), 500/500 VUs, 17720 complete and 0 interrupted iterations
fixed_iterations   [  18% ] 500 VUs  00m42.9s/10m0s  017720/100000 iters, 200 per VU

running (00m43.9s), 500/500 VUs, 18100 complete and 0 interrupted iterations
fixed_iterations   [  18% ] 500 VUs  00m43.9s/10m0s  018100/100000 iters, 200 per VU

running (00m44.9s), 500/500 VUs, 18701 complete and 0 interrupted iterations
fixed_iterations   [  19% ] 500 VUs  00m44.9s/10m0s  018701/100000 iters, 200 per VU

running (00m45.9s), 500/500 VUs, 19081 complete and 0 interrupted iterations
fixed_iterations   [  19% ] 500 VUs  00m45.9s/10m0s  019081/100000 iters, 200 per VU

running (00m46.9s), 500/500 VUs, 19459 complete and 0 interrupted iterations
fixed_iterations   [  19% ] 500 VUs  00m46.9s/10m0s  019459/100000 iters, 200 per VU

running (00m47.9s), 500/500 VUs, 19833 complete and 0 interrupted iterations
fixed_iterations   [  20% ] 500 VUs  00m47.9s/10m0s  019833/100000 iters, 200 per VU

running (00m48.9s), 500/500 VUs, 20201 complete and 0 interrupted iterations
fixed_iterations   [  20% ] 500 VUs  00m48.9s/10m0s  020201/100000 iters, 200 per VU

running (00m49.9s), 500/500 VUs, 20735 complete and 0 interrupted iterations
fixed_iterations   [  21% ] 500 VUs  00m49.9s/10m0s  020735/100000 iters, 200 per VU

running (00m50.9s), 500/500 VUs, 21122 complete and 0 interrupted iterations
fixed_iterations   [  21% ] 500 VUs  00m50.9s/10m0s  021122/100000 iters, 200 per VU

running (00m51.9s), 500/500 VUs, 21871 complete and 0 interrupted iterations
fixed_iterations   [  22% ] 500 VUs  00m51.9s/10m0s  021871/100000 iters, 200 per VU

running (00m52.9s), 500/500 VUs, 22275 complete and 0 interrupted iterations
fixed_iterations   [  22% ] 500 VUs  00m52.9s/10m0s  022275/100000 iters, 200 per VU

running (00m53.9s), 500/500 VUs, 22890 complete and 0 interrupted iterations
fixed_iterations   [  23% ] 500 VUs  00m53.9s/10m0s  022890/100000 iters, 200 per VU

running (00m54.9s), 500/500 VUs, 23596 complete and 0 interrupted iterations
fixed_iterations   [  24% ] 500 VUs  00m54.9s/10m0s  023596/100000 iters, 200 per VU

running (00m55.9s), 500/500 VUs, 24183 complete and 0 interrupted iterations
fixed_iterations   [  24% ] 500 VUs  00m55.9s/10m0s  024183/100000 iters, 200 per VU

running (00m56.9s), 500/500 VUs, 24565 complete and 0 interrupted iterations
fixed_iterations   [  25% ] 500 VUs  00m56.9s/10m0s  024565/100000 iters, 200 per VU

running (00m57.9s), 500/500 VUs, 24948 complete and 0 interrupted iterations
fixed_iterations   [  25% ] 500 VUs  00m57.9s/10m0s  024948/100000 iters, 200 per VU

running (00m58.9s), 500/500 VUs, 25393 complete and 0 interrupted iterations
fixed_iterations   [  25% ] 500 VUs  00m58.9s/10m0s  025393/100000 iters, 200 per VU

running (00m59.9s), 500/500 VUs, 25891 complete and 0 interrupted iterations
fixed_iterations   [  26% ] 500 VUs  00m59.9s/10m0s  025891/100000 iters, 200 per VU

running (01m00.9s), 500/500 VUs, 26267 complete and 0 interrupted iterations
fixed_iterations   [  26% ] 500 VUs  01m00.9s/10m0s  026267/100000 iters, 200 per VU

running (01m01.9s), 500/500 VUs, 26645 complete and 0 interrupted iterations
fixed_iterations   [  27% ] 500 VUs  01m01.9s/10m0s  026645/100000 iters, 200 per VU

running (01m02.9s), 500/500 VUs, 27023 complete and 0 interrupted iterations
fixed_iterations   [  27% ] 500 VUs  01m02.9s/10m0s  027023/100000 iters, 200 per VU

running (01m03.9s), 500/500 VUs, 27401 complete and 0 interrupted iterations
fixed_iterations   [  27% ] 500 VUs  01m03.9s/10m0s  027401/100000 iters, 200 per VU

running (01m04.9s), 500/500 VUs, 27924 complete and 0 interrupted iterations
fixed_iterations   [  28% ] 500 VUs  01m04.9s/10m0s  027924/100000 iters, 200 per VU

running (01m05.9s), 500/500 VUs, 28299 complete and 0 interrupted iterations
fixed_iterations   [  28% ] 500 VUs  01m05.9s/10m0s  028299/100000 iters, 200 per VU

running (01m06.9s), 500/500 VUs, 28685 complete and 0 interrupted iterations
fixed_iterations   [  29% ] 500 VUs  01m06.9s/10m0s  028685/100000 iters, 200 per VU

running (01m07.9s), 500/500 VUs, 29047 complete and 0 interrupted iterations
fixed_iterations   [  29% ] 500 VUs  01m07.9s/10m0s  029047/100000 iters, 200 per VU

running (01m08.9s), 500/500 VUs, 29427 complete and 0 interrupted iterations
fixed_iterations   [  29% ] 500 VUs  01m08.9s/10m0s  029427/100000 iters, 200 per VU

running (01m09.9s), 500/500 VUs, 30035 complete and 0 interrupted iterations
fixed_iterations   [  30% ] 500 VUs  01m09.9s/10m0s  030035/100000 iters, 200 per VU

running (01m10.9s), 500/500 VUs, 30408 complete and 0 interrupted iterations
fixed_iterations   [  30% ] 500 VUs  01m10.9s/10m0s  030408/100000 iters, 200 per VU

running (01m11.9s), 500/500 VUs, 30775 complete and 0 interrupted iterations
fixed_iterations   [  31% ] 500 VUs  01m11.9s/10m0s  030775/100000 iters, 200 per VU

running (01m12.9s), 500/500 VUs, 31150 complete and 0 interrupted iterations
fixed_iterations   [  31% ] 500 VUs  01m12.9s/10m0s  031150/100000 iters, 200 per VU

running (01m13.9s), 500/500 VUs, 31534 complete and 0 interrupted iterations
fixed_iterations   [  32% ] 500 VUs  01m13.9s/10m0s  031534/100000 iters, 200 per VU

running (01m14.9s), 500/500 VUs, 32055 complete and 0 interrupted iterations
fixed_iterations   [  32% ] 500 VUs  01m14.9s/10m0s  032055/100000 iters, 200 per VU

running (01m15.9s), 500/500 VUs, 32431 complete and 0 interrupted iterations
fixed_iterations   [  32% ] 500 VUs  01m15.9s/10m0s  032431/100000 iters, 200 per VU

running (01m16.9s), 500/500 VUs, 32814 complete and 0 interrupted iterations
fixed_iterations   [  33% ] 500 VUs  01m16.9s/10m0s  032814/100000 iters, 200 per VU

running (01m17.9s), 500/500 VUs, 33184 complete and 0 interrupted iterations
fixed_iterations   [  33% ] 500 VUs  01m17.9s/10m0s  033184/100000 iters, 200 per VU

running (01m18.9s), 500/500 VUs, 33708 complete and 0 interrupted iterations
fixed_iterations   [  34% ] 500 VUs  01m18.9s/10m0s  033708/100000 iters, 200 per VU

running (01m19.9s), 500/500 VUs, 34450 complete and 0 interrupted iterations
fixed_iterations   [  34% ] 500 VUs  01m19.9s/10m0s  034450/100000 iters, 200 per VU

running (01m20.9s), 500/500 VUs, 34822 complete and 0 interrupted iterations
fixed_iterations   [  35% ] 500 VUs  01m20.9s/10m0s  034822/100000 iters, 200 per VU

running (01m21.9s), 500/500 VUs, 35192 complete and 0 interrupted iterations
fixed_iterations   [  35% ] 500 VUs  01m21.9s/10m0s  035192/100000 iters, 200 per VU

running (01m22.9s), 500/500 VUs, 35569 complete and 0 interrupted iterations
fixed_iterations   [  36% ] 500 VUs  01m22.9s/10m0s  035569/100000 iters, 200 per VU

running (01m23.9s), 500/500 VUs, 35943 complete and 0 interrupted iterations
fixed_iterations   [  36% ] 500 VUs  01m23.9s/10m0s  035943/100000 iters, 200 per VU

running (01m24.9s), 500/500 VUs, 36438 complete and 0 interrupted iterations
fixed_iterations   [  36% ] 500 VUs  01m24.9s/10m0s  036438/100000 iters, 200 per VU

running (01m25.9s), 500/500 VUs, 36813 complete and 0 interrupted iterations
fixed_iterations   [  37% ] 500 VUs  01m25.9s/10m0s  036813/100000 iters, 200 per VU

running (01m26.9s), 500/500 VUs, 37190 complete and 0 interrupted iterations
fixed_iterations   [  37% ] 500 VUs  01m26.9s/10m0s  037190/100000 iters, 200 per VU

running (01m27.9s), 500/500 VUs, 37572 complete and 0 interrupted iterations
fixed_iterations   [  38% ] 500 VUs  01m27.9s/10m0s  037572/100000 iters, 200 per VU

running (01m28.9s), 500/500 VUs, 38135 complete and 0 interrupted iterations
fixed_iterations   [  38% ] 500 VUs  01m28.9s/10m0s  038135/100000 iters, 200 per VU

running (01m29.9s), 500/500 VUs, 38626 complete and 0 interrupted iterations
fixed_iterations   [  39% ] 500 VUs  01m29.9s/10m0s  038626/100000 iters, 200 per VU

running (01m30.9s), 500/500 VUs, 39002 complete and 0 interrupted iterations
fixed_iterations   [  39% ] 500 VUs  01m30.9s/10m0s  039002/100000 iters, 200 per VU

running (01m31.9s), 500/500 VUs, 39389 complete and 0 interrupted iterations
fixed_iterations   [  39% ] 500 VUs  01m31.9s/10m0s  039389/100000 iters, 200 per VU

running (01m32.9s), 500/500 VUs, 39763 complete and 0 interrupted iterations
fixed_iterations   [  40% ] 500 VUs  01m32.9s/10m0s  039763/100000 iters, 200 per VU

running (01m33.9s), 500/500 VUs, 40147 complete and 0 interrupted iterations
fixed_iterations   [  40% ] 500 VUs  01m33.9s/10m0s  040147/100000 iters, 200 per VU

running (01m34.9s), 500/500 VUs, 40672 complete and 0 interrupted iterations
fixed_iterations   [  41% ] 500 VUs  01m34.9s/10m0s  040672/100000 iters, 200 per VU

running (01m35.9s), 500/500 VUs, 41039 complete and 0 interrupted iterations
fixed_iterations   [  41% ] 500 VUs  01m35.9s/10m0s  041039/100000 iters, 200 per VU

running (01m36.9s), 500/500 VUs, 41412 complete and 0 interrupted iterations
fixed_iterations   [  41% ] 500 VUs  01m36.9s/10m0s  041412/100000 iters, 200 per VU

running (01m37.9s), 500/500 VUs, 41796 complete and 0 interrupted iterations
fixed_iterations   [  42% ] 500 VUs  01m37.9s/10m0s  041796/100000 iters, 200 per VU

running (01m38.9s), 500/500 VUs, 42174 complete and 0 interrupted iterations
fixed_iterations   [  42% ] 500 VUs  01m38.9s/10m0s  042174/100000 iters, 200 per VU

running (01m39.9s), 500/500 VUs, 42717 complete and 0 interrupted iterations
fixed_iterations   [  43% ] 500 VUs  01m39.9s/10m0s  042717/100000 iters, 200 per VU

running (01m40.9s), 500/500 VUs, 43088 complete and 0 interrupted iterations
fixed_iterations   [  43% ] 500 VUs  01m40.9s/10m0s  043088/100000 iters, 200 per VU

running (01m41.9s), 500/500 VUs, 43463 complete and 0 interrupted iterations
fixed_iterations   [  43% ] 500 VUs  01m41.9s/10m0s  043463/100000 iters, 200 per VU

running (01m42.9s), 500/500 VUs, 43987 complete and 0 interrupted iterations
fixed_iterations   [  44% ] 500 VUs  01m42.9s/10m0s  043987/100000 iters, 200 per VU

running (01m43.9s), 500/500 VUs, 44377 complete and 0 interrupted iterations
fixed_iterations   [  44% ] 500 VUs  01m43.9s/10m0s  044377/100000 iters, 200 per VU

running (01m44.9s), 500/500 VUs, 44893 complete and 0 interrupted iterations
fixed_iterations   [  45% ] 500 VUs  01m44.9s/10m0s  044893/100000 iters, 200 per VU

running (01m45.9s), 500/500 VUs, 45276 complete and 0 interrupted iterations
fixed_iterations   [  45% ] 500 VUs  01m45.9s/10m0s  045276/100000 iters, 200 per VU

running (01m46.9s), 500/500 VUs, 45649 complete and 0 interrupted iterations
fixed_iterations   [  46% ] 500 VUs  01m46.9s/10m0s  045649/100000 iters, 200 per VU

running (01m47.9s), 500/500 VUs, 46022 complete and 0 interrupted iterations
fixed_iterations   [  46% ] 500 VUs  01m47.9s/10m0s  046022/100000 iters, 200 per VU

running (01m48.9s), 500/500 VUs, 46449 complete and 0 interrupted iterations
fixed_iterations   [  46% ] 500 VUs  01m48.9s/10m0s  046449/100000 iters, 200 per VU

running (01m49.9s), 500/500 VUs, 46958 complete and 0 interrupted iterations
fixed_iterations   [  47% ] 500 VUs  01m49.9s/10m0s  046958/100000 iters, 200 per VU

running (01m50.9s), 500/500 VUs, 47330 complete and 0 interrupted iterations
fixed_iterations   [  47% ] 500 VUs  01m50.9s/10m0s  047330/100000 iters, 200 per VU

running (01m51.9s), 500/500 VUs, 47703 complete and 0 interrupted iterations
fixed_iterations   [  48% ] 500 VUs  01m51.9s/10m0s  047703/100000 iters, 200 per VU

running (01m52.9s), 500/500 VUs, 48074 complete and 0 interrupted iterations
fixed_iterations   [  48% ] 500 VUs  01m52.9s/10m0s  048074/100000 iters, 200 per VU

running (01m53.9s), 500/500 VUs, 48455 complete and 0 interrupted iterations
fixed_iterations   [  48% ] 500 VUs  01m53.9s/10m0s  048455/100000 iters, 200 per VU

running (01m54.9s), 500/500 VUs, 48977 complete and 0 interrupted iterations
fixed_iterations   [  49% ] 500 VUs  01m54.9s/10m0s  048977/100000 iters, 200 per VU

running (01m55.9s), 500/500 VUs, 49351 complete and 0 interrupted iterations
fixed_iterations   [  49% ] 500 VUs  01m55.9s/10m0s  049351/100000 iters, 200 per VU

running (01m56.9s), 500/500 VUs, 49726 complete and 0 interrupted iterations
fixed_iterations   [  50% ] 500 VUs  01m56.9s/10m0s  049726/100000 iters, 200 per VU

running (01m57.9s), 500/500 VUs, 50106 complete and 0 interrupted iterations
fixed_iterations   [  50% ] 500 VUs  01m57.9s/10m0s  050106/100000 iters, 200 per VU

running (01m58.9s), 500/500 VUs, 50483 complete and 0 interrupted iterations
fixed_iterations   [  50% ] 500 VUs  01m58.9s/10m0s  050483/100000 iters, 200 per VU

running (01m59.9s), 500/500 VUs, 51013 complete and 0 interrupted iterations
fixed_iterations   [  51% ] 500 VUs  01m59.9s/10m0s  051013/100000 iters, 200 per VU

running (02m00.9s), 500/500 VUs, 51385 complete and 0 interrupted iterations
fixed_iterations   [  51% ] 500 VUs  02m00.9s/10m0s  051385/100000 iters, 200 per VU

running (02m01.9s), 500/500 VUs, 51746 complete and 0 interrupted iterations
fixed_iterations   [  52% ] 500 VUs  02m01.9s/10m0s  051746/100000 iters, 200 per VU

running (02m02.9s), 500/500 VUs, 52121 complete and 0 interrupted iterations
fixed_iterations   [  52% ] 500 VUs  02m02.9s/10m0s  052121/100000 iters, 200 per VU

running (02m03.9s), 500/500 VUs, 52485 complete and 0 interrupted iterations
fixed_iterations   [  52% ] 500 VUs  02m03.9s/10m0s  052485/100000 iters, 200 per VU

running (02m04.9s), 500/500 VUs, 53005 complete and 0 interrupted iterations
fixed_iterations   [  53% ] 500 VUs  02m04.9s/10m0s  053005/100000 iters, 200 per VU

running (02m05.9s), 500/500 VUs, 53376 complete and 0 interrupted iterations
fixed_iterations   [  53% ] 500 VUs  02m05.9s/10m0s  053376/100000 iters, 200 per VU

running (02m06.9s), 500/500 VUs, 53753 complete and 0 interrupted iterations
fixed_iterations   [  54% ] 500 VUs  02m06.9s/10m0s  053753/100000 iters, 200 per VU

running (02m07.9s), 500/500 VUs, 54117 complete and 0 interrupted iterations
fixed_iterations   [  54% ] 500 VUs  02m07.9s/10m0s  054117/100000 iters, 200 per VU

running (02m08.9s), 500/500 VUs, 54489 complete and 0 interrupted iterations
fixed_iterations   [  54% ] 500 VUs  02m08.9s/10m0s  054489/100000 iters, 200 per VU

running (02m09.9s), 500/500 VUs, 55006 complete and 0 interrupted iterations
fixed_iterations   [  55% ] 500 VUs  02m09.9s/10m0s  055006/100000 iters, 200 per VU

running (02m10.9s), 500/500 VUs, 55372 complete and 0 interrupted iterations
fixed_iterations   [  55% ] 500 VUs  02m10.9s/10m0s  055372/100000 iters, 200 per VU

running (02m11.9s), 500/500 VUs, 55755 complete and 0 interrupted iterations
fixed_iterations   [  56% ] 500 VUs  02m11.9s/10m0s  055755/100000 iters, 200 per VU

running (02m12.9s), 500/500 VUs, 56122 complete and 0 interrupted iterations
fixed_iterations   [  56% ] 500 VUs  02m12.9s/10m0s  056122/100000 iters, 200 per VU

running (02m13.9s), 500/500 VUs, 56499 complete and 0 interrupted iterations
fixed_iterations   [  56% ] 500 VUs  02m13.9s/10m0s  056499/100000 iters, 200 per VU

running (02m14.9s), 500/500 VUs, 57011 complete and 0 interrupted iterations
fixed_iterations   [  57% ] 500 VUs  02m14.9s/10m0s  057011/100000 iters, 200 per VU

running (02m15.9s), 500/500 VUs, 57381 complete and 0 interrupted iterations
fixed_iterations   [  57% ] 500 VUs  02m15.9s/10m0s  057381/100000 iters, 200 per VU

running (02m16.9s), 500/500 VUs, 57753 complete and 0 interrupted iterations
fixed_iterations   [  58% ] 500 VUs  02m16.9s/10m0s  057753/100000 iters, 200 per VU

running (02m17.9s), 500/500 VUs, 58130 complete and 0 interrupted iterations
fixed_iterations   [  58% ] 500 VUs  02m17.9s/10m0s  058130/100000 iters, 200 per VU

running (02m18.9s), 500/500 VUs, 58630 complete and 0 interrupted iterations
fixed_iterations   [  59% ] 500 VUs  02m18.9s/10m0s  058630/100000 iters, 200 per VU

running (02m19.9s), 500/500 VUs, 59179 complete and 0 interrupted iterations
fixed_iterations   [  59% ] 500 VUs  02m19.9s/10m0s  059179/100000 iters, 200 per VU

running (02m20.9s), 500/500 VUs, 59556 complete and 0 interrupted iterations
fixed_iterations   [  60% ] 500 VUs  02m20.9s/10m0s  059556/100000 iters, 200 per VU

running (02m21.9s), 500/500 VUs, 59918 complete and 0 interrupted iterations
fixed_iterations   [  60% ] 500 VUs  02m21.9s/10m0s  059918/100000 iters, 200 per VU

running (02m22.9s), 500/500 VUs, 60283 complete and 0 interrupted iterations
fixed_iterations   [  60% ] 500 VUs  02m22.9s/10m0s  060283/100000 iters, 200 per VU

running (02m23.9s), 500/500 VUs, 60658 complete and 0 interrupted iterations
fixed_iterations   [  61% ] 500 VUs  02m23.9s/10m0s  060658/100000 iters, 200 per VU

running (02m24.9s), 500/500 VUs, 61170 complete and 0 interrupted iterations
fixed_iterations   [  61% ] 500 VUs  02m24.9s/10m0s  061170/100000 iters, 200 per VU

running (02m25.9s), 500/500 VUs, 61547 complete and 0 interrupted iterations
fixed_iterations   [  62% ] 500 VUs  02m25.9s/10m0s  061547/100000 iters, 200 per VU

running (02m26.9s), 500/500 VUs, 61922 complete and 0 interrupted iterations
fixed_iterations   [  62% ] 500 VUs  02m26.9s/10m0s  061922/100000 iters, 200 per VU

running (02m27.9s), 500/500 VUs, 62306 complete and 0 interrupted iterations
fixed_iterations   [  62% ] 500 VUs  02m27.9s/10m0s  062306/100000 iters, 200 per VU

running (02m28.9s), 500/500 VUs, 62743 complete and 0 interrupted iterations
fixed_iterations   [  63% ] 500 VUs  02m28.9s/10m0s  062743/100000 iters, 200 per VU

running (02m29.9s), 500/500 VUs, 63263 complete and 0 interrupted iterations
fixed_iterations   [  63% ] 500 VUs  02m29.9s/10m0s  063263/100000 iters, 200 per VU

running (02m30.9s), 500/500 VUs, 63637 complete and 0 interrupted iterations
fixed_iterations   [  64% ] 500 VUs  02m30.9s/10m0s  063637/100000 iters, 200 per VU

running (02m31.9s), 500/500 VUs, 64023 complete and 0 interrupted iterations
fixed_iterations   [  64% ] 500 VUs  02m31.9s/10m0s  064023/100000 iters, 200 per VU

running (02m32.9s), 500/500 VUs, 64397 complete and 0 interrupted iterations
fixed_iterations   [  64% ] 500 VUs  02m32.9s/10m0s  064397/100000 iters, 200 per VU

running (02m33.9s), 500/500 VUs, 64765 complete and 0 interrupted iterations
fixed_iterations   [  65% ] 500 VUs  02m33.9s/10m0s  064765/100000 iters, 200 per VU

running (02m34.9s), 500/500 VUs, 65284 complete and 0 interrupted iterations
fixed_iterations   [  65% ] 500 VUs  02m34.9s/10m0s  065284/100000 iters, 200 per VU

running (02m35.9s), 500/500 VUs, 65652 complete and 0 interrupted iterations
fixed_iterations   [  66% ] 500 VUs  02m35.9s/10m0s  065652/100000 iters, 200 per VU

running (02m36.9s), 500/500 VUs, 66026 complete and 0 interrupted iterations
fixed_iterations   [  66% ] 500 VUs  02m36.9s/10m0s  066026/100000 iters, 200 per VU

running (02m37.9s), 500/500 VUs, 66395 complete and 0 interrupted iterations
fixed_iterations   [  66% ] 500 VUs  02m37.9s/10m0s  066395/100000 iters, 200 per VU

running (02m38.9s), 500/500 VUs, 66768 complete and 0 interrupted iterations
fixed_iterations   [  67% ] 500 VUs  02m38.9s/10m0s  066768/100000 iters, 200 per VU

running (02m39.9s), 500/500 VUs, 67427 complete and 0 interrupted iterations
fixed_iterations   [  67% ] 500 VUs  02m39.9s/10m0s  067427/100000 iters, 200 per VU

running (02m40.9s), 500/500 VUs, 67799 complete and 0 interrupted iterations
fixed_iterations   [  68% ] 500 VUs  02m40.9s/10m0s  067799/100000 iters, 200 per VU

running (02m41.9s), 500/500 VUs, 68175 complete and 0 interrupted iterations
fixed_iterations   [  68% ] 500 VUs  02m41.9s/10m0s  068175/100000 iters, 200 per VU

running (02m42.9s), 500/500 VUs, 68541 complete and 0 interrupted iterations
fixed_iterations   [  69% ] 500 VUs  02m42.9s/10m0s  068541/100000 iters, 200 per VU

running (02m43.9s), 500/500 VUs, 68908 complete and 0 interrupted iterations
fixed_iterations   [  69% ] 500 VUs  02m43.9s/10m0s  068908/100000 iters, 200 per VU

running (02m44.9s), 500/500 VUs, 69425 complete and 0 interrupted iterations
fixed_iterations   [  69% ] 500 VUs  02m44.9s/10m0s  069425/100000 iters, 200 per VU

running (02m45.9s), 500/500 VUs, 69794 complete and 0 interrupted iterations
fixed_iterations   [  70% ] 500 VUs  02m45.9s/10m0s  069794/100000 iters, 200 per VU

running (02m46.9s), 500/500 VUs, 70156 complete and 0 interrupted iterations
fixed_iterations   [  70% ] 500 VUs  02m46.9s/10m0s  070156/100000 iters, 200 per VU

running (02m47.9s), 500/500 VUs, 70526 complete and 0 interrupted iterations
fixed_iterations   [  71% ] 500 VUs  02m47.9s/10m0s  070526/100000 iters, 200 per VU

running (02m48.9s), 500/500 VUs, 70901 complete and 0 interrupted iterations
fixed_iterations   [  71% ] 500 VUs  02m48.9s/10m0s  070901/100000 iters, 200 per VU

running (02m49.9s), 500/500 VUs, 71420 complete and 0 interrupted iterations
fixed_iterations   [  71% ] 500 VUs  02m49.9s/10m0s  071420/100000 iters, 200 per VU

running (02m50.9s), 500/500 VUs, 71799 complete and 0 interrupted iterations
fixed_iterations   [  72% ] 500 VUs  02m50.9s/10m0s  071799/100000 iters, 200 per VU

running (02m51.9s), 500/500 VUs, 72178 complete and 0 interrupted iterations
fixed_iterations   [  72% ] 500 VUs  02m51.9s/10m0s  072178/100000 iters, 200 per VU

running (02m52.9s), 500/500 VUs, 72554 complete and 0 interrupted iterations
fixed_iterations   [  73% ] 500 VUs  02m52.9s/10m0s  072554/100000 iters, 200 per VU

running (02m53.9s), 500/500 VUs, 72931 complete and 0 interrupted iterations
fixed_iterations   [  73% ] 500 VUs  02m53.9s/10m0s  072931/100000 iters, 200 per VU

running (02m54.9s), 500/500 VUs, 73447 complete and 0 interrupted iterations
fixed_iterations   [  73% ] 500 VUs  02m54.9s/10m0s  073447/100000 iters, 200 per VU

running (02m55.9s), 500/500 VUs, 73818 complete and 0 interrupted iterations
fixed_iterations   [  74% ] 500 VUs  02m55.9s/10m0s  073818/100000 iters, 200 per VU

running (02m56.9s), 500/500 VUs, 74186 complete and 0 interrupted iterations
fixed_iterations   [  74% ] 500 VUs  02m56.9s/10m0s  074186/100000 iters, 200 per VU

running (02m57.9s), 500/500 VUs, 74554 complete and 0 interrupted iterations
fixed_iterations   [  75% ] 500 VUs  02m57.9s/10m0s  074554/100000 iters, 200 per VU

running (02m58.9s), 500/500 VUs, 74928 complete and 0 interrupted iterations
fixed_iterations   [  75% ] 500 VUs  02m58.9s/10m0s  074928/100000 iters, 200 per VU

running (02m59.9s), 500/500 VUs, 75472 complete and 0 interrupted iterations
fixed_iterations   [  75% ] 500 VUs  02m59.9s/10m0s  075472/100000 iters, 200 per VU

running (03m00.9s), 500/500 VUs, 75841 complete and 0 interrupted iterations
fixed_iterations   [  76% ] 500 VUs  03m00.9s/10m0s  075841/100000 iters, 200 per VU

running (03m01.9s), 500/500 VUs, 76220 complete and 0 interrupted iterations
fixed_iterations   [  76% ] 500 VUs  03m01.9s/10m0s  076220/100000 iters, 200 per VU

running (03m02.9s), 500/500 VUs, 76598 complete and 0 interrupted iterations
fixed_iterations   [  77% ] 500 VUs  03m02.9s/10m0s  076598/100000 iters, 200 per VU

running (03m03.9s), 500/500 VUs, 76971 complete and 0 interrupted iterations
fixed_iterations   [  77% ] 500 VUs  03m03.9s/10m0s  076971/100000 iters, 200 per VU

running (03m04.9s), 500/500 VUs, 77506 complete and 0 interrupted iterations
fixed_iterations   [  78% ] 500 VUs  03m04.9s/10m0s  077506/100000 iters, 200 per VU

running (03m05.9s), 500/500 VUs, 77883 complete and 0 interrupted iterations
fixed_iterations   [  78% ] 500 VUs  03m05.9s/10m0s  077883/100000 iters, 200 per VU

running (03m06.9s), 500/500 VUs, 78250 complete and 0 interrupted iterations
fixed_iterations   [  78% ] 500 VUs  03m06.9s/10m0s  078250/100000 iters, 200 per VU

running (03m07.9s), 500/500 VUs, 78625 complete and 0 interrupted iterations
fixed_iterations   [  79% ] 500 VUs  03m07.9s/10m0s  078625/100000 iters, 200 per VU

running (03m08.9s), 500/500 VUs, 78997 complete and 0 interrupted iterations
fixed_iterations   [  79% ] 500 VUs  03m08.9s/10m0s  078997/100000 iters, 200 per VU

running (03m09.9s), 500/500 VUs, 79512 complete and 0 interrupted iterations
fixed_iterations   [  80% ] 500 VUs  03m09.9s/10m0s  079512/100000 iters, 200 per VU

running (03m10.9s), 500/500 VUs, 79891 complete and 0 interrupted iterations
fixed_iterations   [  80% ] 500 VUs  03m10.9s/10m0s  079891/100000 iters, 200 per VU

running (03m11.9s), 500/500 VUs, 80259 complete and 0 interrupted iterations
fixed_iterations   [  80% ] 500 VUs  03m11.9s/10m0s  080259/100000 iters, 200 per VU

running (03m12.9s), 500/500 VUs, 80708 complete and 0 interrupted iterations
fixed_iterations   [  81% ] 500 VUs  03m12.9s/10m0s  080708/100000 iters, 200 per VU

running (03m13.9s), 500/500 VUs, 81098 complete and 0 interrupted iterations
fixed_iterations   [  81% ] 500 VUs  03m13.9s/10m0s  081098/100000 iters, 200 per VU

running (03m14.9s), 500/500 VUs, 81615 complete and 0 interrupted iterations
fixed_iterations   [  82% ] 500 VUs  03m14.9s/10m0s  081615/100000 iters, 200 per VU

running (03m15.9s), 500/500 VUs, 81991 complete and 0 interrupted iterations
fixed_iterations   [  82% ] 500 VUs  03m15.9s/10m0s  081991/100000 iters, 200 per VU

running (03m16.9s), 500/500 VUs, 82357 complete and 0 interrupted iterations
fixed_iterations   [  82% ] 500 VUs  03m16.9s/10m0s  082357/100000 iters, 200 per VU

running (03m17.9s), 500/500 VUs, 82737 complete and 0 interrupted iterations
fixed_iterations   [  83% ] 500 VUs  03m17.9s/10m0s  082737/100000 iters, 200 per VU

running (03m18.9s), 500/500 VUs, 83212 complete and 0 interrupted iterations
fixed_iterations   [  83% ] 500 VUs  03m18.9s/10m0s  083212/100000 iters, 200 per VU

running (03m19.9s), 500/500 VUs, 83813 complete and 0 interrupted iterations
fixed_iterations   [  84% ] 500 VUs  03m19.9s/10m0s  083813/100000 iters, 200 per VU

running (03m20.9s), 500/500 VUs, 84195 complete and 0 interrupted iterations
fixed_iterations   [  84% ] 500 VUs  03m20.9s/10m0s  084195/100000 iters, 200 per VU

running (03m21.9s), 500/500 VUs, 84572 complete and 0 interrupted iterations
fixed_iterations   [  85% ] 500 VUs  03m21.9s/10m0s  084572/100000 iters, 200 per VU

running (03m22.9s), 500/500 VUs, 84945 complete and 0 interrupted iterations
fixed_iterations   [  85% ] 500 VUs  03m22.9s/10m0s  084945/100000 iters, 200 per VU

running (03m23.9s), 500/500 VUs, 85322 complete and 0 interrupted iterations
fixed_iterations   [  85% ] 500 VUs  03m23.9s/10m0s  085322/100000 iters, 200 per VU

running (03m24.9s), 500/500 VUs, 85835 complete and 0 interrupted iterations
fixed_iterations   [  86% ] 500 VUs  03m24.9s/10m0s  085835/100000 iters, 200 per VU

running (03m25.9s), 500/500 VUs, 86428 complete and 0 interrupted iterations
fixed_iterations   [  86% ] 500 VUs  03m25.9s/10m0s  086428/100000 iters, 200 per VU

running (03m26.9s), 500/500 VUs, 87029 complete and 0 interrupted iterations
fixed_iterations   [  87% ] 500 VUs  03m26.9s/10m0s  087029/100000 iters, 200 per VU

running (03m27.9s), 500/500 VUs, 87406 complete and 0 interrupted iterations
fixed_iterations   [  87% ] 500 VUs  03m27.9s/10m0s  087406/100000 iters, 200 per VU

running (03m28.9s), 500/500 VUs, 87809 complete and 0 interrupted iterations
fixed_iterations   [  88% ] 500 VUs  03m28.9s/10m0s  087809/100000 iters, 200 per VU

running (03m29.9s), 500/500 VUs, 88334 complete and 0 interrupted iterations
fixed_iterations   [  88% ] 500 VUs  03m29.9s/10m0s  088334/100000 iters, 200 per VU

running (03m30.9s), 500/500 VUs, 88714 complete and 0 interrupted iterations
fixed_iterations   [  89% ] 500 VUs  03m30.9s/10m0s  088714/100000 iters, 200 per VU

running (03m31.9s), 500/500 VUs, 89089 complete and 0 interrupted iterations
fixed_iterations   [  89% ] 500 VUs  03m31.9s/10m0s  089089/100000 iters, 200 per VU

running (03m32.9s), 500/500 VUs, 89463 complete and 0 interrupted iterations
fixed_iterations   [  89% ] 500 VUs  03m32.9s/10m0s  089463/100000 iters, 200 per VU

running (03m33.9s), 500/500 VUs, 89846 complete and 0 interrupted iterations
fixed_iterations   [  90% ] 500 VUs  03m33.9s/10m0s  089846/100000 iters, 200 per VU

running (03m34.9s), 500/500 VUs, 90352 complete and 0 interrupted iterations
fixed_iterations   [  90% ] 500 VUs  03m34.9s/10m0s  090352/100000 iters, 200 per VU

running (03m35.9s), 500/500 VUs, 90713 complete and 0 interrupted iterations
fixed_iterations   [  91% ] 500 VUs  03m35.9s/10m0s  090713/100000 iters, 200 per VU

running (03m36.9s), 500/500 VUs, 91087 complete and 0 interrupted iterations
fixed_iterations   [  91% ] 500 VUs  03m36.9s/10m0s  091087/100000 iters, 200 per VU

running (03m37.9s), 500/500 VUs, 91535 complete and 0 interrupted iterations
fixed_iterations   [  92% ] 500 VUs  03m37.9s/10m0s  091535/100000 iters, 200 per VU

running (03m38.9s), 500/500 VUs, 91970 complete and 0 interrupted iterations
fixed_iterations   [  92% ] 500 VUs  03m38.9s/10m0s  091970/100000 iters, 200 per VU

running (03m39.9s), 500/500 VUs, 92506 complete and 0 interrupted iterations
fixed_iterations   [  93% ] 500 VUs  03m39.9s/10m0s  092506/100000 iters, 200 per VU

running (03m40.9s), 500/500 VUs, 92880 complete and 0 interrupted iterations
fixed_iterations   [  93% ] 500 VUs  03m40.9s/10m0s  092880/100000 iters, 200 per VU

running (03m41.9s), 500/500 VUs, 93253 complete and 0 interrupted iterations
fixed_iterations   [  93% ] 500 VUs  03m41.9s/10m0s  093253/100000 iters, 200 per VU

running (03m42.9s), 500/500 VUs, 93633 complete and 0 interrupted iterations
fixed_iterations   [  94% ] 500 VUs  03m42.9s/10m0s  093633/100000 iters, 200 per VU

running (03m43.9s), 500/500 VUs, 94003 complete and 0 interrupted iterations
fixed_iterations   [  94% ] 500 VUs  03m43.9s/10m0s  094003/100000 iters, 200 per VU

running (03m44.9s), 500/500 VUs, 94510 complete and 0 interrupted iterations
fixed_iterations   [  95% ] 500 VUs  03m44.9s/10m0s  094510/100000 iters, 200 per VU

running (03m45.9s), 500/500 VUs, 94886 complete and 0 interrupted iterations
fixed_iterations   [  95% ] 500 VUs  03m45.9s/10m0s  094886/100000 iters, 200 per VU

running (03m47.0s), 500/500 VUs, 95257 complete and 0 interrupted iterations
fixed_iterations   [  95% ] 500 VUs  03m47.0s/10m0s  095257/100000 iters, 200 per VU

running (03m47.9s), 500/500 VUs, 95624 complete and 0 interrupted iterations
fixed_iterations   [  96% ] 500 VUs  03m47.9s/10m0s  095624/100000 iters, 200 per VU

running (03m48.9s), 500/500 VUs, 96051 complete and 0 interrupted iterations
fixed_iterations   [  96% ] 500 VUs  03m48.9s/10m0s  096051/100000 iters, 200 per VU

running (03m49.9s), 500/500 VUs, 96548 complete and 0 interrupted iterations
fixed_iterations   [  97% ] 500 VUs  03m49.9s/10m0s  096548/100000 iters, 200 per VU

running (03m50.9s), 500/500 VUs, 96927 complete and 0 interrupted iterations
fixed_iterations   [  97% ] 500 VUs  03m50.9s/10m0s  096927/100000 iters, 200 per VU

running (03m51.9s), 500/500 VUs, 97300 complete and 0 interrupted iterations
fixed_iterations   [  97% ] 500 VUs  03m51.9s/10m0s  097300/100000 iters, 200 per VU

running (03m52.9s), 500/500 VUs, 97673 complete and 0 interrupted iterations
fixed_iterations   [  98% ] 500 VUs  03m52.9s/10m0s  097673/100000 iters, 200 per VU

running (03m53.9s), 500/500 VUs, 98062 complete and 0 interrupted iterations
fixed_iterations   [  98% ] 500 VUs  03m53.9s/10m0s  098062/100000 iters, 200 per VU

running (03m54.9s), 500/500 VUs, 98559 complete and 0 interrupted iterations
fixed_iterations   [  99% ] 500 VUs  03m54.9s/10m0s  098559/100000 iters, 200 per VU

running (03m55.9s), 500/500 VUs, 98933 complete and 0 interrupted iterations
fixed_iterations   [  99% ] 500 VUs  03m55.9s/10m0s  098933/100000 iters, 200 per VU

running (03m56.9s), 478/500 VUs, 99308 complete and 0 interrupted iterations
fixed_iterations   [  99% ] 500 VUs  03m56.9s/10m0s  099308/100000 iters, 200 per VU

running (03m57.9s), 293/500 VUs, 99699 complete and 0 interrupted iterations
fixed_iterations   [ 100% ] 500 VUs  03m57.9s/10m0s  099699/100000 iters, 200 per VU


  █ TOTAL RESULTS 

    checks_total.......: 100000  418.934417/s
    checks_succeeded...: 100.00% 100000 out of 100000
    checks_failed......: 0.00%   0 out of 100000

    ✓ status is 200

    HTTP
    http_req_duration..............: avg=1.18s min=23.81ms med=1.29s max=1.48s p(90)=1.38s p(95)=1.39s
      { expected_response:true }...: avg=1.18s min=23.81ms med=1.29s max=1.48s p(90)=1.38s p(95)=1.39s
    http_req_failed................: 0.00%  0 out of 100000
    http_reqs......................: 100000 418.934417/s

    EXECUTION
    iteration_duration.............: avg=1.18s min=40.61ms med=1.29s max=1.48s p(90)=1.38s p(95)=1.39s
    iterations.....................: 100000 418.934417/s
    vus............................: 293    min=293         max=500
    vus_max........................: 500    min=500         max=500

    NETWORK
    data_received..................: 22 MB  91 kB/s
    data_sent......................: 14 MB  57 kB/s




running (03m58.7s), 000/500 VUs, 100000 complete and 0 interrupted iterations
fixed_iterations ✓ [ 100% ] 500 VUs  03m58.7s/10m0s  100000/100000 iters, 200 per VU
