
         /\      Grafana   /‾‾/  
    /\  /  \     |\  __   /  /   
   /  \/    \    | |/ /  /   ‾‾\ 
  /          \   |   (  |  (‾)  |
 / __________ \  |_|\_\  \_____/ 

     execution: local
        script: ./script.js
        output: -

     scenarios: (100.00%) 1 scenario, 500 max VUs, 10m30s max duration (incl. graceful stop):
              * fixed_iterations: 200 iterations for each of 500 VUs (maxDuration: 10m0s, gracefulStop: 30s)


running (00m00.9s), 500/500 VUs, 626 complete and 0 interrupted iterations
fixed_iterations   [   1% ] 500 VUs  00m00.9s/10m0s  000626/100000 iters, 200 per VU

running (00m01.9s), 500/500 VUs, 992 complete and 0 interrupted iterations
fixed_iterations   [   1% ] 500 VUs  00m01.9s/10m0s  000992/100000 iters, 200 per VU

running (00m02.9s), 500/500 VUs, 1362 complete and 0 interrupted iterations
fixed_iterations   [   1% ] 500 VUs  00m02.9s/10m0s  001362/100000 iters, 200 per VU

running (00m03.9s), 500/500 VUs, 1728 complete and 0 interrupted iterations
fixed_iterations   [   2% ] 500 VUs  00m03.9s/10m0s  001728/100000 iters, 200 per VU

running (00m04.9s), 500/500 VUs, 2160 complete and 0 interrupted iterations
fixed_iterations   [   2% ] 500 VUs  00m04.9s/10m0s  002160/100000 iters, 200 per VU

running (00m05.9s), 500/500 VUs, 2537 complete and 0 interrupted iterations
fixed_iterations   [   3% ] 500 VUs  00m05.9s/10m0s  002537/100000 iters, 200 per VU

running (00m06.9s), 500/500 VUs, 2909 complete and 0 interrupted iterations
fixed_iterations   [   3% ] 500 VUs  00m06.9s/10m0s  002909/100000 iters, 200 per VU

running (00m07.9s), 500/500 VUs, 3281 complete and 0 interrupted iterations
fixed_iterations   [   3% ] 500 VUs  00m07.9s/10m0s  003281/100000 iters, 200 per VU

running (00m08.9s), 500/500 VUs, 3651 complete and 0 interrupted iterations
fixed_iterations   [   4% ] 500 VUs  00m08.9s/10m0s  003651/100000 iters, 200 per VU

running (00m09.9s), 500/500 VUs, 4016 complete and 0 interrupted iterations
fixed_iterations   [   4% ] 500 VUs  00m09.9s/10m0s  004016/100000 iters, 200 per VU

running (00m10.9s), 500/500 VUs, 4392 complete and 0 interrupted iterations
fixed_iterations   [   4% ] 500 VUs  00m10.9s/10m0s  004392/100000 iters, 200 per VU

running (00m11.9s), 500/500 VUs, 4757 complete and 0 interrupted iterations
fixed_iterations   [   5% ] 500 VUs  00m11.9s/10m0s  004757/100000 iters, 200 per VU

running (00m12.9s), 500/500 VUs, 5137 complete and 0 interrupted iterations
fixed_iterations   [   5% ] 500 VUs  00m12.9s/10m0s  005137/100000 iters, 200 per VU

running (00m13.9s), 500/500 VUs, 5510 complete and 0 interrupted iterations
fixed_iterations   [   6% ] 500 VUs  00m13.9s/10m0s  005510/100000 iters, 200 per VU

running (00m14.9s), 500/500 VUs, 5871 complete and 0 interrupted iterations
fixed_iterations   [   6% ] 500 VUs  00m14.9s/10m0s  005871/100000 iters, 200 per VU

running (00m15.9s), 500/500 VUs, 6229 complete and 0 interrupted iterations
fixed_iterations   [   6% ] 500 VUs  00m15.9s/10m0s  006229/100000 iters, 200 per VU

running (00m16.9s), 500/500 VUs, 6596 complete and 0 interrupted iterations
fixed_iterations   [   7% ] 500 VUs  00m16.9s/10m0s  006596/100000 iters, 200 per VU

running (00m17.9s), 500/500 VUs, 6980 complete and 0 interrupted iterations
fixed_iterations   [   7% ] 500 VUs  00m17.9s/10m0s  006980/100000 iters, 200 per VU

running (00m18.9s), 500/500 VUs, 7361 complete and 0 interrupted iterations
fixed_iterations   [   7% ] 500 VUs  00m18.9s/10m0s  007361/100000 iters, 200 per VU

running (00m19.9s), 500/500 VUs, 7732 complete and 0 interrupted iterations
fixed_iterations   [   8% ] 500 VUs  00m19.9s/10m0s  007732/100000 iters, 200 per VU

running (00m20.9s), 500/500 VUs, 8111 complete and 0 interrupted iterations
fixed_iterations   [   8% ] 500 VUs  00m20.9s/10m0s  008111/100000 iters, 200 per VU

running (00m21.9s), 500/500 VUs, 8474 complete and 0 interrupted iterations
fixed_iterations   [   8% ] 500 VUs  00m21.9s/10m0s  008474/100000 iters, 200 per VU

running (00m22.9s), 500/500 VUs, 8986 complete and 0 interrupted iterations
fixed_iterations   [   9% ] 500 VUs  00m22.9s/10m0s  008986/100000 iters, 200 per VU

running (00m23.9s), 500/500 VUs, 9356 complete and 0 interrupted iterations
fixed_iterations   [   9% ] 500 VUs  00m23.9s/10m0s  009356/100000 iters, 200 per VU

running (00m24.9s), 500/500 VUs, 9723 complete and 0 interrupted iterations
fixed_iterations   [  10% ] 500 VUs  00m24.9s/10m0s  009723/100000 iters, 200 per VU

running (00m25.9s), 500/500 VUs, 10088 complete and 0 interrupted iterations
fixed_iterations   [  10% ] 500 VUs  00m25.9s/10m0s  010088/100000 iters, 200 per VU

running (00m26.9s), 500/500 VUs, 10472 complete and 0 interrupted iterations
fixed_iterations   [  10% ] 500 VUs  00m26.9s/10m0s  010472/100000 iters, 200 per VU

running (00m27.9s), 500/500 VUs, 10840 complete and 0 interrupted iterations
fixed_iterations   [  11% ] 500 VUs  00m27.9s/10m0s  010840/100000 iters, 200 per VU

running (00m28.9s), 500/500 VUs, 11206 complete and 0 interrupted iterations
fixed_iterations   [  11% ] 500 VUs  00m28.9s/10m0s  011206/100000 iters, 200 per VU

running (00m29.9s), 500/500 VUs, 11587 complete and 0 interrupted iterations
fixed_iterations   [  12% ] 500 VUs  00m29.9s/10m0s  011587/100000 iters, 200 per VU

running (00m30.9s), 500/500 VUs, 11959 complete and 0 interrupted iterations
fixed_iterations   [  12% ] 500 VUs  00m30.9s/10m0s  011959/100000 iters, 200 per VU

running (00m31.9s), 500/500 VUs, 12325 complete and 0 interrupted iterations
fixed_iterations   [  12% ] 500 VUs  00m31.9s/10m0s  012325/100000 iters, 200 per VU

running (00m32.9s), 500/500 VUs, 12696 complete and 0 interrupted iterations
fixed_iterations   [  13% ] 500 VUs  00m32.9s/10m0s  012696/100000 iters, 200 per VU

running (00m33.9s), 500/500 VUs, 13081 complete and 0 interrupted iterations
fixed_iterations   [  13% ] 500 VUs  00m33.9s/10m0s  013081/100000 iters, 200 per VU

running (00m34.9s), 500/500 VUs, 13454 complete and 0 interrupted iterations
fixed_iterations   [  13% ] 500 VUs  00m34.9s/10m0s  013454/100000 iters, 200 per VU

running (00m35.9s), 500/500 VUs, 13831 complete and 0 interrupted iterations
fixed_iterations   [  14% ] 500 VUs  00m35.9s/10m0s  013831/100000 iters, 200 per VU

running (00m36.9s), 500/500 VUs, 14208 complete and 0 interrupted iterations
fixed_iterations   [  14% ] 500 VUs  00m36.9s/10m0s  014208/100000 iters, 200 per VU

running (00m37.9s), 500/500 VUs, 14571 complete and 0 interrupted iterations
fixed_iterations   [  15% ] 500 VUs  00m37.9s/10m0s  014571/100000 iters, 200 per VU

running (00m38.9s), 500/500 VUs, 14936 complete and 0 interrupted iterations
fixed_iterations   [  15% ] 500 VUs  00m38.9s/10m0s  014936/100000 iters, 200 per VU

running (00m39.9s), 500/500 VUs, 15307 complete and 0 interrupted iterations
fixed_iterations   [  15% ] 500 VUs  00m39.9s/10m0s  015307/100000 iters, 200 per VU

running (00m40.9s), 500/500 VUs, 15676 complete and 0 interrupted iterations
fixed_iterations   [  16% ] 500 VUs  00m40.9s/10m0s  015676/100000 iters, 200 per VU

running (00m41.9s), 500/500 VUs, 16045 complete and 0 interrupted iterations
fixed_iterations   [  16% ] 500 VUs  00m41.9s/10m0s  016045/100000 iters, 200 per VU

running (00m42.9s), 500/500 VUs, 16423 complete and 0 interrupted iterations
fixed_iterations   [  16% ] 500 VUs  00m42.9s/10m0s  016423/100000 iters, 200 per VU

running (00m43.9s), 500/500 VUs, 16793 complete and 0 interrupted iterations
fixed_iterations   [  17% ] 500 VUs  00m43.9s/10m0s  016793/100000 iters, 200 per VU

running (00m44.9s), 500/500 VUs, 17158 complete and 0 interrupted iterations
fixed_iterations   [  17% ] 500 VUs  00m44.9s/10m0s  017158/100000 iters, 200 per VU

running (00m45.9s), 500/500 VUs, 17531 complete and 0 interrupted iterations
fixed_iterations   [  18% ] 500 VUs  00m45.9s/10m0s  017531/100000 iters, 200 per VU

running (00m46.9s), 500/500 VUs, 17902 complete and 0 interrupted iterations
fixed_iterations   [  18% ] 500 VUs  00m46.9s/10m0s  017902/100000 iters, 200 per VU

running (00m47.9s), 500/500 VUs, 18272 complete and 0 interrupted iterations
fixed_iterations   [  18% ] 500 VUs  00m47.9s/10m0s  018272/100000 iters, 200 per VU

running (00m48.9s), 500/500 VUs, 18644 complete and 0 interrupted iterations
fixed_iterations   [  19% ] 500 VUs  00m48.9s/10m0s  018644/100000 iters, 200 per VU

running (00m49.9s), 500/500 VUs, 19017 complete and 0 interrupted iterations
fixed_iterations   [  19% ] 500 VUs  00m49.9s/10m0s  019017/100000 iters, 200 per VU

running (00m50.9s), 500/500 VUs, 19379 complete and 0 interrupted iterations
fixed_iterations   [  19% ] 500 VUs  00m50.9s/10m0s  019379/100000 iters, 200 per VU

running (00m51.9s), 500/500 VUs, 19756 complete and 0 interrupted iterations
fixed_iterations   [  20% ] 500 VUs  00m51.9s/10m0s  019756/100000 iters, 200 per VU

running (00m52.9s), 500/500 VUs, 20132 complete and 0 interrupted iterations
fixed_iterations   [  20% ] 500 VUs  00m52.9s/10m0s  020132/100000 iters, 200 per VU

running (00m53.9s), 500/500 VUs, 20506 complete and 0 interrupted iterations
fixed_iterations   [  21% ] 500 VUs  00m53.9s/10m0s  020506/100000 iters, 200 per VU

running (00m54.9s), 500/500 VUs, 20876 complete and 0 interrupted iterations
fixed_iterations   [  21% ] 500 VUs  00m54.9s/10m0s  020876/100000 iters, 200 per VU

running (00m55.9s), 500/500 VUs, 21241 complete and 0 interrupted iterations
fixed_iterations   [  21% ] 500 VUs  00m55.9s/10m0s  021241/100000 iters, 200 per VU

running (00m56.9s), 500/500 VUs, 21613 complete and 0 interrupted iterations
fixed_iterations   [  22% ] 500 VUs  00m56.9s/10m0s  021613/100000 iters, 200 per VU

running (00m57.9s), 500/500 VUs, 21983 complete and 0 interrupted iterations
fixed_iterations   [  22% ] 500 VUs  00m57.9s/10m0s  021983/100000 iters, 200 per VU

running (00m58.9s), 500/500 VUs, 22335 complete and 0 interrupted iterations
fixed_iterations   [  22% ] 500 VUs  00m58.9s/10m0s  022335/100000 iters, 200 per VU

running (00m59.9s), 500/500 VUs, 22700 complete and 0 interrupted iterations
fixed_iterations   [  23% ] 500 VUs  00m59.9s/10m0s  022700/100000 iters, 200 per VU

running (01m00.9s), 500/500 VUs, 23071 complete and 0 interrupted iterations
fixed_iterations   [  23% ] 500 VUs  01m00.9s/10m0s  023071/100000 iters, 200 per VU

running (01m01.9s), 500/500 VUs, 23438 complete and 0 interrupted iterations
fixed_iterations   [  23% ] 500 VUs  01m01.9s/10m0s  023438/100000 iters, 200 per VU

running (01m02.9s), 500/500 VUs, 23807 complete and 0 interrupted iterations
fixed_iterations   [  24% ] 500 VUs  01m02.9s/10m0s  023807/100000 iters, 200 per VU

running (01m03.9s), 500/500 VUs, 24180 complete and 0 interrupted iterations
fixed_iterations   [  24% ] 500 VUs  01m03.9s/10m0s  024180/100000 iters, 200 per VU

running (01m04.9s), 500/500 VUs, 24546 complete and 0 interrupted iterations
fixed_iterations   [  25% ] 500 VUs  01m04.9s/10m0s  024546/100000 iters, 200 per VU

running (01m05.9s), 500/500 VUs, 24926 complete and 0 interrupted iterations
fixed_iterations   [  25% ] 500 VUs  01m05.9s/10m0s  024926/100000 iters, 200 per VU

running (01m06.9s), 500/500 VUs, 25311 complete and 0 interrupted iterations
fixed_iterations   [  25% ] 500 VUs  01m06.9s/10m0s  025311/100000 iters, 200 per VU

running (01m07.9s), 500/500 VUs, 25691 complete and 0 interrupted iterations
fixed_iterations   [  26% ] 500 VUs  01m07.9s/10m0s  025691/100000 iters, 200 per VU

running (01m08.9s), 500/500 VUs, 26068 complete and 0 interrupted iterations
fixed_iterations   [  26% ] 500 VUs  01m08.9s/10m0s  026068/100000 iters, 200 per VU

running (01m09.9s), 500/500 VUs, 26451 complete and 0 interrupted iterations
fixed_iterations   [  26% ] 500 VUs  01m09.9s/10m0s  026451/100000 iters, 200 per VU

running (01m10.9s), 500/500 VUs, 26835 complete and 0 interrupted iterations
fixed_iterations   [  27% ] 500 VUs  01m10.9s/10m0s  026835/100000 iters, 200 per VU

running (01m11.9s), 500/500 VUs, 27209 complete and 0 interrupted iterations
fixed_iterations   [  27% ] 500 VUs  01m11.9s/10m0s  027209/100000 iters, 200 per VU

running (01m12.9s), 500/500 VUs, 27580 complete and 0 interrupted iterations
fixed_iterations   [  28% ] 500 VUs  01m12.9s/10m0s  027580/100000 iters, 200 per VU

running (01m13.9s), 500/500 VUs, 27965 complete and 0 interrupted iterations
fixed_iterations   [  28% ] 500 VUs  01m13.9s/10m0s  027965/100000 iters, 200 per VU

running (01m14.9s), 500/500 VUs, 28339 complete and 0 interrupted iterations
fixed_iterations   [  28% ] 500 VUs  01m14.9s/10m0s  028339/100000 iters, 200 per VU

running (01m15.9s), 500/500 VUs, 28714 complete and 0 interrupted iterations
fixed_iterations   [  29% ] 500 VUs  01m15.9s/10m0s  028714/100000 iters, 200 per VU

running (01m16.9s), 500/500 VUs, 29089 complete and 0 interrupted iterations
fixed_iterations   [  29% ] 500 VUs  01m16.9s/10m0s  029089/100000 iters, 200 per VU

running (01m17.9s), 500/500 VUs, 29467 complete and 0 interrupted iterations
fixed_iterations   [  29% ] 500 VUs  01m17.9s/10m0s  029467/100000 iters, 200 per VU

running (01m18.9s), 500/500 VUs, 29838 complete and 0 interrupted iterations
fixed_iterations   [  30% ] 500 VUs  01m18.9s/10m0s  029838/100000 iters, 200 per VU

running (01m19.9s), 500/500 VUs, 30224 complete and 0 interrupted iterations
fixed_iterations   [  30% ] 500 VUs  01m19.9s/10m0s  030224/100000 iters, 200 per VU

running (01m20.9s), 500/500 VUs, 30591 complete and 0 interrupted iterations
fixed_iterations   [  31% ] 500 VUs  01m20.9s/10m0s  030591/100000 iters, 200 per VU

running (01m21.9s), 500/500 VUs, 30959 complete and 0 interrupted iterations
fixed_iterations   [  31% ] 500 VUs  01m21.9s/10m0s  030959/100000 iters, 200 per VU

running (01m22.9s), 500/500 VUs, 31333 complete and 0 interrupted iterations
fixed_iterations   [  31% ] 500 VUs  01m22.9s/10m0s  031333/100000 iters, 200 per VU

running (01m23.9s), 500/500 VUs, 31694 complete and 0 interrupted iterations
fixed_iterations   [  32% ] 500 VUs  01m23.9s/10m0s  031694/100000 iters, 200 per VU

running (01m24.9s), 500/500 VUs, 32067 complete and 0 interrupted iterations
fixed_iterations   [  32% ] 500 VUs  01m24.9s/10m0s  032067/100000 iters, 200 per VU

running (01m25.9s), 500/500 VUs, 32437 complete and 0 interrupted iterations
fixed_iterations   [  32% ] 500 VUs  01m25.9s/10m0s  032437/100000 iters, 200 per VU

running (01m26.9s), 500/500 VUs, 32812 complete and 0 interrupted iterations
fixed_iterations   [  33% ] 500 VUs  01m26.9s/10m0s  032812/100000 iters, 200 per VU

running (01m27.9s), 500/500 VUs, 33185 complete and 0 interrupted iterations
fixed_iterations   [  33% ] 500 VUs  01m27.9s/10m0s  033185/100000 iters, 200 per VU

running (01m28.9s), 500/500 VUs, 33564 complete and 0 interrupted iterations
fixed_iterations   [  34% ] 500 VUs  01m28.9s/10m0s  033564/100000 iters, 200 per VU

running (01m29.9s), 500/500 VUs, 33927 complete and 0 interrupted iterations
fixed_iterations   [  34% ] 500 VUs  01m29.9s/10m0s  033927/100000 iters, 200 per VU

running (01m30.9s), 500/500 VUs, 34305 complete and 0 interrupted iterations
fixed_iterations   [  34% ] 500 VUs  01m30.9s/10m0s  034305/100000 iters, 200 per VU

running (01m31.9s), 500/500 VUs, 34676 complete and 0 interrupted iterations
fixed_iterations   [  35% ] 500 VUs  01m31.9s/10m0s  034676/100000 iters, 200 per VU

running (01m32.9s), 500/500 VUs, 35041 complete and 0 interrupted iterations
fixed_iterations   [  35% ] 500 VUs  01m32.9s/10m0s  035041/100000 iters, 200 per VU

running (01m33.9s), 500/500 VUs, 35406 complete and 0 interrupted iterations
fixed_iterations   [  35% ] 500 VUs  01m33.9s/10m0s  035406/100000 iters, 200 per VU

running (01m34.9s), 500/500 VUs, 35787 complete and 0 interrupted iterations
fixed_iterations   [  36% ] 500 VUs  01m34.9s/10m0s  035787/100000 iters, 200 per VU

running (01m35.9s), 500/500 VUs, 36158 complete and 0 interrupted iterations
fixed_iterations   [  36% ] 500 VUs  01m35.9s/10m0s  036158/100000 iters, 200 per VU

running (01m36.9s), 500/500 VUs, 36538 complete and 0 interrupted iterations
fixed_iterations   [  37% ] 500 VUs  01m36.9s/10m0s  036538/100000 iters, 200 per VU

running (01m37.9s), 500/500 VUs, 36909 complete and 0 interrupted iterations
fixed_iterations   [  37% ] 500 VUs  01m37.9s/10m0s  036909/100000 iters, 200 per VU

running (01m38.9s), 500/500 VUs, 37277 complete and 0 interrupted iterations
fixed_iterations   [  37% ] 500 VUs  01m38.9s/10m0s  037277/100000 iters, 200 per VU

running (01m39.9s), 500/500 VUs, 37648 complete and 0 interrupted iterations
fixed_iterations   [  38% ] 500 VUs  01m39.9s/10m0s  037648/100000 iters, 200 per VU

running (01m40.9s), 500/500 VUs, 38019 complete and 0 interrupted iterations
fixed_iterations   [  38% ] 500 VUs  01m40.9s/10m0s  038019/100000 iters, 200 per VU

running (01m41.9s), 500/500 VUs, 38385 complete and 0 interrupted iterations
fixed_iterations   [  38% ] 500 VUs  01m41.9s/10m0s  038385/100000 iters, 200 per VU

running (01m42.9s), 500/500 VUs, 38757 complete and 0 interrupted iterations
fixed_iterations   [  39% ] 500 VUs  01m42.9s/10m0s  038757/100000 iters, 200 per VU

running (01m43.9s), 500/500 VUs, 39124 complete and 0 interrupted iterations
fixed_iterations   [  39% ] 500 VUs  01m43.9s/10m0s  039124/100000 iters, 200 per VU

running (01m44.9s), 500/500 VUs, 39491 complete and 0 interrupted iterations
fixed_iterations   [  39% ] 500 VUs  01m44.9s/10m0s  039491/100000 iters, 200 per VU

running (01m45.9s), 500/500 VUs, 39863 complete and 0 interrupted iterations
fixed_iterations   [  40% ] 500 VUs  01m45.9s/10m0s  039863/100000 iters, 200 per VU

running (01m46.9s), 500/500 VUs, 40236 complete and 0 interrupted iterations
fixed_iterations   [  40% ] 500 VUs  01m46.9s/10m0s  040236/100000 iters, 200 per VU

running (01m47.9s), 500/500 VUs, 40609 complete and 0 interrupted iterations
fixed_iterations   [  41% ] 500 VUs  01m47.9s/10m0s  040609/100000 iters, 200 per VU

running (01m48.9s), 500/500 VUs, 40975 complete and 0 interrupted iterations
fixed_iterations   [  41% ] 500 VUs  01m48.9s/10m0s  040975/100000 iters, 200 per VU

running (01m49.9s), 500/500 VUs, 41349 complete and 0 interrupted iterations
fixed_iterations   [  41% ] 500 VUs  01m49.9s/10m0s  041349/100000 iters, 200 per VU

running (01m50.9s), 500/500 VUs, 41720 complete and 0 interrupted iterations
fixed_iterations   [  42% ] 500 VUs  01m50.9s/10m0s  041720/100000 iters, 200 per VU

running (01m51.9s), 500/500 VUs, 42086 complete and 0 interrupted iterations
fixed_iterations   [  42% ] 500 VUs  01m51.9s/10m0s  042086/100000 iters, 200 per VU

running (01m52.9s), 500/500 VUs, 42446 complete and 0 interrupted iterations
fixed_iterations   [  42% ] 500 VUs  01m52.9s/10m0s  042446/100000 iters, 200 per VU

running (01m53.9s), 500/500 VUs, 42822 complete and 0 interrupted iterations
fixed_iterations   [  43% ] 500 VUs  01m53.9s/10m0s  042822/100000 iters, 200 per VU

running (01m54.9s), 500/500 VUs, 43194 complete and 0 interrupted iterations
fixed_iterations   [  43% ] 500 VUs  01m54.9s/10m0s  043194/100000 iters, 200 per VU

running (01m55.9s), 500/500 VUs, 43554 complete and 0 interrupted iterations
fixed_iterations   [  44% ] 500 VUs  01m55.9s/10m0s  043554/100000 iters, 200 per VU

running (01m56.9s), 500/500 VUs, 43924 complete and 0 interrupted iterations
fixed_iterations   [  44% ] 500 VUs  01m56.9s/10m0s  043924/100000 iters, 200 per VU

running (01m57.9s), 500/500 VUs, 44296 complete and 0 interrupted iterations
fixed_iterations   [  44% ] 500 VUs  01m57.9s/10m0s  044296/100000 iters, 200 per VU

running (01m58.9s), 500/500 VUs, 44666 complete and 0 interrupted iterations
fixed_iterations   [  45% ] 500 VUs  01m58.9s/10m0s  044666/100000 iters, 200 per VU

running (01m59.9s), 500/500 VUs, 45035 complete and 0 interrupted iterations
fixed_iterations   [  45% ] 500 VUs  01m59.9s/10m0s  045035/100000 iters, 200 per VU

running (02m00.9s), 500/500 VUs, 45417 complete and 0 interrupted iterations
fixed_iterations   [  45% ] 500 VUs  02m00.9s/10m0s  045417/100000 iters, 200 per VU

running (02m01.9s), 500/500 VUs, 45783 complete and 0 interrupted iterations
fixed_iterations   [  46% ] 500 VUs  02m01.9s/10m0s  045783/100000 iters, 200 per VU

running (02m02.9s), 500/500 VUs, 46156 complete and 0 interrupted iterations
fixed_iterations   [  46% ] 500 VUs  02m02.9s/10m0s  046156/100000 iters, 200 per VU

running (02m03.9s), 500/500 VUs, 46527 complete and 0 interrupted iterations
fixed_iterations   [  47% ] 500 VUs  02m03.9s/10m0s  046527/100000 iters, 200 per VU

running (02m04.9s), 500/500 VUs, 46897 complete and 0 interrupted iterations
fixed_iterations   [  47% ] 500 VUs  02m04.9s/10m0s  046897/100000 iters, 200 per VU

running (02m05.9s), 500/500 VUs, 47258 complete and 0 interrupted iterations
fixed_iterations   [  47% ] 500 VUs  02m05.9s/10m0s  047258/100000 iters, 200 per VU

running (02m06.9s), 500/500 VUs, 47629 complete and 0 interrupted iterations
fixed_iterations   [  48% ] 500 VUs  02m06.9s/10m0s  047629/100000 iters, 200 per VU

running (02m07.9s), 500/500 VUs, 47993 complete and 0 interrupted iterations
fixed_iterations   [  48% ] 500 VUs  02m07.9s/10m0s  047993/100000 iters, 200 per VU

running (02m08.9s), 500/500 VUs, 48349 complete and 0 interrupted iterations
fixed_iterations   [  48% ] 500 VUs  02m08.9s/10m0s  048349/100000 iters, 200 per VU

running (02m09.9s), 500/500 VUs, 48711 complete and 0 interrupted iterations
fixed_iterations   [  49% ] 500 VUs  02m09.9s/10m0s  048711/100000 iters, 200 per VU

running (02m10.9s), 500/500 VUs, 49078 complete and 0 interrupted iterations
fixed_iterations   [  49% ] 500 VUs  02m10.9s/10m0s  049078/100000 iters, 200 per VU

running (02m11.9s), 500/500 VUs, 49453 complete and 0 interrupted iterations
fixed_iterations   [  49% ] 500 VUs  02m11.9s/10m0s  049453/100000 iters, 200 per VU

running (02m12.9s), 500/500 VUs, 49832 complete and 0 interrupted iterations
fixed_iterations   [  50% ] 500 VUs  02m12.9s/10m0s  049832/100000 iters, 200 per VU

running (02m13.9s), 500/500 VUs, 50206 complete and 0 interrupted iterations
fixed_iterations   [  50% ] 500 VUs  02m13.9s/10m0s  050206/100000 iters, 200 per VU

running (02m14.9s), 500/500 VUs, 50576 complete and 0 interrupted iterations
fixed_iterations   [  51% ] 500 VUs  02m14.9s/10m0s  050576/100000 iters, 200 per VU

running (02m15.9s), 500/500 VUs, 50955 complete and 0 interrupted iterations
fixed_iterations   [  51% ] 500 VUs  02m15.9s/10m0s  050955/100000 iters, 200 per VU

running (02m16.9s), 500/500 VUs, 51331 complete and 0 interrupted iterations
fixed_iterations   [  51% ] 500 VUs  02m16.9s/10m0s  051331/100000 iters, 200 per VU

running (02m17.9s), 500/500 VUs, 51726 complete and 0 interrupted iterations
fixed_iterations   [  52% ] 500 VUs  02m17.9s/10m0s  051726/100000 iters, 200 per VU

running (02m18.9s), 500/500 VUs, 52100 complete and 0 interrupted iterations
fixed_iterations   [  52% ] 500 VUs  02m18.9s/10m0s  052100/100000 iters, 200 per VU

running (02m19.9s), 500/500 VUs, 52469 complete and 0 interrupted iterations
fixed_iterations   [  52% ] 500 VUs  02m19.9s/10m0s  052469/100000 iters, 200 per VU

running (02m20.9s), 500/500 VUs, 52839 complete and 0 interrupted iterations
fixed_iterations   [  53% ] 500 VUs  02m20.9s/10m0s  052839/100000 iters, 200 per VU

running (02m21.9s), 500/500 VUs, 53204 complete and 0 interrupted iterations
fixed_iterations   [  53% ] 500 VUs  02m21.9s/10m0s  053204/100000 iters, 200 per VU

running (02m22.9s), 500/500 VUs, 53573 complete and 0 interrupted iterations
fixed_iterations   [  54% ] 500 VUs  02m22.9s/10m0s  053573/100000 iters, 200 per VU

running (02m23.9s), 500/500 VUs, 53948 complete and 0 interrupted iterations
fixed_iterations   [  54% ] 500 VUs  02m23.9s/10m0s  053948/100000 iters, 200 per VU

running (02m24.9s), 500/500 VUs, 54320 complete and 0 interrupted iterations
fixed_iterations   [  54% ] 500 VUs  02m24.9s/10m0s  054320/100000 iters, 200 per VU

running (02m25.9s), 500/500 VUs, 54688 complete and 0 interrupted iterations
fixed_iterations   [  55% ] 500 VUs  02m25.9s/10m0s  054688/100000 iters, 200 per VU

running (02m26.9s), 500/500 VUs, 55047 complete and 0 interrupted iterations
fixed_iterations   [  55% ] 500 VUs  02m26.9s/10m0s  055047/100000 iters, 200 per VU

running (02m27.9s), 500/500 VUs, 55425 complete and 0 interrupted iterations
fixed_iterations   [  55% ] 500 VUs  02m27.9s/10m0s  055425/100000 iters, 200 per VU

running (02m28.9s), 500/500 VUs, 55788 complete and 0 interrupted iterations
fixed_iterations   [  56% ] 500 VUs  02m28.9s/10m0s  055788/100000 iters, 200 per VU

running (02m29.9s), 500/500 VUs, 56148 complete and 0 interrupted iterations
fixed_iterations   [  56% ] 500 VUs  02m29.9s/10m0s  056148/100000 iters, 200 per VU

running (02m30.9s), 500/500 VUs, 56516 complete and 0 interrupted iterations
fixed_iterations   [  57% ] 500 VUs  02m30.9s/10m0s  056516/100000 iters, 200 per VU

running (02m31.9s), 500/500 VUs, 56888 complete and 0 interrupted iterations
fixed_iterations   [  57% ] 500 VUs  02m31.9s/10m0s  056888/100000 iters, 200 per VU

running (02m32.9s), 500/500 VUs, 57253 complete and 0 interrupted iterations
fixed_iterations   [  57% ] 500 VUs  02m32.9s/10m0s  057253/100000 iters, 200 per VU

running (02m33.9s), 500/500 VUs, 57618 complete and 0 interrupted iterations
fixed_iterations   [  58% ] 500 VUs  02m33.9s/10m0s  057618/100000 iters, 200 per VU

running (02m34.9s), 500/500 VUs, 57979 complete and 0 interrupted iterations
fixed_iterations   [  58% ] 500 VUs  02m34.9s/10m0s  057979/100000 iters, 200 per VU

running (02m35.9s), 500/500 VUs, 58360 complete and 0 interrupted iterations
fixed_iterations   [  58% ] 500 VUs  02m35.9s/10m0s  058360/100000 iters, 200 per VU

running (02m36.9s), 500/500 VUs, 58722 complete and 0 interrupted iterations
fixed_iterations   [  59% ] 500 VUs  02m36.9s/10m0s  058722/100000 iters, 200 per VU

running (02m37.9s), 500/500 VUs, 59093 complete and 0 interrupted iterations
fixed_iterations   [  59% ] 500 VUs  02m37.9s/10m0s  059093/100000 iters, 200 per VU

running (02m38.9s), 500/500 VUs, 59467 complete and 0 interrupted iterations
fixed_iterations   [  59% ] 500 VUs  02m38.9s/10m0s  059467/100000 iters, 200 per VU

running (02m39.9s), 500/500 VUs, 59835 complete and 0 interrupted iterations
fixed_iterations   [  60% ] 500 VUs  02m39.9s/10m0s  059835/100000 iters, 200 per VU

running (02m40.9s), 500/500 VUs, 60203 complete and 0 interrupted iterations
fixed_iterations   [  60% ] 500 VUs  02m40.9s/10m0s  060203/100000 iters, 200 per VU

running (02m41.9s), 500/500 VUs, 60573 complete and 0 interrupted iterations
fixed_iterations   [  61% ] 500 VUs  02m41.9s/10m0s  060573/100000 iters, 200 per VU

running (02m42.9s), 500/500 VUs, 60948 complete and 0 interrupted iterations
fixed_iterations   [  61% ] 500 VUs  02m42.9s/10m0s  060948/100000 iters, 200 per VU

running (02m43.9s), 500/500 VUs, 61319 complete and 0 interrupted iterations
fixed_iterations   [  61% ] 500 VUs  02m43.9s/10m0s  061319/100000 iters, 200 per VU

running (02m44.9s), 500/500 VUs, 61688 complete and 0 interrupted iterations
fixed_iterations   [  62% ] 500 VUs  02m44.9s/10m0s  061688/100000 iters, 200 per VU

running (02m45.9s), 500/500 VUs, 62054 complete and 0 interrupted iterations
fixed_iterations   [  62% ] 500 VUs  02m45.9s/10m0s  062054/100000 iters, 200 per VU

running (02m46.9s), 500/500 VUs, 62418 complete and 0 interrupted iterations
fixed_iterations   [  62% ] 500 VUs  02m46.9s/10m0s  062418/100000 iters, 200 per VU

running (02m47.9s), 500/500 VUs, 62796 complete and 0 interrupted iterations
fixed_iterations   [  63% ] 500 VUs  02m47.9s/10m0s  062796/100000 iters, 200 per VU

running (02m48.9s), 500/500 VUs, 63151 complete and 0 interrupted iterations
fixed_iterations   [  63% ] 500 VUs  02m48.9s/10m0s  063151/100000 iters, 200 per VU

running (02m49.9s), 500/500 VUs, 63514 complete and 0 interrupted iterations
fixed_iterations   [  64% ] 500 VUs  02m49.9s/10m0s  063514/100000 iters, 200 per VU

running (02m50.9s), 500/500 VUs, 63879 complete and 0 interrupted iterations
fixed_iterations   [  64% ] 500 VUs  02m50.9s/10m0s  063879/100000 iters, 200 per VU

running (02m51.9s), 500/500 VUs, 64259 complete and 0 interrupted iterations
fixed_iterations   [  64% ] 500 VUs  02m51.9s/10m0s  064259/100000 iters, 200 per VU

running (02m52.9s), 500/500 VUs, 64630 complete and 0 interrupted iterations
fixed_iterations   [  65% ] 500 VUs  02m52.9s/10m0s  064630/100000 iters, 200 per VU

running (02m53.9s), 500/500 VUs, 64999 complete and 0 interrupted iterations
fixed_iterations   [  65% ] 500 VUs  02m53.9s/10m0s  064999/100000 iters, 200 per VU

running (02m54.9s), 500/500 VUs, 65365 complete and 0 interrupted iterations
fixed_iterations   [  65% ] 500 VUs  02m54.9s/10m0s  065365/100000 iters, 200 per VU

running (02m55.9s), 500/500 VUs, 65739 complete and 0 interrupted iterations
fixed_iterations   [  66% ] 500 VUs  02m55.9s/10m0s  065739/100000 iters, 200 per VU

running (02m56.9s), 500/500 VUs, 66107 complete and 0 interrupted iterations
fixed_iterations   [  66% ] 500 VUs  02m56.9s/10m0s  066107/100000 iters, 200 per VU

running (02m57.9s), 500/500 VUs, 66482 complete and 0 interrupted iterations
fixed_iterations   [  66% ] 500 VUs  02m57.9s/10m0s  066482/100000 iters, 200 per VU

running (02m58.9s), 500/500 VUs, 66856 complete and 0 interrupted iterations
fixed_iterations   [  67% ] 500 VUs  02m58.9s/10m0s  066856/100000 iters, 200 per VU

running (02m59.9s), 500/500 VUs, 67225 complete and 0 interrupted iterations
fixed_iterations   [  67% ] 500 VUs  02m59.9s/10m0s  067225/100000 iters, 200 per VU

running (03m00.9s), 500/500 VUs, 67604 complete and 0 interrupted iterations
fixed_iterations   [  68% ] 500 VUs  03m00.9s/10m0s  067604/100000 iters, 200 per VU

running (03m01.9s), 500/500 VUs, 67988 complete and 0 interrupted iterations
fixed_iterations   [  68% ] 500 VUs  03m01.9s/10m0s  067988/100000 iters, 200 per VU

running (03m02.9s), 500/500 VUs, 68353 complete and 0 interrupted iterations
fixed_iterations   [  68% ] 500 VUs  03m02.9s/10m0s  068353/100000 iters, 200 per VU

running (03m03.9s), 500/500 VUs, 68722 complete and 0 interrupted iterations
fixed_iterations   [  69% ] 500 VUs  03m03.9s/10m0s  068722/100000 iters, 200 per VU

running (03m04.9s), 500/500 VUs, 69086 complete and 0 interrupted iterations
fixed_iterations   [  69% ] 500 VUs  03m04.9s/10m0s  069086/100000 iters, 200 per VU

running (03m05.9s), 500/500 VUs, 69456 complete and 0 interrupted iterations
fixed_iterations   [  69% ] 500 VUs  03m05.9s/10m0s  069456/100000 iters, 200 per VU

running (03m06.9s), 500/500 VUs, 70097 complete and 0 interrupted iterations
fixed_iterations   [  70% ] 500 VUs  03m06.9s/10m0s  070097/100000 iters, 200 per VU

running (03m07.9s), 500/500 VUs, 70458 complete and 0 interrupted iterations
fixed_iterations   [  70% ] 500 VUs  03m07.9s/10m0s  070458/100000 iters, 200 per VU

running (03m08.9s), 500/500 VUs, 70808 complete and 0 interrupted iterations
fixed_iterations   [  71% ] 500 VUs  03m08.9s/10m0s  070808/100000 iters, 200 per VU

running (03m09.9s), 500/500 VUs, 71167 complete and 0 interrupted iterations
fixed_iterations   [  71% ] 500 VUs  03m09.9s/10m0s  071167/100000 iters, 200 per VU

running (03m10.9s), 500/500 VUs, 71532 complete and 0 interrupted iterations
fixed_iterations   [  72% ] 500 VUs  03m10.9s/10m0s  071532/100000 iters, 200 per VU

running (03m11.9s), 500/500 VUs, 71907 complete and 0 interrupted iterations
fixed_iterations   [  72% ] 500 VUs  03m11.9s/10m0s  071907/100000 iters, 200 per VU

running (03m12.9s), 500/500 VUs, 72270 complete and 0 interrupted iterations
fixed_iterations   [  72% ] 500 VUs  03m12.9s/10m0s  072270/100000 iters, 200 per VU

running (03m13.9s), 500/500 VUs, 72645 complete and 0 interrupted iterations
fixed_iterations   [  73% ] 500 VUs  03m13.9s/10m0s  072645/100000 iters, 200 per VU

running (03m14.9s), 500/500 VUs, 73011 complete and 0 interrupted iterations
fixed_iterations   [  73% ] 500 VUs  03m14.9s/10m0s  073011/100000 iters, 200 per VU

running (03m15.9s), 500/500 VUs, 73371 complete and 0 interrupted iterations
fixed_iterations   [  73% ] 500 VUs  03m15.9s/10m0s  073371/100000 iters, 200 per VU

running (03m16.9s), 500/500 VUs, 73737 complete and 0 interrupted iterations
fixed_iterations   [  74% ] 500 VUs  03m16.9s/10m0s  073737/100000 iters, 200 per VU

running (03m17.9s), 500/500 VUs, 74107 complete and 0 interrupted iterations
fixed_iterations   [  74% ] 500 VUs  03m17.9s/10m0s  074107/100000 iters, 200 per VU

running (03m18.9s), 500/500 VUs, 74459 complete and 0 interrupted iterations
fixed_iterations   [  74% ] 500 VUs  03m18.9s/10m0s  074459/100000 iters, 200 per VU

running (03m19.9s), 500/500 VUs, 74822 complete and 0 interrupted iterations
fixed_iterations   [  75% ] 500 VUs  03m19.9s/10m0s  074822/100000 iters, 200 per VU

running (03m20.9s), 500/500 VUs, 75194 complete and 0 interrupted iterations
fixed_iterations   [  75% ] 500 VUs  03m20.9s/10m0s  075194/100000 iters, 200 per VU

running (03m21.9s), 500/500 VUs, 75562 complete and 0 interrupted iterations
fixed_iterations   [  76% ] 500 VUs  03m21.9s/10m0s  075562/100000 iters, 200 per VU

running (03m22.9s), 500/500 VUs, 75941 complete and 0 interrupted iterations
fixed_iterations   [  76% ] 500 VUs  03m22.9s/10m0s  075941/100000 iters, 200 per VU

running (03m23.9s), 500/500 VUs, 76295 complete and 0 interrupted iterations
fixed_iterations   [  76% ] 500 VUs  03m23.9s/10m0s  076295/100000 iters, 200 per VU

running (03m24.9s), 500/500 VUs, 76666 complete and 0 interrupted iterations
fixed_iterations   [  77% ] 500 VUs  03m24.9s/10m0s  076666/100000 iters, 200 per VU

running (03m25.9s), 500/500 VUs, 77031 complete and 0 interrupted iterations
fixed_iterations   [  77% ] 500 VUs  03m25.9s/10m0s  077031/100000 iters, 200 per VU

running (03m26.9s), 500/500 VUs, 77397 complete and 0 interrupted iterations
fixed_iterations   [  77% ] 500 VUs  03m26.9s/10m0s  077397/100000 iters, 200 per VU

running (03m27.9s), 500/500 VUs, 77768 complete and 0 interrupted iterations
fixed_iterations   [  78% ] 500 VUs  03m27.9s/10m0s  077768/100000 iters, 200 per VU

running (03m28.9s), 500/500 VUs, 78140 complete and 0 interrupted iterations
fixed_iterations   [  78% ] 500 VUs  03m28.9s/10m0s  078140/100000 iters, 200 per VU

running (03m29.9s), 500/500 VUs, 78504 complete and 0 interrupted iterations
fixed_iterations   [  79% ] 500 VUs  03m29.9s/10m0s  078504/100000 iters, 200 per VU

running (03m30.9s), 500/500 VUs, 78874 complete and 0 interrupted iterations
fixed_iterations   [  79% ] 500 VUs  03m30.9s/10m0s  078874/100000 iters, 200 per VU

running (03m31.9s), 500/500 VUs, 79245 complete and 0 interrupted iterations
fixed_iterations   [  79% ] 500 VUs  03m31.9s/10m0s  079245/100000 iters, 200 per VU

running (03m32.9s), 500/500 VUs, 79603 complete and 0 interrupted iterations
fixed_iterations   [  80% ] 500 VUs  03m32.9s/10m0s  079603/100000 iters, 200 per VU

running (03m33.9s), 500/500 VUs, 79976 complete and 0 interrupted iterations
fixed_iterations   [  80% ] 500 VUs  03m33.9s/10m0s  079976/100000 iters, 200 per VU

running (03m34.9s), 500/500 VUs, 80352 complete and 0 interrupted iterations
fixed_iterations   [  80% ] 500 VUs  03m34.9s/10m0s  080352/100000 iters, 200 per VU

running (03m35.9s), 500/500 VUs, 80720 complete and 0 interrupted iterations
fixed_iterations   [  81% ] 500 VUs  03m35.9s/10m0s  080720/100000 iters, 200 per VU

running (03m36.9s), 500/500 VUs, 81085 complete and 0 interrupted iterations
fixed_iterations   [  81% ] 500 VUs  03m36.9s/10m0s  081085/100000 iters, 200 per VU

running (03m37.9s), 500/500 VUs, 81464 complete and 0 interrupted iterations
fixed_iterations   [  81% ] 500 VUs  03m37.9s/10m0s  081464/100000 iters, 200 per VU

running (03m38.9s), 500/500 VUs, 81830 complete and 0 interrupted iterations
fixed_iterations   [  82% ] 500 VUs  03m38.9s/10m0s  081830/100000 iters, 200 per VU

running (03m39.9s), 500/500 VUs, 82207 complete and 0 interrupted iterations
fixed_iterations   [  82% ] 500 VUs  03m39.9s/10m0s  082207/100000 iters, 200 per VU

running (03m40.9s), 500/500 VUs, 82579 complete and 0 interrupted iterations
fixed_iterations   [  83% ] 500 VUs  03m40.9s/10m0s  082579/100000 iters, 200 per VU

running (03m41.9s), 500/500 VUs, 82950 complete and 0 interrupted iterations
fixed_iterations   [  83% ] 500 VUs  03m41.9s/10m0s  082950/100000 iters, 200 per VU

running (03m42.9s), 500/500 VUs, 83316 complete and 0 interrupted iterations
fixed_iterations   [  83% ] 500 VUs  03m42.9s/10m0s  083316/100000 iters, 200 per VU

running (03m43.9s), 500/500 VUs, 83676 complete and 0 interrupted iterations
fixed_iterations   [  84% ] 500 VUs  03m43.9s/10m0s  083676/100000 iters, 200 per VU

running (03m44.9s), 500/500 VUs, 84049 complete and 0 interrupted iterations
fixed_iterations   [  84% ] 500 VUs  03m44.9s/10m0s  084049/100000 iters, 200 per VU

running (03m45.9s), 500/500 VUs, 84434 complete and 0 interrupted iterations
fixed_iterations   [  84% ] 500 VUs  03m45.9s/10m0s  084434/100000 iters, 200 per VU

running (03m46.9s), 500/500 VUs, 84818 complete and 0 interrupted iterations
fixed_iterations   [  85% ] 500 VUs  03m46.9s/10m0s  084818/100000 iters, 200 per VU

running (03m47.9s), 500/500 VUs, 85203 complete and 0 interrupted iterations
fixed_iterations   [  85% ] 500 VUs  03m47.9s/10m0s  085203/100000 iters, 200 per VU

running (03m48.9s), 500/500 VUs, 85595 complete and 0 interrupted iterations
fixed_iterations   [  86% ] 500 VUs  03m48.9s/10m0s  085595/100000 iters, 200 per VU

running (03m49.9s), 500/500 VUs, 85967 complete and 0 interrupted iterations
fixed_iterations   [  86% ] 500 VUs  03m49.9s/10m0s  085967/100000 iters, 200 per VU

running (03m50.9s), 500/500 VUs, 86339 complete and 0 interrupted iterations
fixed_iterations   [  86% ] 500 VUs  03m50.9s/10m0s  086339/100000 iters, 200 per VU

running (03m51.9s), 500/500 VUs, 86710 complete and 0 interrupted iterations
fixed_iterations   [  87% ] 500 VUs  03m51.9s/10m0s  086710/100000 iters, 200 per VU

running (03m52.9s), 500/500 VUs, 87077 complete and 0 interrupted iterations
fixed_iterations   [  87% ] 500 VUs  03m52.9s/10m0s  087077/100000 iters, 200 per VU

running (03m53.9s), 500/500 VUs, 87448 complete and 0 interrupted iterations
fixed_iterations   [  87% ] 500 VUs  03m53.9s/10m0s  087448/100000 iters, 200 per VU

running (03m54.9s), 500/500 VUs, 87820 complete and 0 interrupted iterations
fixed_iterations   [  88% ] 500 VUs  03m54.9s/10m0s  087820/100000 iters, 200 per VU

running (03m55.9s), 500/500 VUs, 88188 complete and 0 interrupted iterations
fixed_iterations   [  88% ] 500 VUs  03m55.9s/10m0s  088188/100000 iters, 200 per VU

running (03m56.9s), 500/500 VUs, 88555 complete and 0 interrupted iterations
fixed_iterations   [  89% ] 500 VUs  03m56.9s/10m0s  088555/100000 iters, 200 per VU

running (03m57.9s), 500/500 VUs, 88926 complete and 0 interrupted iterations
fixed_iterations   [  89% ] 500 VUs  03m57.9s/10m0s  088926/100000 iters, 200 per VU

running (03m58.9s), 500/500 VUs, 89300 complete and 0 interrupted iterations
fixed_iterations   [  89% ] 500 VUs  03m58.9s/10m0s  089300/100000 iters, 200 per VU

running (03m59.9s), 500/500 VUs, 89661 complete and 0 interrupted iterations
fixed_iterations   [  90% ] 500 VUs  03m59.9s/10m0s  089661/100000 iters, 200 per VU

running (04m00.9s), 500/500 VUs, 90032 complete and 0 interrupted iterations
fixed_iterations   [  90% ] 500 VUs  04m00.9s/10m0s  090032/100000 iters, 200 per VU

running (04m01.9s), 500/500 VUs, 90396 complete and 0 interrupted iterations
fixed_iterations   [  90% ] 500 VUs  04m01.9s/10m0s  090396/100000 iters, 200 per VU

running (04m02.9s), 500/500 VUs, 90762 complete and 0 interrupted iterations
fixed_iterations   [  91% ] 500 VUs  04m02.9s/10m0s  090762/100000 iters, 200 per VU

running (04m03.9s), 500/500 VUs, 91135 complete and 0 interrupted iterations
fixed_iterations   [  91% ] 500 VUs  04m03.9s/10m0s  091135/100000 iters, 200 per VU

running (04m04.9s), 500/500 VUs, 91499 complete and 0 interrupted iterations
fixed_iterations   [  91% ] 500 VUs  04m04.9s/10m0s  091499/100000 iters, 200 per VU

running (04m05.9s), 500/500 VUs, 91866 complete and 0 interrupted iterations
fixed_iterations   [  92% ] 500 VUs  04m05.9s/10m0s  091866/100000 iters, 200 per VU

running (04m06.9s), 500/500 VUs, 92230 complete and 0 interrupted iterations
fixed_iterations   [  92% ] 500 VUs  04m06.9s/10m0s  092230/100000 iters, 200 per VU

running (04m07.9s), 500/500 VUs, 92596 complete and 0 interrupted iterations
fixed_iterations   [  93% ] 500 VUs  04m07.9s/10m0s  092596/100000 iters, 200 per VU

running (04m08.9s), 500/500 VUs, 92963 complete and 0 interrupted iterations
fixed_iterations   [  93% ] 500 VUs  04m08.9s/10m0s  092963/100000 iters, 200 per VU

running (04m09.9s), 500/500 VUs, 93343 complete and 0 interrupted iterations
fixed_iterations   [  93% ] 500 VUs  04m09.9s/10m0s  093343/100000 iters, 200 per VU

running (04m10.9s), 500/500 VUs, 93707 complete and 0 interrupted iterations
fixed_iterations   [  94% ] 500 VUs  04m10.9s/10m0s  093707/100000 iters, 200 per VU

running (04m11.9s), 500/500 VUs, 94071 complete and 0 interrupted iterations
fixed_iterations   [  94% ] 500 VUs  04m11.9s/10m0s  094071/100000 iters, 200 per VU

running (04m12.9s), 500/500 VUs, 94438 complete and 0 interrupted iterations
fixed_iterations   [  94% ] 500 VUs  04m12.9s/10m0s  094438/100000 iters, 200 per VU

running (04m13.9s), 500/500 VUs, 94817 complete and 0 interrupted iterations
fixed_iterations   [  95% ] 500 VUs  04m13.9s/10m0s  094817/100000 iters, 200 per VU

running (04m14.9s), 500/500 VUs, 95192 complete and 0 interrupted iterations
fixed_iterations   [  95% ] 500 VUs  04m14.9s/10m0s  095192/100000 iters, 200 per VU

running (04m15.9s), 500/500 VUs, 95572 complete and 0 interrupted iterations
fixed_iterations   [  96% ] 500 VUs  04m15.9s/10m0s  095572/100000 iters, 200 per VU

running (04m16.9s), 500/500 VUs, 95935 complete and 0 interrupted iterations
fixed_iterations   [  96% ] 500 VUs  04m16.9s/10m0s  095935/100000 iters, 200 per VU

running (04m17.9s), 500/500 VUs, 96293 complete and 0 interrupted iterations
fixed_iterations   [  96% ] 500 VUs  04m17.9s/10m0s  096293/100000 iters, 200 per VU

running (04m18.9s), 500/500 VUs, 96668 complete and 0 interrupted iterations
fixed_iterations   [  97% ] 500 VUs  04m18.9s/10m0s  096668/100000 iters, 200 per VU

running (04m19.9s), 500/500 VUs, 97042 complete and 0 interrupted iterations
fixed_iterations   [  97% ] 500 VUs  04m19.9s/10m0s  097042/100000 iters, 200 per VU

running (04m20.9s), 500/500 VUs, 97405 complete and 0 interrupted iterations
fixed_iterations   [  97% ] 500 VUs  04m20.9s/10m0s  097405/100000 iters, 200 per VU

running (04m21.9s), 500/500 VUs, 97775 complete and 0 interrupted iterations
fixed_iterations   [  98% ] 500 VUs  04m21.9s/10m0s  097775/100000 iters, 200 per VU

running (04m22.9s), 500/500 VUs, 98139 complete and 0 interrupted iterations
fixed_iterations   [  98% ] 500 VUs  04m22.9s/10m0s  098139/100000 iters, 200 per VU

running (04m23.9s), 500/500 VUs, 98503 complete and 0 interrupted iterations
fixed_iterations   [  99% ] 500 VUs  04m23.9s/10m0s  098503/100000 iters, 200 per VU

running (04m24.9s), 500/500 VUs, 98882 complete and 0 interrupted iterations
fixed_iterations   [  99% ] 500 VUs  04m24.9s/10m0s  098882/100000 iters, 200 per VU

running (04m25.9s), 472/500 VUs, 99256 complete and 0 interrupted iterations
fixed_iterations   [  99% ] 500 VUs  04m25.9s/10m0s  099256/100000 iters, 200 per VU

running (04m26.9s), 352/500 VUs, 99631 complete and 0 interrupted iterations
fixed_iterations   [ 100% ] 500 VUs  04m26.9s/10m0s  099631/100000 iters, 200 per VU


  █ TOTAL RESULTS 

    checks_total.......: 100000  373.445818/s
    checks_succeeded...: 100.00% 100000 out of 100000
    checks_failed......: 0.00%   0 out of 100000

    ✓ status is 200

    HTTP
    http_req_duration..............: avg=1.33s min=15.59ms med=1.31s max=1.5s p(90)=1.39s p(95)=1.39s
      { expected_response:true }...: avg=1.33s min=15.59ms med=1.31s max=1.5s p(90)=1.39s p(95)=1.39s
    http_req_failed................: 0.00%  0 out of 100000
    http_reqs......................: 100000 373.445818/s

    EXECUTION
    iteration_duration.............: avg=1.33s min=16.28ms med=1.31s max=1.5s p(90)=1.39s p(95)=1.39s
    iterations.....................: 100000 373.445818/s
    vus............................: 352    min=352         max=500
    vus_max........................: 500    min=500         max=500

    NETWORK
    data_received..................: 22 MB  81 kB/s
    data_sent......................: 14 MB  51 kB/s




running (04m27.8s), 000/500 VUs, 100000 complete and 0 interrupted iterations
fixed_iterations ✓ [ 100% ] 500 VUs  04m27.8s/10m0s  100000/100000 iters, 200 per VU
