
         /\      Grafana   /‾‾/  
    /\  /  \     |\  __   /  /   
   /  \/    \    | |/ /  /   ‾‾\ 
  /          \   |   (  |  (‾)  |
 / __________ \  |_|\_\  \_____/ 

     execution: local
        script: ./script.js
        output: -

     scenarios: (100.00%) 1 scenario, 500 max VUs, 10m30s max duration (incl. graceful stop):
              * fixed_iterations: 200 iterations for each of 500 VUs (maxDuration: 10m0s, gracefulStop: 30s)


running (00m01.0s), 500/500 VUs, 462 complete and 0 interrupted iterations
fixed_iterations   [   0% ] 500 VUs  00m01.0s/10m0s  000462/100000 iters, 200 per VU

running (00m02.0s), 500/500 VUs, 831 complete and 0 interrupted iterations
fixed_iterations   [   1% ] 500 VUs  00m02.0s/10m0s  000831/100000 iters, 200 per VU

running (00m03.0s), 500/500 VUs, 1194 complete and 0 interrupted iterations
fixed_iterations   [   1% ] 500 VUs  00m03.0s/10m0s  001194/100000 iters, 200 per VU

running (00m04.0s), 500/500 VUs, 1572 complete and 0 interrupted iterations
fixed_iterations   [   2% ] 500 VUs  00m04.0s/10m0s  001572/100000 iters, 200 per VU

running (00m05.0s), 500/500 VUs, 1923 complete and 0 interrupted iterations
fixed_iterations   [   2% ] 500 VUs  00m05.0s/10m0s  001923/100000 iters, 200 per VU

running (00m06.0s), 500/500 VUs, 2284 complete and 0 interrupted iterations
fixed_iterations   [   2% ] 500 VUs  00m06.0s/10m0s  002284/100000 iters, 200 per VU

running (00m07.0s), 500/500 VUs, 2658 complete and 0 interrupted iterations
fixed_iterations   [   3% ] 500 VUs  00m07.0s/10m0s  002658/100000 iters, 200 per VU

running (00m08.0s), 500/500 VUs, 3130 complete and 0 interrupted iterations
fixed_iterations   [   3% ] 500 VUs  00m08.0s/10m0s  003130/100000 iters, 200 per VU

running (00m09.0s), 500/500 VUs, 3488 complete and 0 interrupted iterations
fixed_iterations   [   3% ] 500 VUs  00m09.0s/10m0s  003488/100000 iters, 200 per VU

running (00m10.0s), 500/500 VUs, 3862 complete and 0 interrupted iterations
fixed_iterations   [   4% ] 500 VUs  00m10.0s/10m0s  003862/100000 iters, 200 per VU

running (00m11.0s), 500/500 VUs, 4235 complete and 0 interrupted iterations
fixed_iterations   [   4% ] 500 VUs  00m11.0s/10m0s  004235/100000 iters, 200 per VU

running (00m12.0s), 500/500 VUs, 4603 complete and 0 interrupted iterations
fixed_iterations   [   5% ] 500 VUs  00m12.0s/10m0s  004603/100000 iters, 200 per VU

running (00m13.0s), 500/500 VUs, 4969 complete and 0 interrupted iterations
fixed_iterations   [   5% ] 500 VUs  00m13.0s/10m0s  004969/100000 iters, 200 per VU

running (00m14.0s), 500/500 VUs, 5338 complete and 0 interrupted iterations
fixed_iterations   [   5% ] 500 VUs  00m14.0s/10m0s  005338/100000 iters, 200 per VU

running (00m15.0s), 500/500 VUs, 5710 complete and 0 interrupted iterations
fixed_iterations   [   6% ] 500 VUs  00m15.0s/10m0s  005710/100000 iters, 200 per VU

running (00m16.0s), 500/500 VUs, 6077 complete and 0 interrupted iterations
fixed_iterations   [   6% ] 500 VUs  00m16.0s/10m0s  006077/100000 iters, 200 per VU

running (00m17.0s), 500/500 VUs, 6445 complete and 0 interrupted iterations
fixed_iterations   [   6% ] 500 VUs  00m17.0s/10m0s  006445/100000 iters, 200 per VU

running (00m18.0s), 500/500 VUs, 6811 complete and 0 interrupted iterations
fixed_iterations   [   7% ] 500 VUs  00m18.0s/10m0s  006811/100000 iters, 200 per VU

running (00m19.0s), 500/500 VUs, 7184 complete and 0 interrupted iterations
fixed_iterations   [   7% ] 500 VUs  00m19.0s/10m0s  007184/100000 iters, 200 per VU

running (00m20.0s), 500/500 VUs, 7562 complete and 0 interrupted iterations
fixed_iterations   [   8% ] 500 VUs  00m20.0s/10m0s  007562/100000 iters, 200 per VU

running (00m21.0s), 500/500 VUs, 7939 complete and 0 interrupted iterations
fixed_iterations   [   8% ] 500 VUs  00m21.0s/10m0s  007939/100000 iters, 200 per VU

running (00m22.0s), 500/500 VUs, 8306 complete and 0 interrupted iterations
fixed_iterations   [   8% ] 500 VUs  00m22.0s/10m0s  008306/100000 iters, 200 per VU

running (00m23.0s), 500/500 VUs, 8672 complete and 0 interrupted iterations
fixed_iterations   [   9% ] 500 VUs  00m23.0s/10m0s  008672/100000 iters, 200 per VU

running (00m24.0s), 500/500 VUs, 9048 complete and 0 interrupted iterations
fixed_iterations   [   9% ] 500 VUs  00m24.0s/10m0s  009048/100000 iters, 200 per VU

running (00m25.0s), 500/500 VUs, 9416 complete and 0 interrupted iterations
fixed_iterations   [   9% ] 500 VUs  00m25.0s/10m0s  009416/100000 iters, 200 per VU

running (00m26.0s), 500/500 VUs, 9788 complete and 0 interrupted iterations
fixed_iterations   [  10% ] 500 VUs  00m26.0s/10m0s  009788/100000 iters, 200 per VU

running (00m27.0s), 500/500 VUs, 10137 complete and 0 interrupted iterations
fixed_iterations   [  10% ] 500 VUs  00m27.0s/10m0s  010137/100000 iters, 200 per VU

running (00m28.0s), 500/500 VUs, 10464 complete and 0 interrupted iterations
fixed_iterations   [  10% ] 500 VUs  00m28.0s/10m0s  010464/100000 iters, 200 per VU

running (00m29.0s), 500/500 VUs, 10798 complete and 0 interrupted iterations
fixed_iterations   [  11% ] 500 VUs  00m29.0s/10m0s  010798/100000 iters, 200 per VU

running (00m30.0s), 500/500 VUs, 11173 complete and 0 interrupted iterations
fixed_iterations   [  11% ] 500 VUs  00m30.0s/10m0s  011173/100000 iters, 200 per VU

running (00m31.0s), 500/500 VUs, 11539 complete and 0 interrupted iterations
fixed_iterations   [  12% ] 500 VUs  00m31.0s/10m0s  011539/100000 iters, 200 per VU

running (00m32.0s), 500/500 VUs, 11916 complete and 0 interrupted iterations
fixed_iterations   [  12% ] 500 VUs  00m32.0s/10m0s  011916/100000 iters, 200 per VU

running (00m33.0s), 500/500 VUs, 12292 complete and 0 interrupted iterations
fixed_iterations   [  12% ] 500 VUs  00m33.0s/10m0s  012292/100000 iters, 200 per VU

running (00m34.0s), 500/500 VUs, 12668 complete and 0 interrupted iterations
fixed_iterations   [  13% ] 500 VUs  00m34.0s/10m0s  012668/100000 iters, 200 per VU

running (00m35.0s), 500/500 VUs, 13034 complete and 0 interrupted iterations
fixed_iterations   [  13% ] 500 VUs  00m35.0s/10m0s  013034/100000 iters, 200 per VU

running (00m36.0s), 500/500 VUs, 13397 complete and 0 interrupted iterations
fixed_iterations   [  13% ] 500 VUs  00m36.0s/10m0s  013397/100000 iters, 200 per VU

running (00m37.0s), 500/500 VUs, 13774 complete and 0 interrupted iterations
fixed_iterations   [  14% ] 500 VUs  00m37.0s/10m0s  013774/100000 iters, 200 per VU

running (00m38.0s), 500/500 VUs, 14150 complete and 0 interrupted iterations
fixed_iterations   [  14% ] 500 VUs  00m38.0s/10m0s  014150/100000 iters, 200 per VU

running (00m39.0s), 500/500 VUs, 14516 complete and 0 interrupted iterations
fixed_iterations   [  15% ] 500 VUs  00m39.0s/10m0s  014516/100000 iters, 200 per VU

running (00m40.0s), 500/500 VUs, 14882 complete and 0 interrupted iterations
fixed_iterations   [  15% ] 500 VUs  00m40.0s/10m0s  014882/100000 iters, 200 per VU

running (00m41.0s), 500/500 VUs, 15256 complete and 0 interrupted iterations
fixed_iterations   [  15% ] 500 VUs  00m41.0s/10m0s  015256/100000 iters, 200 per VU

running (00m42.0s), 500/500 VUs, 15626 complete and 0 interrupted iterations
fixed_iterations   [  16% ] 500 VUs  00m42.0s/10m0s  015626/100000 iters, 200 per VU

running (00m43.0s), 500/500 VUs, 16001 complete and 0 interrupted iterations
fixed_iterations   [  16% ] 500 VUs  00m43.0s/10m0s  016001/100000 iters, 200 per VU

running (00m44.0s), 500/500 VUs, 16368 complete and 0 interrupted iterations
fixed_iterations   [  16% ] 500 VUs  00m44.0s/10m0s  016368/100000 iters, 200 per VU

running (00m45.0s), 500/500 VUs, 16734 complete and 0 interrupted iterations
fixed_iterations   [  17% ] 500 VUs  00m45.0s/10m0s  016734/100000 iters, 200 per VU

running (00m46.0s), 500/500 VUs, 17103 complete and 0 interrupted iterations
fixed_iterations   [  17% ] 500 VUs  00m46.0s/10m0s  017103/100000 iters, 200 per VU

running (00m47.0s), 500/500 VUs, 17474 complete and 0 interrupted iterations
fixed_iterations   [  17% ] 500 VUs  00m47.0s/10m0s  017474/100000 iters, 200 per VU

running (00m48.0s), 500/500 VUs, 17847 complete and 0 interrupted iterations
fixed_iterations   [  18% ] 500 VUs  00m48.0s/10m0s  017847/100000 iters, 200 per VU

running (00m49.0s), 500/500 VUs, 18223 complete and 0 interrupted iterations
fixed_iterations   [  18% ] 500 VUs  00m49.0s/10m0s  018223/100000 iters, 200 per VU

running (00m50.0s), 500/500 VUs, 18590 complete and 0 interrupted iterations
fixed_iterations   [  19% ] 500 VUs  00m50.0s/10m0s  018590/100000 iters, 200 per VU

running (00m51.0s), 500/500 VUs, 18956 complete and 0 interrupted iterations
fixed_iterations   [  19% ] 500 VUs  00m51.0s/10m0s  018956/100000 iters, 200 per VU

running (00m52.0s), 500/500 VUs, 19322 complete and 0 interrupted iterations
fixed_iterations   [  19% ] 500 VUs  00m52.0s/10m0s  019322/100000 iters, 200 per VU

running (00m53.0s), 500/500 VUs, 19688 complete and 0 interrupted iterations
fixed_iterations   [  20% ] 500 VUs  00m53.0s/10m0s  019688/100000 iters, 200 per VU

running (00m54.0s), 500/500 VUs, 20066 complete and 0 interrupted iterations
fixed_iterations   [  20% ] 500 VUs  00m54.0s/10m0s  020066/100000 iters, 200 per VU

running (00m55.0s), 500/500 VUs, 20437 complete and 0 interrupted iterations
fixed_iterations   [  20% ] 500 VUs  00m55.0s/10m0s  020437/100000 iters, 200 per VU

running (00m56.0s), 500/500 VUs, 20810 complete and 0 interrupted iterations
fixed_iterations   [  21% ] 500 VUs  00m56.0s/10m0s  020810/100000 iters, 200 per VU

running (00m57.0s), 500/500 VUs, 21186 complete and 0 interrupted iterations
fixed_iterations   [  21% ] 500 VUs  00m57.0s/10m0s  021186/100000 iters, 200 per VU

running (00m58.0s), 500/500 VUs, 21558 complete and 0 interrupted iterations
fixed_iterations   [  22% ] 500 VUs  00m58.0s/10m0s  021558/100000 iters, 200 per VU

running (00m59.0s), 500/500 VUs, 21925 complete and 0 interrupted iterations
fixed_iterations   [  22% ] 500 VUs  00m59.0s/10m0s  021925/100000 iters, 200 per VU

running (01m00.0s), 500/500 VUs, 22300 complete and 0 interrupted iterations
fixed_iterations   [  22% ] 500 VUs  01m00.0s/10m0s  022300/100000 iters, 200 per VU

running (01m01.0s), 500/500 VUs, 22668 complete and 0 interrupted iterations
fixed_iterations   [  23% ] 500 VUs  01m01.0s/10m0s  022668/100000 iters, 200 per VU

running (01m02.0s), 500/500 VUs, 23044 complete and 0 interrupted iterations
fixed_iterations   [  23% ] 500 VUs  01m02.0s/10m0s  023044/100000 iters, 200 per VU

running (01m03.0s), 500/500 VUs, 23406 complete and 0 interrupted iterations
fixed_iterations   [  23% ] 500 VUs  01m03.0s/10m0s  023406/100000 iters, 200 per VU

running (01m04.0s), 500/500 VUs, 23768 complete and 0 interrupted iterations
fixed_iterations   [  24% ] 500 VUs  01m04.0s/10m0s  023768/100000 iters, 200 per VU

running (01m05.0s), 500/500 VUs, 24146 complete and 0 interrupted iterations
fixed_iterations   [  24% ] 500 VUs  01m05.0s/10m0s  024146/100000 iters, 200 per VU

running (01m06.0s), 500/500 VUs, 24519 complete and 0 interrupted iterations
fixed_iterations   [  25% ] 500 VUs  01m06.0s/10m0s  024519/100000 iters, 200 per VU

running (01m07.0s), 500/500 VUs, 24886 complete and 0 interrupted iterations
fixed_iterations   [  25% ] 500 VUs  01m07.0s/10m0s  024886/100000 iters, 200 per VU

running (01m08.0s), 500/500 VUs, 25259 complete and 0 interrupted iterations
fixed_iterations   [  25% ] 500 VUs  01m08.0s/10m0s  025259/100000 iters, 200 per VU

running (01m09.0s), 500/500 VUs, 25609 complete and 0 interrupted iterations
fixed_iterations   [  26% ] 500 VUs  01m09.0s/10m0s  025609/100000 iters, 200 per VU

running (01m10.0s), 500/500 VUs, 25982 complete and 0 interrupted iterations
fixed_iterations   [  26% ] 500 VUs  01m10.0s/10m0s  025982/100000 iters, 200 per VU

running (01m11.0s), 500/500 VUs, 26345 complete and 0 interrupted iterations
fixed_iterations   [  26% ] 500 VUs  01m11.0s/10m0s  026345/100000 iters, 200 per VU

running (01m12.0s), 500/500 VUs, 26716 complete and 0 interrupted iterations
fixed_iterations   [  27% ] 500 VUs  01m12.0s/10m0s  026716/100000 iters, 200 per VU

running (01m13.0s), 500/500 VUs, 27083 complete and 0 interrupted iterations
fixed_iterations   [  27% ] 500 VUs  01m13.0s/10m0s  027083/100000 iters, 200 per VU

running (01m14.0s), 500/500 VUs, 27455 complete and 0 interrupted iterations
fixed_iterations   [  27% ] 500 VUs  01m14.0s/10m0s  027455/100000 iters, 200 per VU

running (01m15.0s), 500/500 VUs, 27826 complete and 0 interrupted iterations
fixed_iterations   [  28% ] 500 VUs  01m15.0s/10m0s  027826/100000 iters, 200 per VU

running (01m16.0s), 500/500 VUs, 28203 complete and 0 interrupted iterations
fixed_iterations   [  28% ] 500 VUs  01m16.0s/10m0s  028203/100000 iters, 200 per VU

running (01m17.0s), 500/500 VUs, 28567 complete and 0 interrupted iterations
fixed_iterations   [  29% ] 500 VUs  01m17.0s/10m0s  028567/100000 iters, 200 per VU

running (01m18.0s), 500/500 VUs, 28929 complete and 0 interrupted iterations
fixed_iterations   [  29% ] 500 VUs  01m18.0s/10m0s  028929/100000 iters, 200 per VU

running (01m19.0s), 500/500 VUs, 29296 complete and 0 interrupted iterations
fixed_iterations   [  29% ] 500 VUs  01m19.0s/10m0s  029296/100000 iters, 200 per VU

running (01m20.0s), 500/500 VUs, 29670 complete and 0 interrupted iterations
fixed_iterations   [  30% ] 500 VUs  01m20.0s/10m0s  029670/100000 iters, 200 per VU

running (01m21.0s), 500/500 VUs, 30041 complete and 0 interrupted iterations
fixed_iterations   [  30% ] 500 VUs  01m21.0s/10m0s  030041/100000 iters, 200 per VU

running (01m22.0s), 500/500 VUs, 30407 complete and 0 interrupted iterations
fixed_iterations   [  30% ] 500 VUs  01m22.0s/10m0s  030407/100000 iters, 200 per VU

running (01m23.0s), 500/500 VUs, 30770 complete and 0 interrupted iterations
fixed_iterations   [  31% ] 500 VUs  01m23.0s/10m0s  030770/100000 iters, 200 per VU

running (01m24.0s), 500/500 VUs, 31127 complete and 0 interrupted iterations
fixed_iterations   [  31% ] 500 VUs  01m24.0s/10m0s  031127/100000 iters, 200 per VU

running (01m25.0s), 500/500 VUs, 31490 complete and 0 interrupted iterations
fixed_iterations   [  31% ] 500 VUs  01m25.0s/10m0s  031490/100000 iters, 200 per VU

running (01m26.0s), 500/500 VUs, 31864 complete and 0 interrupted iterations
fixed_iterations   [  32% ] 500 VUs  01m26.0s/10m0s  031864/100000 iters, 200 per VU

running (01m27.0s), 500/500 VUs, 32233 complete and 0 interrupted iterations
fixed_iterations   [  32% ] 500 VUs  01m27.0s/10m0s  032233/100000 iters, 200 per VU

running (01m28.0s), 500/500 VUs, 32605 complete and 0 interrupted iterations
fixed_iterations   [  33% ] 500 VUs  01m28.0s/10m0s  032605/100000 iters, 200 per VU

running (01m29.0s), 500/500 VUs, 32978 complete and 0 interrupted iterations
fixed_iterations   [  33% ] 500 VUs  01m29.0s/10m0s  032978/100000 iters, 200 per VU

running (01m30.0s), 500/500 VUs, 33345 complete and 0 interrupted iterations
fixed_iterations   [  33% ] 500 VUs  01m30.0s/10m0s  033345/100000 iters, 200 per VU

running (01m31.0s), 500/500 VUs, 33710 complete and 0 interrupted iterations
fixed_iterations   [  34% ] 500 VUs  01m31.0s/10m0s  033710/100000 iters, 200 per VU

running (01m32.0s), 500/500 VUs, 34075 complete and 0 interrupted iterations
fixed_iterations   [  34% ] 500 VUs  01m32.0s/10m0s  034075/100000 iters, 200 per VU

running (01m33.0s), 500/500 VUs, 34444 complete and 0 interrupted iterations
fixed_iterations   [  34% ] 500 VUs  01m33.0s/10m0s  034444/100000 iters, 200 per VU

running (01m34.0s), 500/500 VUs, 34807 complete and 0 interrupted iterations
fixed_iterations   [  35% ] 500 VUs  01m34.0s/10m0s  034807/100000 iters, 200 per VU

running (01m35.0s), 500/500 VUs, 35180 complete and 0 interrupted iterations
fixed_iterations   [  35% ] 500 VUs  01m35.0s/10m0s  035180/100000 iters, 200 per VU

running (01m36.0s), 500/500 VUs, 35560 complete and 0 interrupted iterations
fixed_iterations   [  36% ] 500 VUs  01m36.0s/10m0s  035560/100000 iters, 200 per VU

running (01m37.0s), 500/500 VUs, 35931 complete and 0 interrupted iterations
fixed_iterations   [  36% ] 500 VUs  01m37.0s/10m0s  035931/100000 iters, 200 per VU

running (01m38.0s), 500/500 VUs, 36293 complete and 0 interrupted iterations
fixed_iterations   [  36% ] 500 VUs  01m38.0s/10m0s  036293/100000 iters, 200 per VU

running (01m39.0s), 500/500 VUs, 36654 complete and 0 interrupted iterations
fixed_iterations   [  37% ] 500 VUs  01m39.0s/10m0s  036654/100000 iters, 200 per VU

running (01m40.0s), 500/500 VUs, 37024 complete and 0 interrupted iterations
fixed_iterations   [  37% ] 500 VUs  01m40.0s/10m0s  037024/100000 iters, 200 per VU

running (01m41.0s), 500/500 VUs, 37414 complete and 0 interrupted iterations
fixed_iterations   [  37% ] 500 VUs  01m41.0s/10m0s  037414/100000 iters, 200 per VU

running (01m42.0s), 500/500 VUs, 37782 complete and 0 interrupted iterations
fixed_iterations   [  38% ] 500 VUs  01m42.0s/10m0s  037782/100000 iters, 200 per VU

running (01m43.0s), 500/500 VUs, 38144 complete and 0 interrupted iterations
fixed_iterations   [  38% ] 500 VUs  01m43.0s/10m0s  038144/100000 iters, 200 per VU

running (01m44.0s), 500/500 VUs, 38506 complete and 0 interrupted iterations
fixed_iterations   [  39% ] 500 VUs  01m44.0s/10m0s  038506/100000 iters, 200 per VU

running (01m45.0s), 500/500 VUs, 38876 complete and 0 interrupted iterations
fixed_iterations   [  39% ] 500 VUs  01m45.0s/10m0s  038876/100000 iters, 200 per VU

running (01m46.0s), 500/500 VUs, 39248 complete and 0 interrupted iterations
fixed_iterations   [  39% ] 500 VUs  01m46.0s/10m0s  039248/100000 iters, 200 per VU

running (01m47.0s), 500/500 VUs, 39619 complete and 0 interrupted iterations
fixed_iterations   [  40% ] 500 VUs  01m47.0s/10m0s  039619/100000 iters, 200 per VU

running (01m48.0s), 500/500 VUs, 39990 complete and 0 interrupted iterations
fixed_iterations   [  40% ] 500 VUs  01m48.0s/10m0s  039990/100000 iters, 200 per VU

running (01m49.0s), 500/500 VUs, 40345 complete and 0 interrupted iterations
fixed_iterations   [  40% ] 500 VUs  01m49.0s/10m0s  040345/100000 iters, 200 per VU

running (01m50.0s), 500/500 VUs, 40712 complete and 0 interrupted iterations
fixed_iterations   [  41% ] 500 VUs  01m50.0s/10m0s  040712/100000 iters, 200 per VU

running (01m51.0s), 500/500 VUs, 41089 complete and 0 interrupted iterations
fixed_iterations   [  41% ] 500 VUs  01m51.0s/10m0s  041089/100000 iters, 200 per VU

running (01m52.0s), 500/500 VUs, 41462 complete and 0 interrupted iterations
fixed_iterations   [  41% ] 500 VUs  01m52.0s/10m0s  041462/100000 iters, 200 per VU

running (01m53.0s), 500/500 VUs, 41838 complete and 0 interrupted iterations
fixed_iterations   [  42% ] 500 VUs  01m53.0s/10m0s  041838/100000 iters, 200 per VU

running (01m54.0s), 500/500 VUs, 42209 complete and 0 interrupted iterations
fixed_iterations   [  42% ] 500 VUs  01m54.0s/10m0s  042209/100000 iters, 200 per VU

running (01m55.0s), 500/500 VUs, 42586 complete and 0 interrupted iterations
fixed_iterations   [  43% ] 500 VUs  01m55.0s/10m0s  042586/100000 iters, 200 per VU

running (01m56.0s), 500/500 VUs, 42970 complete and 0 interrupted iterations
fixed_iterations   [  43% ] 500 VUs  01m56.0s/10m0s  042970/100000 iters, 200 per VU

running (01m57.0s), 500/500 VUs, 43336 complete and 0 interrupted iterations
fixed_iterations   [  43% ] 500 VUs  01m57.0s/10m0s  043336/100000 iters, 200 per VU

running (01m58.0s), 500/500 VUs, 43694 complete and 0 interrupted iterations
fixed_iterations   [  44% ] 500 VUs  01m58.0s/10m0s  043694/100000 iters, 200 per VU

running (01m59.0s), 500/500 VUs, 44070 complete and 0 interrupted iterations
fixed_iterations   [  44% ] 500 VUs  01m59.0s/10m0s  044070/100000 iters, 200 per VU

running (02m00.0s), 500/500 VUs, 44435 complete and 0 interrupted iterations
fixed_iterations   [  44% ] 500 VUs  02m00.0s/10m0s  044435/100000 iters, 200 per VU

running (02m01.0s), 500/500 VUs, 44804 complete and 0 interrupted iterations
fixed_iterations   [  45% ] 500 VUs  02m01.0s/10m0s  044804/100000 iters, 200 per VU

running (02m02.0s), 500/500 VUs, 45178 complete and 0 interrupted iterations
fixed_iterations   [  45% ] 500 VUs  02m02.0s/10m0s  045178/100000 iters, 200 per VU

running (02m03.0s), 500/500 VUs, 45550 complete and 0 interrupted iterations
fixed_iterations   [  46% ] 500 VUs  02m03.0s/10m0s  045550/100000 iters, 200 per VU

running (02m04.0s), 500/500 VUs, 45923 complete and 0 interrupted iterations
fixed_iterations   [  46% ] 500 VUs  02m04.0s/10m0s  045923/100000 iters, 200 per VU

running (02m05.0s), 500/500 VUs, 46282 complete and 0 interrupted iterations
fixed_iterations   [  46% ] 500 VUs  02m05.0s/10m0s  046282/100000 iters, 200 per VU

running (02m06.0s), 500/500 VUs, 46644 complete and 0 interrupted iterations
fixed_iterations   [  47% ] 500 VUs  02m06.0s/10m0s  046644/100000 iters, 200 per VU

running (02m07.0s), 500/500 VUs, 47010 complete and 0 interrupted iterations
fixed_iterations   [  47% ] 500 VUs  02m07.0s/10m0s  047010/100000 iters, 200 per VU

running (02m08.0s), 500/500 VUs, 47392 complete and 0 interrupted iterations
fixed_iterations   [  47% ] 500 VUs  02m08.0s/10m0s  047392/100000 iters, 200 per VU

running (02m09.0s), 500/500 VUs, 47754 complete and 0 interrupted iterations
fixed_iterations   [  48% ] 500 VUs  02m09.0s/10m0s  047754/100000 iters, 200 per VU

running (02m10.0s), 500/500 VUs, 48117 complete and 0 interrupted iterations
fixed_iterations   [  48% ] 500 VUs  02m10.0s/10m0s  048117/100000 iters, 200 per VU

running (02m11.0s), 500/500 VUs, 48489 complete and 0 interrupted iterations
fixed_iterations   [  48% ] 500 VUs  02m11.0s/10m0s  048489/100000 iters, 200 per VU

running (02m12.0s), 500/500 VUs, 48859 complete and 0 interrupted iterations
fixed_iterations   [  49% ] 500 VUs  02m12.0s/10m0s  048859/100000 iters, 200 per VU

running (02m13.0s), 500/500 VUs, 49222 complete and 0 interrupted iterations
fixed_iterations   [  49% ] 500 VUs  02m13.0s/10m0s  049222/100000 iters, 200 per VU

running (02m14.0s), 500/500 VUs, 49601 complete and 0 interrupted iterations
fixed_iterations   [  50% ] 500 VUs  02m14.0s/10m0s  049601/100000 iters, 200 per VU

running (02m15.0s), 500/500 VUs, 49978 complete and 0 interrupted iterations
fixed_iterations   [  50% ] 500 VUs  02m15.0s/10m0s  049978/100000 iters, 200 per VU

running (02m16.0s), 500/500 VUs, 50359 complete and 0 interrupted iterations
fixed_iterations   [  50% ] 500 VUs  02m16.0s/10m0s  050359/100000 iters, 200 per VU

running (02m17.0s), 500/500 VUs, 50728 complete and 0 interrupted iterations
fixed_iterations   [  51% ] 500 VUs  02m17.0s/10m0s  050728/100000 iters, 200 per VU

running (02m18.0s), 500/500 VUs, 51089 complete and 0 interrupted iterations
fixed_iterations   [  51% ] 500 VUs  02m18.0s/10m0s  051089/100000 iters, 200 per VU

running (02m19.0s), 500/500 VUs, 51469 complete and 0 interrupted iterations
fixed_iterations   [  51% ] 500 VUs  02m19.0s/10m0s  051469/100000 iters, 200 per VU

running (02m20.0s), 500/500 VUs, 51838 complete and 0 interrupted iterations
fixed_iterations   [  52% ] 500 VUs  02m20.0s/10m0s  051838/100000 iters, 200 per VU

running (02m21.0s), 500/500 VUs, 52205 complete and 0 interrupted iterations
fixed_iterations   [  52% ] 500 VUs  02m21.0s/10m0s  052205/100000 iters, 200 per VU

running (02m22.0s), 500/500 VUs, 52566 complete and 0 interrupted iterations
fixed_iterations   [  53% ] 500 VUs  02m22.0s/10m0s  052566/100000 iters, 200 per VU

running (02m23.0s), 500/500 VUs, 52947 complete and 0 interrupted iterations
fixed_iterations   [  53% ] 500 VUs  02m23.0s/10m0s  052947/100000 iters, 200 per VU

running (02m24.0s), 500/500 VUs, 53317 complete and 0 interrupted iterations
fixed_iterations   [  53% ] 500 VUs  02m24.0s/10m0s  053317/100000 iters, 200 per VU

running (02m25.0s), 500/500 VUs, 53689 complete and 0 interrupted iterations
fixed_iterations   [  54% ] 500 VUs  02m25.0s/10m0s  053689/100000 iters, 200 per VU

running (02m26.0s), 500/500 VUs, 54063 complete and 0 interrupted iterations
fixed_iterations   [  54% ] 500 VUs  02m26.0s/10m0s  054063/100000 iters, 200 per VU

running (02m27.0s), 500/500 VUs, 54441 complete and 0 interrupted iterations
fixed_iterations   [  54% ] 500 VUs  02m27.0s/10m0s  054441/100000 iters, 200 per VU

running (02m28.0s), 500/500 VUs, 54810 complete and 0 interrupted iterations
fixed_iterations   [  55% ] 500 VUs  02m28.0s/10m0s  054810/100000 iters, 200 per VU

running (02m29.0s), 500/500 VUs, 55174 complete and 0 interrupted iterations
fixed_iterations   [  55% ] 500 VUs  02m29.0s/10m0s  055174/100000 iters, 200 per VU

running (02m30.0s), 500/500 VUs, 55548 complete and 0 interrupted iterations
fixed_iterations   [  56% ] 500 VUs  02m30.0s/10m0s  055548/100000 iters, 200 per VU

running (02m31.0s), 500/500 VUs, 55908 complete and 0 interrupted iterations
fixed_iterations   [  56% ] 500 VUs  02m31.0s/10m0s  055908/100000 iters, 200 per VU

running (02m32.0s), 500/500 VUs, 56290 complete and 0 interrupted iterations
fixed_iterations   [  56% ] 500 VUs  02m32.0s/10m0s  056290/100000 iters, 200 per VU

running (02m33.0s), 500/500 VUs, 56674 complete and 0 interrupted iterations
fixed_iterations   [  57% ] 500 VUs  02m33.0s/10m0s  056674/100000 iters, 200 per VU

running (02m34.0s), 500/500 VUs, 57039 complete and 0 interrupted iterations
fixed_iterations   [  57% ] 500 VUs  02m34.0s/10m0s  057039/100000 iters, 200 per VU

running (02m35.0s), 500/500 VUs, 57408 complete and 0 interrupted iterations
fixed_iterations   [  57% ] 500 VUs  02m35.0s/10m0s  057408/100000 iters, 200 per VU

running (02m36.0s), 500/500 VUs, 57775 complete and 0 interrupted iterations
fixed_iterations   [  58% ] 500 VUs  02m36.0s/10m0s  057775/100000 iters, 200 per VU

running (02m37.0s), 500/500 VUs, 58143 complete and 0 interrupted iterations
fixed_iterations   [  58% ] 500 VUs  02m37.0s/10m0s  058143/100000 iters, 200 per VU

running (02m38.0s), 500/500 VUs, 58524 complete and 0 interrupted iterations
fixed_iterations   [  59% ] 500 VUs  02m38.0s/10m0s  058524/100000 iters, 200 per VU

running (02m39.0s), 500/500 VUs, 58888 complete and 0 interrupted iterations
fixed_iterations   [  59% ] 500 VUs  02m39.0s/10m0s  058888/100000 iters, 200 per VU

running (02m40.0s), 500/500 VUs, 59261 complete and 0 interrupted iterations
fixed_iterations   [  59% ] 500 VUs  02m40.0s/10m0s  059261/100000 iters, 200 per VU

running (02m41.0s), 500/500 VUs, 59604 complete and 0 interrupted iterations
fixed_iterations   [  60% ] 500 VUs  02m41.0s/10m0s  059604/100000 iters, 200 per VU

running (02m42.0s), 500/500 VUs, 59962 complete and 0 interrupted iterations
fixed_iterations   [  60% ] 500 VUs  02m42.0s/10m0s  059962/100000 iters, 200 per VU

running (02m43.0s), 500/500 VUs, 60371 complete and 0 interrupted iterations
fixed_iterations   [  60% ] 500 VUs  02m43.0s/10m0s  060371/100000 iters, 200 per VU

running (02m44.0s), 500/500 VUs, 60740 complete and 0 interrupted iterations
fixed_iterations   [  61% ] 500 VUs  02m44.0s/10m0s  060740/100000 iters, 200 per VU

running (02m45.0s), 500/500 VUs, 61118 complete and 0 interrupted iterations
fixed_iterations   [  61% ] 500 VUs  02m45.0s/10m0s  061118/100000 iters, 200 per VU

running (02m46.0s), 500/500 VUs, 61487 complete and 0 interrupted iterations
fixed_iterations   [  61% ] 500 VUs  02m46.0s/10m0s  061487/100000 iters, 200 per VU

running (02m47.0s), 500/500 VUs, 61852 complete and 0 interrupted iterations
fixed_iterations   [  62% ] 500 VUs  02m47.0s/10m0s  061852/100000 iters, 200 per VU

running (02m48.0s), 500/500 VUs, 62215 complete and 0 interrupted iterations
fixed_iterations   [  62% ] 500 VUs  02m48.0s/10m0s  062215/100000 iters, 200 per VU

running (02m49.0s), 500/500 VUs, 62579 complete and 0 interrupted iterations
fixed_iterations   [  63% ] 500 VUs  02m49.0s/10m0s  062579/100000 iters, 200 per VU

running (02m50.0s), 500/500 VUs, 62943 complete and 0 interrupted iterations
fixed_iterations   [  63% ] 500 VUs  02m50.0s/10m0s  062943/100000 iters, 200 per VU

running (02m51.0s), 500/500 VUs, 63323 complete and 0 interrupted iterations
fixed_iterations   [  63% ] 500 VUs  02m51.0s/10m0s  063323/100000 iters, 200 per VU

running (02m52.0s), 500/500 VUs, 63695 complete and 0 interrupted iterations
fixed_iterations   [  64% ] 500 VUs  02m52.0s/10m0s  063695/100000 iters, 200 per VU

running (02m53.0s), 500/500 VUs, 64059 complete and 0 interrupted iterations
fixed_iterations   [  64% ] 500 VUs  02m53.0s/10m0s  064059/100000 iters, 200 per VU

running (02m54.0s), 500/500 VUs, 64432 complete and 0 interrupted iterations
fixed_iterations   [  64% ] 500 VUs  02m54.0s/10m0s  064432/100000 iters, 200 per VU

running (02m55.0s), 500/500 VUs, 64790 complete and 0 interrupted iterations
fixed_iterations   [  65% ] 500 VUs  02m55.0s/10m0s  064790/100000 iters, 200 per VU

running (02m56.0s), 500/500 VUs, 65158 complete and 0 interrupted iterations
fixed_iterations   [  65% ] 500 VUs  02m56.0s/10m0s  065158/100000 iters, 200 per VU

running (02m57.0s), 500/500 VUs, 65526 complete and 0 interrupted iterations
fixed_iterations   [  66% ] 500 VUs  02m57.0s/10m0s  065526/100000 iters, 200 per VU

running (02m58.0s), 500/500 VUs, 65902 complete and 0 interrupted iterations
fixed_iterations   [  66% ] 500 VUs  02m58.0s/10m0s  065902/100000 iters, 200 per VU

running (02m59.0s), 500/500 VUs, 66279 complete and 0 interrupted iterations
fixed_iterations   [  66% ] 500 VUs  02m59.0s/10m0s  066279/100000 iters, 200 per VU

running (03m00.0s), 500/500 VUs, 66654 complete and 0 interrupted iterations
fixed_iterations   [  67% ] 500 VUs  03m00.0s/10m0s  066654/100000 iters, 200 per VU

running (03m01.0s), 500/500 VUs, 67027 complete and 0 interrupted iterations
fixed_iterations   [  67% ] 500 VUs  03m01.0s/10m0s  067027/100000 iters, 200 per VU

running (03m02.0s), 500/500 VUs, 67398 complete and 0 interrupted iterations
fixed_iterations   [  67% ] 500 VUs  03m02.0s/10m0s  067398/100000 iters, 200 per VU

running (03m03.0s), 500/500 VUs, 67767 complete and 0 interrupted iterations
fixed_iterations   [  68% ] 500 VUs  03m03.0s/10m0s  067767/100000 iters, 200 per VU

running (03m04.0s), 500/500 VUs, 68133 complete and 0 interrupted iterations
fixed_iterations   [  68% ] 500 VUs  03m04.0s/10m0s  068133/100000 iters, 200 per VU

running (03m05.0s), 500/500 VUs, 68505 complete and 0 interrupted iterations
fixed_iterations   [  69% ] 500 VUs  03m05.0s/10m0s  068505/100000 iters, 200 per VU

running (03m06.0s), 500/500 VUs, 68873 complete and 0 interrupted iterations
fixed_iterations   [  69% ] 500 VUs  03m06.0s/10m0s  068873/100000 iters, 200 per VU

running (03m07.0s), 500/500 VUs, 69241 complete and 0 interrupted iterations
fixed_iterations   [  69% ] 500 VUs  03m07.0s/10m0s  069241/100000 iters, 200 per VU

running (03m08.0s), 500/500 VUs, 69614 complete and 0 interrupted iterations
fixed_iterations   [  70% ] 500 VUs  03m08.0s/10m0s  069614/100000 iters, 200 per VU

running (03m09.0s), 500/500 VUs, 69980 complete and 0 interrupted iterations
fixed_iterations   [  70% ] 500 VUs  03m09.0s/10m0s  069980/100000 iters, 200 per VU

running (03m10.0s), 500/500 VUs, 70353 complete and 0 interrupted iterations
fixed_iterations   [  70% ] 500 VUs  03m10.0s/10m0s  070353/100000 iters, 200 per VU

running (03m11.0s), 500/500 VUs, 70720 complete and 0 interrupted iterations
fixed_iterations   [  71% ] 500 VUs  03m11.0s/10m0s  070720/100000 iters, 200 per VU

running (03m12.0s), 500/500 VUs, 71092 complete and 0 interrupted iterations
fixed_iterations   [  71% ] 500 VUs  03m12.0s/10m0s  071092/100000 iters, 200 per VU

running (03m13.0s), 500/500 VUs, 71458 complete and 0 interrupted iterations
fixed_iterations   [  71% ] 500 VUs  03m13.0s/10m0s  071458/100000 iters, 200 per VU

running (03m14.0s), 500/500 VUs, 71816 complete and 0 interrupted iterations
fixed_iterations   [  72% ] 500 VUs  03m14.0s/10m0s  071816/100000 iters, 200 per VU

running (03m15.0s), 500/500 VUs, 72178 complete and 0 interrupted iterations
fixed_iterations   [  72% ] 500 VUs  03m15.0s/10m0s  072178/100000 iters, 200 per VU

running (03m16.0s), 500/500 VUs, 72549 complete and 0 interrupted iterations
fixed_iterations   [  73% ] 500 VUs  03m16.0s/10m0s  072549/100000 iters, 200 per VU

running (03m17.0s), 500/500 VUs, 72907 complete and 0 interrupted iterations
fixed_iterations   [  73% ] 500 VUs  03m17.0s/10m0s  072907/100000 iters, 200 per VU

running (03m18.0s), 500/500 VUs, 73287 complete and 0 interrupted iterations
fixed_iterations   [  73% ] 500 VUs  03m18.0s/10m0s  073287/100000 iters, 200 per VU

running (03m19.0s), 500/500 VUs, 73645 complete and 0 interrupted iterations
fixed_iterations   [  74% ] 500 VUs  03m19.0s/10m0s  073645/100000 iters, 200 per VU

running (03m20.0s), 500/500 VUs, 74008 complete and 0 interrupted iterations
fixed_iterations   [  74% ] 500 VUs  03m20.0s/10m0s  074008/100000 iters, 200 per VU

running (03m21.0s), 500/500 VUs, 74375 complete and 0 interrupted iterations
fixed_iterations   [  74% ] 500 VUs  03m21.0s/10m0s  074375/100000 iters, 200 per VU

running (03m22.0s), 500/500 VUs, 74743 complete and 0 interrupted iterations
fixed_iterations   [  75% ] 500 VUs  03m22.0s/10m0s  074743/100000 iters, 200 per VU

running (03m23.0s), 500/500 VUs, 75117 complete and 0 interrupted iterations
fixed_iterations   [  75% ] 500 VUs  03m23.0s/10m0s  075117/100000 iters, 200 per VU

running (03m24.0s), 500/500 VUs, 75500 complete and 0 interrupted iterations
fixed_iterations   [  76% ] 500 VUs  03m24.0s/10m0s  075500/100000 iters, 200 per VU

running (03m25.0s), 500/500 VUs, 75874 complete and 0 interrupted iterations
fixed_iterations   [  76% ] 500 VUs  03m25.0s/10m0s  075874/100000 iters, 200 per VU

running (03m26.0s), 500/500 VUs, 76244 complete and 0 interrupted iterations
fixed_iterations   [  76% ] 500 VUs  03m26.0s/10m0s  076244/100000 iters, 200 per VU

running (03m27.0s), 500/500 VUs, 76620 complete and 0 interrupted iterations
fixed_iterations   [  77% ] 500 VUs  03m27.0s/10m0s  076620/100000 iters, 200 per VU

running (03m28.0s), 500/500 VUs, 76985 complete and 0 interrupted iterations
fixed_iterations   [  77% ] 500 VUs  03m28.0s/10m0s  076985/100000 iters, 200 per VU

running (03m29.0s), 500/500 VUs, 77343 complete and 0 interrupted iterations
fixed_iterations   [  77% ] 500 VUs  03m29.0s/10m0s  077343/100000 iters, 200 per VU

running (03m30.0s), 500/500 VUs, 77708 complete and 0 interrupted iterations
fixed_iterations   [  78% ] 500 VUs  03m30.0s/10m0s  077708/100000 iters, 200 per VU

running (03m31.0s), 500/500 VUs, 78080 complete and 0 interrupted iterations
fixed_iterations   [  78% ] 500 VUs  03m31.0s/10m0s  078080/100000 iters, 200 per VU

running (03m32.0s), 500/500 VUs, 78450 complete and 0 interrupted iterations
fixed_iterations   [  78% ] 500 VUs  03m32.0s/10m0s  078450/100000 iters, 200 per VU

running (03m33.0s), 500/500 VUs, 78844 complete and 0 interrupted iterations
fixed_iterations   [  79% ] 500 VUs  03m33.0s/10m0s  078844/100000 iters, 200 per VU

running (03m34.0s), 500/500 VUs, 79224 complete and 0 interrupted iterations
fixed_iterations   [  79% ] 500 VUs  03m34.0s/10m0s  079224/100000 iters, 200 per VU

running (03m35.0s), 500/500 VUs, 79600 complete and 0 interrupted iterations
fixed_iterations   [  80% ] 500 VUs  03m35.0s/10m0s  079600/100000 iters, 200 per VU

running (03m36.0s), 500/500 VUs, 79966 complete and 0 interrupted iterations
fixed_iterations   [  80% ] 500 VUs  03m36.0s/10m0s  079966/100000 iters, 200 per VU

running (03m37.0s), 500/500 VUs, 80337 complete and 0 interrupted iterations
fixed_iterations   [  80% ] 500 VUs  03m37.0s/10m0s  080337/100000 iters, 200 per VU

running (03m38.0s), 500/500 VUs, 80708 complete and 0 interrupted iterations
fixed_iterations   [  81% ] 500 VUs  03m38.0s/10m0s  080708/100000 iters, 200 per VU

running (03m39.0s), 500/500 VUs, 81080 complete and 0 interrupted iterations
fixed_iterations   [  81% ] 500 VUs  03m39.0s/10m0s  081080/100000 iters, 200 per VU

running (03m40.0s), 500/500 VUs, 81448 complete and 0 interrupted iterations
fixed_iterations   [  81% ] 500 VUs  03m40.0s/10m0s  081448/100000 iters, 200 per VU

running (03m41.0s), 500/500 VUs, 81813 complete and 0 interrupted iterations
fixed_iterations   [  82% ] 500 VUs  03m41.0s/10m0s  081813/100000 iters, 200 per VU

running (03m42.0s), 500/500 VUs, 82181 complete and 0 interrupted iterations
fixed_iterations   [  82% ] 500 VUs  03m42.0s/10m0s  082181/100000 iters, 200 per VU

running (03m43.0s), 500/500 VUs, 82547 complete and 0 interrupted iterations
fixed_iterations   [  83% ] 500 VUs  03m43.0s/10m0s  082547/100000 iters, 200 per VU

running (03m44.0s), 500/500 VUs, 82911 complete and 0 interrupted iterations
fixed_iterations   [  83% ] 500 VUs  03m44.0s/10m0s  082911/100000 iters, 200 per VU

running (03m45.0s), 500/500 VUs, 83277 complete and 0 interrupted iterations
fixed_iterations   [  83% ] 500 VUs  03m45.0s/10m0s  083277/100000 iters, 200 per VU

running (03m46.0s), 500/500 VUs, 83640 complete and 0 interrupted iterations
fixed_iterations   [  84% ] 500 VUs  03m46.0s/10m0s  083640/100000 iters, 200 per VU

running (03m47.0s), 500/500 VUs, 84005 complete and 0 interrupted iterations
fixed_iterations   [  84% ] 500 VUs  03m47.0s/10m0s  084005/100000 iters, 200 per VU

running (03m48.0s), 500/500 VUs, 84373 complete and 0 interrupted iterations
fixed_iterations   [  84% ] 500 VUs  03m48.0s/10m0s  084373/100000 iters, 200 per VU

running (03m49.0s), 500/500 VUs, 84739 complete and 0 interrupted iterations
fixed_iterations   [  85% ] 500 VUs  03m49.0s/10m0s  084739/100000 iters, 200 per VU

running (03m50.0s), 500/500 VUs, 85106 complete and 0 interrupted iterations
fixed_iterations   [  85% ] 500 VUs  03m50.0s/10m0s  085106/100000 iters, 200 per VU

running (03m51.0s), 500/500 VUs, 85478 complete and 0 interrupted iterations
fixed_iterations   [  85% ] 500 VUs  03m51.0s/10m0s  085478/100000 iters, 200 per VU

running (03m52.0s), 500/500 VUs, 85836 complete and 0 interrupted iterations
fixed_iterations   [  86% ] 500 VUs  03m52.0s/10m0s  085836/100000 iters, 200 per VU

running (03m53.0s), 500/500 VUs, 86205 complete and 0 interrupted iterations
fixed_iterations   [  86% ] 500 VUs  03m53.0s/10m0s  086205/100000 iters, 200 per VU

running (03m54.0s), 500/500 VUs, 86580 complete and 0 interrupted iterations
fixed_iterations   [  87% ] 500 VUs  03m54.0s/10m0s  086580/100000 iters, 200 per VU

running (03m55.0s), 500/500 VUs, 86953 complete and 0 interrupted iterations
fixed_iterations   [  87% ] 500 VUs  03m55.0s/10m0s  086953/100000 iters, 200 per VU

running (03m56.0s), 500/500 VUs, 87338 complete and 0 interrupted iterations
fixed_iterations   [  87% ] 500 VUs  03m56.0s/10m0s  087338/100000 iters, 200 per VU

running (03m57.0s), 500/500 VUs, 87718 complete and 0 interrupted iterations
fixed_iterations   [  88% ] 500 VUs  03m57.0s/10m0s  087718/100000 iters, 200 per VU

running (03m58.0s), 500/500 VUs, 88096 complete and 0 interrupted iterations
fixed_iterations   [  88% ] 500 VUs  03m58.0s/10m0s  088096/100000 iters, 200 per VU

running (03m59.0s), 500/500 VUs, 88460 complete and 0 interrupted iterations
fixed_iterations   [  88% ] 500 VUs  03m59.0s/10m0s  088460/100000 iters, 200 per VU

running (04m00.0s), 500/500 VUs, 88822 complete and 0 interrupted iterations
fixed_iterations   [  89% ] 500 VUs  04m00.0s/10m0s  088822/100000 iters, 200 per VU

running (04m01.0s), 500/500 VUs, 89189 complete and 0 interrupted iterations
fixed_iterations   [  89% ] 500 VUs  04m01.0s/10m0s  089189/100000 iters, 200 per VU

running (04m02.0s), 500/500 VUs, 89560 complete and 0 interrupted iterations
fixed_iterations   [  90% ] 500 VUs  04m02.0s/10m0s  089560/100000 iters, 200 per VU

running (04m03.0s), 500/500 VUs, 89938 complete and 0 interrupted iterations
fixed_iterations   [  90% ] 500 VUs  04m03.0s/10m0s  089938/100000 iters, 200 per VU

running (04m04.0s), 500/500 VUs, 90309 complete and 0 interrupted iterations
fixed_iterations   [  90% ] 500 VUs  04m04.0s/10m0s  090309/100000 iters, 200 per VU

running (04m05.0s), 500/500 VUs, 90670 complete and 0 interrupted iterations
fixed_iterations   [  91% ] 500 VUs  04m05.0s/10m0s  090670/100000 iters, 200 per VU

running (04m06.0s), 500/500 VUs, 91044 complete and 0 interrupted iterations
fixed_iterations   [  91% ] 500 VUs  04m06.0s/10m0s  091044/100000 iters, 200 per VU

running (04m07.0s), 500/500 VUs, 91407 complete and 0 interrupted iterations
fixed_iterations   [  91% ] 500 VUs  04m07.0s/10m0s  091407/100000 iters, 200 per VU

running (04m08.0s), 500/500 VUs, 91781 complete and 0 interrupted iterations
fixed_iterations   [  92% ] 500 VUs  04m08.0s/10m0s  091781/100000 iters, 200 per VU

running (04m09.0s), 500/500 VUs, 92149 complete and 0 interrupted iterations
fixed_iterations   [  92% ] 500 VUs  04m09.0s/10m0s  092149/100000 iters, 200 per VU

running (04m10.0s), 500/500 VUs, 92506 complete and 0 interrupted iterations
fixed_iterations   [  93% ] 500 VUs  04m10.0s/10m0s  092506/100000 iters, 200 per VU

running (04m11.0s), 500/500 VUs, 92873 complete and 0 interrupted iterations
fixed_iterations   [  93% ] 500 VUs  04m11.0s/10m0s  092873/100000 iters, 200 per VU

running (04m12.0s), 500/500 VUs, 93239 complete and 0 interrupted iterations
fixed_iterations   [  93% ] 500 VUs  04m12.0s/10m0s  093239/100000 iters, 200 per VU

running (04m13.0s), 500/500 VUs, 93597 complete and 0 interrupted iterations
fixed_iterations   [  94% ] 500 VUs  04m13.0s/10m0s  093597/100000 iters, 200 per VU

running (04m14.0s), 500/500 VUs, 93964 complete and 0 interrupted iterations
fixed_iterations   [  94% ] 500 VUs  04m14.0s/10m0s  093964/100000 iters, 200 per VU

running (04m15.0s), 500/500 VUs, 94335 complete and 0 interrupted iterations
fixed_iterations   [  94% ] 500 VUs  04m15.0s/10m0s  094335/100000 iters, 200 per VU

running (04m16.0s), 500/500 VUs, 94700 complete and 0 interrupted iterations
fixed_iterations   [  95% ] 500 VUs  04m16.0s/10m0s  094700/100000 iters, 200 per VU

running (04m17.0s), 500/500 VUs, 95077 complete and 0 interrupted iterations
fixed_iterations   [  95% ] 500 VUs  04m17.0s/10m0s  095077/100000 iters, 200 per VU

running (04m18.0s), 500/500 VUs, 95446 complete and 0 interrupted iterations
fixed_iterations   [  95% ] 500 VUs  04m18.0s/10m0s  095446/100000 iters, 200 per VU

running (04m19.0s), 500/500 VUs, 95815 complete and 0 interrupted iterations
fixed_iterations   [  96% ] 500 VUs  04m19.0s/10m0s  095815/100000 iters, 200 per VU

running (04m20.0s), 500/500 VUs, 96182 complete and 0 interrupted iterations
fixed_iterations   [  96% ] 500 VUs  04m20.0s/10m0s  096182/100000 iters, 200 per VU

running (04m21.0s), 500/500 VUs, 96623 complete and 0 interrupted iterations
fixed_iterations   [  97% ] 500 VUs  04m21.0s/10m0s  096623/100000 iters, 200 per VU

running (04m22.0s), 500/500 VUs, 96993 complete and 0 interrupted iterations
fixed_iterations   [  97% ] 500 VUs  04m22.0s/10m0s  096993/100000 iters, 200 per VU

running (04m23.0s), 500/500 VUs, 97940 complete and 0 interrupted iterations
fixed_iterations   [  98% ] 500 VUs  04m23.0s/10m0s  097940/100000 iters, 200 per VU

running (04m24.0s), 495/500 VUs, 98950 complete and 0 interrupted iterations
fixed_iterations   [  99% ] 500 VUs  04m24.0s/10m0s  098950/100000 iters, 200 per VU

running (04m24.9s), 000/500 VUs, 100000 complete and 0 interrupted iterations
fixed_iterations ✓ [ 100% ] 500 VUs  04m24.9s/10m0s  100000/100000 iters, 200 per VU


  █ TOTAL RESULTS 

    checks_total.......: 100000  377.504014/s
    checks_succeeded...: 100.00% 100000 out of 100000
    checks_failed......: 0.00%   0 out of 100000

    ✓ status is 200

    HTTP
    http_req_duration..............: avg=1.32s min=10.95ms med=1.38s max=1.58s p(90)=1.39s p(95)=1.4s
      { expected_response:true }...: avg=1.32s min=10.95ms med=1.38s max=1.58s p(90)=1.39s p(95)=1.4s
    http_req_failed................: 0.00%  0 out of 100000
    http_reqs......................: 100000 377.504014/s

    EXECUTION
    iteration_duration.............: avg=1.32s min=12.02ms med=1.38s max=1.59s p(90)=1.39s p(95)=1.4s
    iterations.....................: 100000 377.504014/s
    vus............................: 495    min=495         max=500
    vus_max........................: 500    min=500         max=500

    NETWORK
    data_received..................: 22 MB  82 kB/s
    data_sent......................: 14 MB  51 kB/s




running (04m24.9s), 000/500 VUs, 100000 complete and 0 interrupted iterations
fixed_iterations ✓ [ 100% ] 500 VUs  04m24.9s/10m0s  100000/100000 iters, 200 per VU
