
         /\      Grafana   /‾‾/  
    /\  /  \     |\  __   /  /   
   /  \/    \    | |/ /  /   ‾‾\ 
  /          \   |   (  |  (‾)  |
 / __________ \  |_|\_\  \_____/ 

     execution: local
        script: ./script.js
        output: -

     scenarios: (100.00%) 1 scenario, 500 max VUs, 10m30s max duration (incl. graceful stop):
              * fixed_iterations: 200 iterations for each of 500 VUs (maxDuration: 10m0s, gracefulStop: 30s)


running (00m00.9s), 500/500 VUs, 391 complete and 0 interrupted iterations
fixed_iterations   [   0% ] 500 VUs  00m00.9s/10m0s  000391/100000 iters, 200 per VU

running (00m01.9s), 500/500 VUs, 763 complete and 0 interrupted iterations
fixed_iterations   [   1% ] 500 VUs  00m01.9s/10m0s  000763/100000 iters, 200 per VU

running (00m02.9s), 500/500 VUs, 1134 complete and 0 interrupted iterations
fixed_iterations   [   1% ] 500 VUs  00m02.9s/10m0s  001134/100000 iters, 200 per VU

running (00m03.9s), 500/500 VUs, 1506 complete and 0 interrupted iterations
fixed_iterations   [   2% ] 500 VUs  00m03.9s/10m0s  001506/100000 iters, 200 per VU

running (00m04.9s), 500/500 VUs, 1887 complete and 0 interrupted iterations
fixed_iterations   [   2% ] 500 VUs  00m04.9s/10m0s  001887/100000 iters, 200 per VU

running (00m05.9s), 500/500 VUs, 2252 complete and 0 interrupted iterations
fixed_iterations   [   2% ] 500 VUs  00m05.9s/10m0s  002252/100000 iters, 200 per VU

running (00m06.9s), 500/500 VUs, 2624 complete and 0 interrupted iterations
fixed_iterations   [   3% ] 500 VUs  00m06.9s/10m0s  002624/100000 iters, 200 per VU

running (00m07.9s), 500/500 VUs, 2996 complete and 0 interrupted iterations
fixed_iterations   [   3% ] 500 VUs  00m07.9s/10m0s  002996/100000 iters, 200 per VU

running (00m08.9s), 500/500 VUs, 3355 complete and 0 interrupted iterations
fixed_iterations   [   3% ] 500 VUs  00m08.9s/10m0s  003355/100000 iters, 200 per VU

running (00m09.9s), 500/500 VUs, 3737 complete and 0 interrupted iterations
fixed_iterations   [   4% ] 500 VUs  00m09.9s/10m0s  003737/100000 iters, 200 per VU

running (00m10.9s), 500/500 VUs, 4103 complete and 0 interrupted iterations
fixed_iterations   [   4% ] 500 VUs  00m10.9s/10m0s  004103/100000 iters, 200 per VU

running (00m11.9s), 500/500 VUs, 4465 complete and 0 interrupted iterations
fixed_iterations   [   4% ] 500 VUs  00m11.9s/10m0s  004465/100000 iters, 200 per VU

running (00m12.9s), 500/500 VUs, 4833 complete and 0 interrupted iterations
fixed_iterations   [   5% ] 500 VUs  00m12.9s/10m0s  004833/100000 iters, 200 per VU

running (00m13.9s), 500/500 VUs, 5200 complete and 0 interrupted iterations
fixed_iterations   [   5% ] 500 VUs  00m13.9s/10m0s  005200/100000 iters, 200 per VU

running (00m15.0s), 500/500 VUs, 5567 complete and 0 interrupted iterations
fixed_iterations   [   6% ] 500 VUs  00m15.0s/10m0s  005567/100000 iters, 200 per VU

running (00m15.9s), 500/500 VUs, 5939 complete and 0 interrupted iterations
fixed_iterations   [   6% ] 500 VUs  00m15.9s/10m0s  005939/100000 iters, 200 per VU

running (00m16.9s), 500/500 VUs, 6305 complete and 0 interrupted iterations
fixed_iterations   [   6% ] 500 VUs  00m16.9s/10m0s  006305/100000 iters, 200 per VU

running (00m17.9s), 500/500 VUs, 6669 complete and 0 interrupted iterations
fixed_iterations   [   7% ] 500 VUs  00m17.9s/10m0s  006669/100000 iters, 200 per VU

running (00m18.9s), 500/500 VUs, 7049 complete and 0 interrupted iterations
fixed_iterations   [   7% ] 500 VUs  00m18.9s/10m0s  007049/100000 iters, 200 per VU

running (00m19.9s), 500/500 VUs, 7428 complete and 0 interrupted iterations
fixed_iterations   [   7% ] 500 VUs  00m19.9s/10m0s  007428/100000 iters, 200 per VU

running (00m20.9s), 500/500 VUs, 7795 complete and 0 interrupted iterations
fixed_iterations   [   8% ] 500 VUs  00m20.9s/10m0s  007795/100000 iters, 200 per VU

running (00m21.9s), 500/500 VUs, 8168 complete and 0 interrupted iterations
fixed_iterations   [   8% ] 500 VUs  00m21.9s/10m0s  008168/100000 iters, 200 per VU

running (00m22.9s), 500/500 VUs, 8540 complete and 0 interrupted iterations
fixed_iterations   [   9% ] 500 VUs  00m22.9s/10m0s  008540/100000 iters, 200 per VU

running (00m23.9s), 500/500 VUs, 8908 complete and 0 interrupted iterations
fixed_iterations   [   9% ] 500 VUs  00m23.9s/10m0s  008908/100000 iters, 200 per VU

running (00m24.9s), 500/500 VUs, 9277 complete and 0 interrupted iterations
fixed_iterations   [   9% ] 500 VUs  00m24.9s/10m0s  009277/100000 iters, 200 per VU

running (00m25.9s), 500/500 VUs, 9657 complete and 0 interrupted iterations
fixed_iterations   [  10% ] 500 VUs  00m25.9s/10m0s  009657/100000 iters, 200 per VU

running (00m26.9s), 500/500 VUs, 10027 complete and 0 interrupted iterations
fixed_iterations   [  10% ] 500 VUs  00m26.9s/10m0s  010027/100000 iters, 200 per VU

running (00m27.9s), 500/500 VUs, 10408 complete and 0 interrupted iterations
fixed_iterations   [  10% ] 500 VUs  00m27.9s/10m0s  010408/100000 iters, 200 per VU

running (00m28.9s), 500/500 VUs, 10771 complete and 0 interrupted iterations
fixed_iterations   [  11% ] 500 VUs  00m28.9s/10m0s  010771/100000 iters, 200 per VU

running (00m29.9s), 500/500 VUs, 11141 complete and 0 interrupted iterations
fixed_iterations   [  11% ] 500 VUs  00m29.9s/10m0s  011141/100000 iters, 200 per VU

running (00m30.9s), 500/500 VUs, 11498 complete and 0 interrupted iterations
fixed_iterations   [  11% ] 500 VUs  00m30.9s/10m0s  011498/100000 iters, 200 per VU

running (00m31.9s), 500/500 VUs, 11853 complete and 0 interrupted iterations
fixed_iterations   [  12% ] 500 VUs  00m31.9s/10m0s  011853/100000 iters, 200 per VU

running (00m32.9s), 500/500 VUs, 12227 complete and 0 interrupted iterations
fixed_iterations   [  12% ] 500 VUs  00m32.9s/10m0s  012227/100000 iters, 200 per VU

running (00m33.9s), 500/500 VUs, 12578 complete and 0 interrupted iterations
fixed_iterations   [  13% ] 500 VUs  00m33.9s/10m0s  012578/100000 iters, 200 per VU

running (00m34.9s), 500/500 VUs, 12946 complete and 0 interrupted iterations
fixed_iterations   [  13% ] 500 VUs  00m34.9s/10m0s  012946/100000 iters, 200 per VU

running (00m35.9s), 500/500 VUs, 13310 complete and 0 interrupted iterations
fixed_iterations   [  13% ] 500 VUs  00m35.9s/10m0s  013310/100000 iters, 200 per VU

running (00m36.9s), 500/500 VUs, 13684 complete and 0 interrupted iterations
fixed_iterations   [  14% ] 500 VUs  00m36.9s/10m0s  013684/100000 iters, 200 per VU

running (00m37.9s), 500/500 VUs, 14052 complete and 0 interrupted iterations
fixed_iterations   [  14% ] 500 VUs  00m37.9s/10m0s  014052/100000 iters, 200 per VU

running (00m38.9s), 500/500 VUs, 14428 complete and 0 interrupted iterations
fixed_iterations   [  14% ] 500 VUs  00m38.9s/10m0s  014428/100000 iters, 200 per VU

running (00m39.9s), 500/500 VUs, 14792 complete and 0 interrupted iterations
fixed_iterations   [  15% ] 500 VUs  00m39.9s/10m0s  014792/100000 iters, 200 per VU

running (00m40.9s), 500/500 VUs, 15187 complete and 0 interrupted iterations
fixed_iterations   [  15% ] 500 VUs  00m40.9s/10m0s  015187/100000 iters, 200 per VU

running (00m41.9s), 500/500 VUs, 15556 complete and 0 interrupted iterations
fixed_iterations   [  16% ] 500 VUs  00m41.9s/10m0s  015556/100000 iters, 200 per VU

running (00m42.9s), 500/500 VUs, 15930 complete and 0 interrupted iterations
fixed_iterations   [  16% ] 500 VUs  00m42.9s/10m0s  015930/100000 iters, 200 per VU

running (00m43.9s), 500/500 VUs, 16299 complete and 0 interrupted iterations
fixed_iterations   [  16% ] 500 VUs  00m43.9s/10m0s  016299/100000 iters, 200 per VU

running (00m44.9s), 500/500 VUs, 16674 complete and 0 interrupted iterations
fixed_iterations   [  17% ] 500 VUs  00m44.9s/10m0s  016674/100000 iters, 200 per VU

running (00m45.9s), 500/500 VUs, 17046 complete and 0 interrupted iterations
fixed_iterations   [  17% ] 500 VUs  00m45.9s/10m0s  017046/100000 iters, 200 per VU

running (00m46.9s), 500/500 VUs, 17419 complete and 0 interrupted iterations
fixed_iterations   [  17% ] 500 VUs  00m46.9s/10m0s  017419/100000 iters, 200 per VU

running (00m47.9s), 500/500 VUs, 17776 complete and 0 interrupted iterations
fixed_iterations   [  18% ] 500 VUs  00m47.9s/10m0s  017776/100000 iters, 200 per VU

running (00m48.9s), 500/500 VUs, 18147 complete and 0 interrupted iterations
fixed_iterations   [  18% ] 500 VUs  00m48.9s/10m0s  018147/100000 iters, 200 per VU

running (00m49.9s), 500/500 VUs, 18513 complete and 0 interrupted iterations
fixed_iterations   [  19% ] 500 VUs  00m49.9s/10m0s  018513/100000 iters, 200 per VU

running (00m50.9s), 500/500 VUs, 18886 complete and 0 interrupted iterations
fixed_iterations   [  19% ] 500 VUs  00m50.9s/10m0s  018886/100000 iters, 200 per VU

running (00m51.9s), 500/500 VUs, 19256 complete and 0 interrupted iterations
fixed_iterations   [  19% ] 500 VUs  00m51.9s/10m0s  019256/100000 iters, 200 per VU

running (00m52.9s), 500/500 VUs, 19619 complete and 0 interrupted iterations
fixed_iterations   [  20% ] 500 VUs  00m52.9s/10m0s  019619/100000 iters, 200 per VU

running (00m53.9s), 500/500 VUs, 19987 complete and 0 interrupted iterations
fixed_iterations   [  20% ] 500 VUs  00m53.9s/10m0s  019987/100000 iters, 200 per VU

running (00m54.9s), 500/500 VUs, 20348 complete and 0 interrupted iterations
fixed_iterations   [  20% ] 500 VUs  00m54.9s/10m0s  020348/100000 iters, 200 per VU

running (00m55.9s), 500/500 VUs, 20716 complete and 0 interrupted iterations
fixed_iterations   [  21% ] 500 VUs  00m55.9s/10m0s  020716/100000 iters, 200 per VU

running (00m56.9s), 500/500 VUs, 21074 complete and 0 interrupted iterations
fixed_iterations   [  21% ] 500 VUs  00m56.9s/10m0s  021074/100000 iters, 200 per VU

running (00m57.9s), 500/500 VUs, 21439 complete and 0 interrupted iterations
fixed_iterations   [  21% ] 500 VUs  00m57.9s/10m0s  021439/100000 iters, 200 per VU

running (00m58.9s), 500/500 VUs, 21804 complete and 0 interrupted iterations
fixed_iterations   [  22% ] 500 VUs  00m58.9s/10m0s  021804/100000 iters, 200 per VU

running (00m59.9s), 500/500 VUs, 22162 complete and 0 interrupted iterations
fixed_iterations   [  22% ] 500 VUs  00m59.9s/10m0s  022162/100000 iters, 200 per VU

running (01m00.9s), 500/500 VUs, 22538 complete and 0 interrupted iterations
fixed_iterations   [  23% ] 500 VUs  01m00.9s/10m0s  022538/100000 iters, 200 per VU

running (01m01.9s), 500/500 VUs, 22909 complete and 0 interrupted iterations
fixed_iterations   [  23% ] 500 VUs  01m01.9s/10m0s  022909/100000 iters, 200 per VU

running (01m02.9s), 500/500 VUs, 23283 complete and 0 interrupted iterations
fixed_iterations   [  23% ] 500 VUs  01m02.9s/10m0s  023283/100000 iters, 200 per VU

running (01m03.9s), 500/500 VUs, 23659 complete and 0 interrupted iterations
fixed_iterations   [  24% ] 500 VUs  01m03.9s/10m0s  023659/100000 iters, 200 per VU

running (01m04.9s), 500/500 VUs, 24022 complete and 0 interrupted iterations
fixed_iterations   [  24% ] 500 VUs  01m04.9s/10m0s  024022/100000 iters, 200 per VU

running (01m05.9s), 500/500 VUs, 24383 complete and 0 interrupted iterations
fixed_iterations   [  24% ] 500 VUs  01m05.9s/10m0s  024383/100000 iters, 200 per VU

running (01m06.9s), 500/500 VUs, 24754 complete and 0 interrupted iterations
fixed_iterations   [  25% ] 500 VUs  01m06.9s/10m0s  024754/100000 iters, 200 per VU

running (01m07.9s), 500/500 VUs, 25116 complete and 0 interrupted iterations
fixed_iterations   [  25% ] 500 VUs  01m07.9s/10m0s  025116/100000 iters, 200 per VU

running (01m08.9s), 500/500 VUs, 25482 complete and 0 interrupted iterations
fixed_iterations   [  25% ] 500 VUs  01m08.9s/10m0s  025482/100000 iters, 200 per VU

running (01m09.9s), 500/500 VUs, 25855 complete and 0 interrupted iterations
fixed_iterations   [  26% ] 500 VUs  01m09.9s/10m0s  025855/100000 iters, 200 per VU

running (01m10.9s), 500/500 VUs, 26222 complete and 0 interrupted iterations
fixed_iterations   [  26% ] 500 VUs  01m10.9s/10m0s  026222/100000 iters, 200 per VU

running (01m11.9s), 500/500 VUs, 26589 complete and 0 interrupted iterations
fixed_iterations   [  27% ] 500 VUs  01m11.9s/10m0s  026589/100000 iters, 200 per VU

running (01m12.9s), 500/500 VUs, 26958 complete and 0 interrupted iterations
fixed_iterations   [  27% ] 500 VUs  01m12.9s/10m0s  026958/100000 iters, 200 per VU

running (01m13.9s), 500/500 VUs, 27319 complete and 0 interrupted iterations
fixed_iterations   [  27% ] 500 VUs  01m13.9s/10m0s  027319/100000 iters, 200 per VU

running (01m14.9s), 500/500 VUs, 27679 complete and 0 interrupted iterations
fixed_iterations   [  28% ] 500 VUs  01m14.9s/10m0s  027679/100000 iters, 200 per VU

running (01m15.9s), 500/500 VUs, 28043 complete and 0 interrupted iterations
fixed_iterations   [  28% ] 500 VUs  01m15.9s/10m0s  028043/100000 iters, 200 per VU

running (01m16.9s), 500/500 VUs, 28493 complete and 0 interrupted iterations
fixed_iterations   [  28% ] 500 VUs  01m16.9s/10m0s  028493/100000 iters, 200 per VU

running (01m17.9s), 500/500 VUs, 29235 complete and 0 interrupted iterations
fixed_iterations   [  29% ] 500 VUs  01m17.9s/10m0s  029235/100000 iters, 200 per VU

running (01m18.9s), 500/500 VUs, 30121 complete and 0 interrupted iterations
fixed_iterations   [  30% ] 500 VUs  01m18.9s/10m0s  030121/100000 iters, 200 per VU

running (01m19.9s), 500/500 VUs, 30480 complete and 0 interrupted iterations
fixed_iterations   [  30% ] 500 VUs  01m19.9s/10m0s  030480/100000 iters, 200 per VU

running (01m20.9s), 500/500 VUs, 30859 complete and 0 interrupted iterations
fixed_iterations   [  31% ] 500 VUs  01m20.9s/10m0s  030859/100000 iters, 200 per VU

running (01m21.9s), 500/500 VUs, 31235 complete and 0 interrupted iterations
fixed_iterations   [  31% ] 500 VUs  01m21.9s/10m0s  031235/100000 iters, 200 per VU

running (01m22.9s), 500/500 VUs, 31614 complete and 0 interrupted iterations
fixed_iterations   [  32% ] 500 VUs  01m22.9s/10m0s  031614/100000 iters, 200 per VU

running (01m23.9s), 500/500 VUs, 31986 complete and 0 interrupted iterations
fixed_iterations   [  32% ] 500 VUs  01m23.9s/10m0s  031986/100000 iters, 200 per VU

running (01m24.9s), 500/500 VUs, 32369 complete and 0 interrupted iterations
fixed_iterations   [  32% ] 500 VUs  01m24.9s/10m0s  032369/100000 iters, 200 per VU

running (01m26.0s), 500/500 VUs, 32747 complete and 0 interrupted iterations
fixed_iterations   [  33% ] 500 VUs  01m26.0s/10m0s  032747/100000 iters, 200 per VU

running (01m26.9s), 500/500 VUs, 33105 complete and 0 interrupted iterations
fixed_iterations   [  33% ] 500 VUs  01m26.9s/10m0s  033105/100000 iters, 200 per VU

running (01m27.9s), 500/500 VUs, 33477 complete and 0 interrupted iterations
fixed_iterations   [  33% ] 500 VUs  01m27.9s/10m0s  033477/100000 iters, 200 per VU

running (01m28.9s), 500/500 VUs, 33845 complete and 0 interrupted iterations
fixed_iterations   [  34% ] 500 VUs  01m28.9s/10m0s  033845/100000 iters, 200 per VU

running (01m29.9s), 500/500 VUs, 34214 complete and 0 interrupted iterations
fixed_iterations   [  34% ] 500 VUs  01m29.9s/10m0s  034214/100000 iters, 200 per VU

running (01m30.9s), 500/500 VUs, 34576 complete and 0 interrupted iterations
fixed_iterations   [  35% ] 500 VUs  01m30.9s/10m0s  034576/100000 iters, 200 per VU

running (01m31.9s), 500/500 VUs, 34947 complete and 0 interrupted iterations
fixed_iterations   [  35% ] 500 VUs  01m31.9s/10m0s  034947/100000 iters, 200 per VU

running (01m32.9s), 500/500 VUs, 35321 complete and 0 interrupted iterations
fixed_iterations   [  35% ] 500 VUs  01m32.9s/10m0s  035321/100000 iters, 200 per VU

running (01m33.9s), 500/500 VUs, 35681 complete and 0 interrupted iterations
fixed_iterations   [  36% ] 500 VUs  01m33.9s/10m0s  035681/100000 iters, 200 per VU

running (01m34.9s), 500/500 VUs, 36041 complete and 0 interrupted iterations
fixed_iterations   [  36% ] 500 VUs  01m34.9s/10m0s  036041/100000 iters, 200 per VU

running (01m35.9s), 500/500 VUs, 36410 complete and 0 interrupted iterations
fixed_iterations   [  36% ] 500 VUs  01m35.9s/10m0s  036410/100000 iters, 200 per VU

running (01m36.9s), 500/500 VUs, 36782 complete and 0 interrupted iterations
fixed_iterations   [  37% ] 500 VUs  01m36.9s/10m0s  036782/100000 iters, 200 per VU

running (01m37.9s), 500/500 VUs, 37156 complete and 0 interrupted iterations
fixed_iterations   [  37% ] 500 VUs  01m37.9s/10m0s  037156/100000 iters, 200 per VU

running (01m38.9s), 500/500 VUs, 37532 complete and 0 interrupted iterations
fixed_iterations   [  38% ] 500 VUs  01m38.9s/10m0s  037532/100000 iters, 200 per VU

running (01m39.9s), 500/500 VUs, 37906 complete and 0 interrupted iterations
fixed_iterations   [  38% ] 500 VUs  01m39.9s/10m0s  037906/100000 iters, 200 per VU

running (01m40.9s), 500/500 VUs, 38270 complete and 0 interrupted iterations
fixed_iterations   [  38% ] 500 VUs  01m40.9s/10m0s  038270/100000 iters, 200 per VU

running (01m41.9s), 500/500 VUs, 38651 complete and 0 interrupted iterations
fixed_iterations   [  39% ] 500 VUs  01m41.9s/10m0s  038651/100000 iters, 200 per VU

running (01m42.9s), 500/500 VUs, 39029 complete and 0 interrupted iterations
fixed_iterations   [  39% ] 500 VUs  01m42.9s/10m0s  039029/100000 iters, 200 per VU

running (01m43.9s), 500/500 VUs, 39395 complete and 0 interrupted iterations
fixed_iterations   [  39% ] 500 VUs  01m43.9s/10m0s  039395/100000 iters, 200 per VU

running (01m44.9s), 500/500 VUs, 39758 complete and 0 interrupted iterations
fixed_iterations   [  40% ] 500 VUs  01m44.9s/10m0s  039758/100000 iters, 200 per VU

running (01m46.0s), 500/500 VUs, 40124 complete and 0 interrupted iterations
fixed_iterations   [  40% ] 500 VUs  01m46.0s/10m0s  040124/100000 iters, 200 per VU

running (01m46.9s), 500/500 VUs, 40502 complete and 0 interrupted iterations
fixed_iterations   [  41% ] 500 VUs  01m46.9s/10m0s  040502/100000 iters, 200 per VU

running (01m47.9s), 500/500 VUs, 40860 complete and 0 interrupted iterations
fixed_iterations   [  41% ] 500 VUs  01m47.9s/10m0s  040860/100000 iters, 200 per VU

running (01m48.9s), 500/500 VUs, 41243 complete and 0 interrupted iterations
fixed_iterations   [  41% ] 500 VUs  01m48.9s/10m0s  041243/100000 iters, 200 per VU

running (01m49.9s), 500/500 VUs, 41617 complete and 0 interrupted iterations
fixed_iterations   [  42% ] 500 VUs  01m49.9s/10m0s  041617/100000 iters, 200 per VU

running (01m50.9s), 500/500 VUs, 42002 complete and 0 interrupted iterations
fixed_iterations   [  42% ] 500 VUs  01m50.9s/10m0s  042002/100000 iters, 200 per VU

running (01m51.9s), 500/500 VUs, 42378 complete and 0 interrupted iterations
fixed_iterations   [  42% ] 500 VUs  01m51.9s/10m0s  042378/100000 iters, 200 per VU

running (01m52.9s), 500/500 VUs, 42759 complete and 0 interrupted iterations
fixed_iterations   [  43% ] 500 VUs  01m52.9s/10m0s  042759/100000 iters, 200 per VU

running (01m53.9s), 500/500 VUs, 43122 complete and 0 interrupted iterations
fixed_iterations   [  43% ] 500 VUs  01m53.9s/10m0s  043122/100000 iters, 200 per VU

running (01m54.9s), 500/500 VUs, 43508 complete and 0 interrupted iterations
fixed_iterations   [  44% ] 500 VUs  01m54.9s/10m0s  043508/100000 iters, 200 per VU

running (01m55.9s), 500/500 VUs, 43869 complete and 0 interrupted iterations
fixed_iterations   [  44% ] 500 VUs  01m55.9s/10m0s  043869/100000 iters, 200 per VU

running (01m56.9s), 500/500 VUs, 44221 complete and 0 interrupted iterations
fixed_iterations   [  44% ] 500 VUs  01m56.9s/10m0s  044221/100000 iters, 200 per VU

running (01m57.9s), 500/500 VUs, 44588 complete and 0 interrupted iterations
fixed_iterations   [  45% ] 500 VUs  01m57.9s/10m0s  044588/100000 iters, 200 per VU

running (01m58.9s), 500/500 VUs, 44964 complete and 0 interrupted iterations
fixed_iterations   [  45% ] 500 VUs  01m58.9s/10m0s  044964/100000 iters, 200 per VU

running (01m59.9s), 500/500 VUs, 45321 complete and 0 interrupted iterations
fixed_iterations   [  45% ] 500 VUs  01m59.9s/10m0s  045321/100000 iters, 200 per VU

running (02m00.9s), 500/500 VUs, 45691 complete and 0 interrupted iterations
fixed_iterations   [  46% ] 500 VUs  02m00.9s/10m0s  045691/100000 iters, 200 per VU

running (02m01.9s), 500/500 VUs, 46059 complete and 0 interrupted iterations
fixed_iterations   [  46% ] 500 VUs  02m01.9s/10m0s  046059/100000 iters, 200 per VU

running (02m02.9s), 500/500 VUs, 46427 complete and 0 interrupted iterations
fixed_iterations   [  46% ] 500 VUs  02m02.9s/10m0s  046427/100000 iters, 200 per VU

running (02m03.9s), 500/500 VUs, 46795 complete and 0 interrupted iterations
fixed_iterations   [  47% ] 500 VUs  02m03.9s/10m0s  046795/100000 iters, 200 per VU

running (02m04.9s), 500/500 VUs, 47158 complete and 0 interrupted iterations
fixed_iterations   [  47% ] 500 VUs  02m04.9s/10m0s  047158/100000 iters, 200 per VU

running (02m05.9s), 500/500 VUs, 47537 complete and 0 interrupted iterations
fixed_iterations   [  48% ] 500 VUs  02m05.9s/10m0s  047537/100000 iters, 200 per VU

running (02m06.9s), 500/500 VUs, 47908 complete and 0 interrupted iterations
fixed_iterations   [  48% ] 500 VUs  02m06.9s/10m0s  047908/100000 iters, 200 per VU

running (02m07.9s), 500/500 VUs, 48270 complete and 0 interrupted iterations
fixed_iterations   [  48% ] 500 VUs  02m07.9s/10m0s  048270/100000 iters, 200 per VU

running (02m08.9s), 500/500 VUs, 48640 complete and 0 interrupted iterations
fixed_iterations   [  49% ] 500 VUs  02m08.9s/10m0s  048640/100000 iters, 200 per VU

running (02m09.9s), 500/500 VUs, 49003 complete and 0 interrupted iterations
fixed_iterations   [  49% ] 500 VUs  02m09.9s/10m0s  049003/100000 iters, 200 per VU

running (02m10.9s), 500/500 VUs, 49376 complete and 0 interrupted iterations
fixed_iterations   [  49% ] 500 VUs  02m10.9s/10m0s  049376/100000 iters, 200 per VU

running (02m11.9s), 500/500 VUs, 49744 complete and 0 interrupted iterations
fixed_iterations   [  50% ] 500 VUs  02m11.9s/10m0s  049744/100000 iters, 200 per VU

running (02m12.9s), 500/500 VUs, 50118 complete and 0 interrupted iterations
fixed_iterations   [  50% ] 500 VUs  02m12.9s/10m0s  050118/100000 iters, 200 per VU

running (02m13.9s), 500/500 VUs, 50497 complete and 0 interrupted iterations
fixed_iterations   [  50% ] 500 VUs  02m13.9s/10m0s  050497/100000 iters, 200 per VU

running (02m14.9s), 500/500 VUs, 50864 complete and 0 interrupted iterations
fixed_iterations   [  51% ] 500 VUs  02m14.9s/10m0s  050864/100000 iters, 200 per VU

running (02m15.9s), 500/500 VUs, 51248 complete and 0 interrupted iterations
fixed_iterations   [  51% ] 500 VUs  02m15.9s/10m0s  051248/100000 iters, 200 per VU

running (02m16.9s), 500/500 VUs, 51618 complete and 0 interrupted iterations
fixed_iterations   [  52% ] 500 VUs  02m16.9s/10m0s  051618/100000 iters, 200 per VU

running (02m17.9s), 500/500 VUs, 51996 complete and 0 interrupted iterations
fixed_iterations   [  52% ] 500 VUs  02m17.9s/10m0s  051996/100000 iters, 200 per VU

running (02m18.9s), 500/500 VUs, 52355 complete and 0 interrupted iterations
fixed_iterations   [  52% ] 500 VUs  02m18.9s/10m0s  052355/100000 iters, 200 per VU

running (02m19.9s), 500/500 VUs, 52735 complete and 0 interrupted iterations
fixed_iterations   [  53% ] 500 VUs  02m19.9s/10m0s  052735/100000 iters, 200 per VU

running (02m20.9s), 500/500 VUs, 53104 complete and 0 interrupted iterations
fixed_iterations   [  53% ] 500 VUs  02m20.9s/10m0s  053104/100000 iters, 200 per VU

running (02m21.9s), 500/500 VUs, 53487 complete and 0 interrupted iterations
fixed_iterations   [  53% ] 500 VUs  02m21.9s/10m0s  053487/100000 iters, 200 per VU

running (02m22.9s), 500/500 VUs, 53865 complete and 0 interrupted iterations
fixed_iterations   [  54% ] 500 VUs  02m22.9s/10m0s  053865/100000 iters, 200 per VU

running (02m23.9s), 500/500 VUs, 54229 complete and 0 interrupted iterations
fixed_iterations   [  54% ] 500 VUs  02m23.9s/10m0s  054229/100000 iters, 200 per VU

running (02m24.9s), 500/500 VUs, 54596 complete and 0 interrupted iterations
fixed_iterations   [  55% ] 500 VUs  02m24.9s/10m0s  054596/100000 iters, 200 per VU

running (02m25.9s), 500/500 VUs, 54966 complete and 0 interrupted iterations
fixed_iterations   [  55% ] 500 VUs  02m25.9s/10m0s  054966/100000 iters, 200 per VU

running (02m26.9s), 500/500 VUs, 55335 complete and 0 interrupted iterations
fixed_iterations   [  55% ] 500 VUs  02m26.9s/10m0s  055335/100000 iters, 200 per VU

running (02m27.9s), 500/500 VUs, 55700 complete and 0 interrupted iterations
fixed_iterations   [  56% ] 500 VUs  02m27.9s/10m0s  055700/100000 iters, 200 per VU

running (02m28.9s), 500/500 VUs, 56075 complete and 0 interrupted iterations
fixed_iterations   [  56% ] 500 VUs  02m28.9s/10m0s  056075/100000 iters, 200 per VU

running (02m29.9s), 500/500 VUs, 56441 complete and 0 interrupted iterations
fixed_iterations   [  56% ] 500 VUs  02m29.9s/10m0s  056441/100000 iters, 200 per VU

running (02m30.9s), 500/500 VUs, 56813 complete and 0 interrupted iterations
fixed_iterations   [  57% ] 500 VUs  02m30.9s/10m0s  056813/100000 iters, 200 per VU

running (02m31.9s), 500/500 VUs, 57178 complete and 0 interrupted iterations
fixed_iterations   [  57% ] 500 VUs  02m31.9s/10m0s  057178/100000 iters, 200 per VU

running (02m32.9s), 500/500 VUs, 57507 complete and 0 interrupted iterations
fixed_iterations   [  58% ] 500 VUs  02m32.9s/10m0s  057507/100000 iters, 200 per VU

running (02m33.9s), 500/500 VUs, 57861 complete and 0 interrupted iterations
fixed_iterations   [  58% ] 500 VUs  02m33.9s/10m0s  057861/100000 iters, 200 per VU

running (02m34.9s), 500/500 VUs, 58222 complete and 0 interrupted iterations
fixed_iterations   [  58% ] 500 VUs  02m34.9s/10m0s  058222/100000 iters, 200 per VU

running (02m35.9s), 500/500 VUs, 58577 complete and 0 interrupted iterations
fixed_iterations   [  59% ] 500 VUs  02m35.9s/10m0s  058577/100000 iters, 200 per VU

running (02m36.9s), 500/500 VUs, 58946 complete and 0 interrupted iterations
fixed_iterations   [  59% ] 500 VUs  02m36.9s/10m0s  058946/100000 iters, 200 per VU

running (02m37.9s), 500/500 VUs, 59307 complete and 0 interrupted iterations
fixed_iterations   [  59% ] 500 VUs  02m37.9s/10m0s  059307/100000 iters, 200 per VU

running (02m38.9s), 500/500 VUs, 59681 complete and 0 interrupted iterations
fixed_iterations   [  60% ] 500 VUs  02m38.9s/10m0s  059681/100000 iters, 200 per VU

running (02m39.9s), 500/500 VUs, 60050 complete and 0 interrupted iterations
fixed_iterations   [  60% ] 500 VUs  02m39.9s/10m0s  060050/100000 iters, 200 per VU

running (02m40.9s), 500/500 VUs, 60417 complete and 0 interrupted iterations
fixed_iterations   [  60% ] 500 VUs  02m40.9s/10m0s  060417/100000 iters, 200 per VU

running (02m41.9s), 500/500 VUs, 60799 complete and 0 interrupted iterations
fixed_iterations   [  61% ] 500 VUs  02m41.9s/10m0s  060799/100000 iters, 200 per VU

running (02m42.9s), 500/500 VUs, 61164 complete and 0 interrupted iterations
fixed_iterations   [  61% ] 500 VUs  02m42.9s/10m0s  061164/100000 iters, 200 per VU

running (02m43.9s), 500/500 VUs, 61532 complete and 0 interrupted iterations
fixed_iterations   [  62% ] 500 VUs  02m43.9s/10m0s  061532/100000 iters, 200 per VU

running (02m44.9s), 500/500 VUs, 61906 complete and 0 interrupted iterations
fixed_iterations   [  62% ] 500 VUs  02m44.9s/10m0s  061906/100000 iters, 200 per VU

running (02m45.9s), 500/500 VUs, 62271 complete and 0 interrupted iterations
fixed_iterations   [  62% ] 500 VUs  02m45.9s/10m0s  062271/100000 iters, 200 per VU

running (02m46.9s), 500/500 VUs, 62642 complete and 0 interrupted iterations
fixed_iterations   [  63% ] 500 VUs  02m46.9s/10m0s  062642/100000 iters, 200 per VU

running (02m47.9s), 500/500 VUs, 63017 complete and 0 interrupted iterations
fixed_iterations   [  63% ] 500 VUs  02m47.9s/10m0s  063017/100000 iters, 200 per VU

running (02m48.9s), 500/500 VUs, 63388 complete and 0 interrupted iterations
fixed_iterations   [  63% ] 500 VUs  02m48.9s/10m0s  063388/100000 iters, 200 per VU

running (02m49.9s), 500/500 VUs, 63730 complete and 0 interrupted iterations
fixed_iterations   [  64% ] 500 VUs  02m49.9s/10m0s  063730/100000 iters, 200 per VU

running (02m50.9s), 500/500 VUs, 64086 complete and 0 interrupted iterations
fixed_iterations   [  64% ] 500 VUs  02m50.9s/10m0s  064086/100000 iters, 200 per VU

running (02m51.9s), 500/500 VUs, 64477 complete and 0 interrupted iterations
fixed_iterations   [  64% ] 500 VUs  02m51.9s/10m0s  064477/100000 iters, 200 per VU

running (02m52.9s), 500/500 VUs, 64855 complete and 0 interrupted iterations
fixed_iterations   [  65% ] 500 VUs  02m52.9s/10m0s  064855/100000 iters, 200 per VU

running (02m53.9s), 500/500 VUs, 65230 complete and 0 interrupted iterations
fixed_iterations   [  65% ] 500 VUs  02m53.9s/10m0s  065230/100000 iters, 200 per VU

running (02m54.9s), 500/500 VUs, 65597 complete and 0 interrupted iterations
fixed_iterations   [  66% ] 500 VUs  02m54.9s/10m0s  065597/100000 iters, 200 per VU

running (02m55.9s), 500/500 VUs, 65953 complete and 0 interrupted iterations
fixed_iterations   [  66% ] 500 VUs  02m55.9s/10m0s  065953/100000 iters, 200 per VU

running (02m56.9s), 500/500 VUs, 66321 complete and 0 interrupted iterations
fixed_iterations   [  66% ] 500 VUs  02m56.9s/10m0s  066321/100000 iters, 200 per VU

running (02m57.9s), 500/500 VUs, 66701 complete and 0 interrupted iterations
fixed_iterations   [  67% ] 500 VUs  02m57.9s/10m0s  066701/100000 iters, 200 per VU

running (02m58.9s), 500/500 VUs, 67066 complete and 0 interrupted iterations
fixed_iterations   [  67% ] 500 VUs  02m58.9s/10m0s  067066/100000 iters, 200 per VU

running (02m59.9s), 500/500 VUs, 67438 complete and 0 interrupted iterations
fixed_iterations   [  67% ] 500 VUs  02m59.9s/10m0s  067438/100000 iters, 200 per VU

running (03m00.9s), 500/500 VUs, 67799 complete and 0 interrupted iterations
fixed_iterations   [  68% ] 500 VUs  03m00.9s/10m0s  067799/100000 iters, 200 per VU

running (03m01.9s), 500/500 VUs, 68176 complete and 0 interrupted iterations
fixed_iterations   [  68% ] 500 VUs  03m01.9s/10m0s  068176/100000 iters, 200 per VU

running (03m02.9s), 500/500 VUs, 68558 complete and 0 interrupted iterations
fixed_iterations   [  69% ] 500 VUs  03m02.9s/10m0s  068558/100000 iters, 200 per VU

running (03m03.9s), 500/500 VUs, 68924 complete and 0 interrupted iterations
fixed_iterations   [  69% ] 500 VUs  03m03.9s/10m0s  068924/100000 iters, 200 per VU

running (03m04.9s), 500/500 VUs, 69302 complete and 0 interrupted iterations
fixed_iterations   [  69% ] 500 VUs  03m04.9s/10m0s  069302/100000 iters, 200 per VU

running (03m05.9s), 500/500 VUs, 69678 complete and 0 interrupted iterations
fixed_iterations   [  70% ] 500 VUs  03m05.9s/10m0s  069678/100000 iters, 200 per VU

running (03m06.9s), 500/500 VUs, 70049 complete and 0 interrupted iterations
fixed_iterations   [  70% ] 500 VUs  03m06.9s/10m0s  070049/100000 iters, 200 per VU

running (03m07.9s), 500/500 VUs, 70417 complete and 0 interrupted iterations
fixed_iterations   [  70% ] 500 VUs  03m07.9s/10m0s  070417/100000 iters, 200 per VU

running (03m08.9s), 500/500 VUs, 70797 complete and 0 interrupted iterations
fixed_iterations   [  71% ] 500 VUs  03m08.9s/10m0s  070797/100000 iters, 200 per VU

running (03m09.9s), 500/500 VUs, 71161 complete and 0 interrupted iterations
fixed_iterations   [  71% ] 500 VUs  03m09.9s/10m0s  071161/100000 iters, 200 per VU

running (03m10.9s), 500/500 VUs, 71526 complete and 0 interrupted iterations
fixed_iterations   [  72% ] 500 VUs  03m10.9s/10m0s  071526/100000 iters, 200 per VU

running (03m11.9s), 500/500 VUs, 71890 complete and 0 interrupted iterations
fixed_iterations   [  72% ] 500 VUs  03m11.9s/10m0s  071890/100000 iters, 200 per VU

running (03m12.9s), 500/500 VUs, 72259 complete and 0 interrupted iterations
fixed_iterations   [  72% ] 500 VUs  03m12.9s/10m0s  072259/100000 iters, 200 per VU

running (03m13.9s), 500/500 VUs, 72624 complete and 0 interrupted iterations
fixed_iterations   [  73% ] 500 VUs  03m13.9s/10m0s  072624/100000 iters, 200 per VU

running (03m14.9s), 500/500 VUs, 72988 complete and 0 interrupted iterations
fixed_iterations   [  73% ] 500 VUs  03m14.9s/10m0s  072988/100000 iters, 200 per VU

running (03m15.9s), 500/500 VUs, 73349 complete and 0 interrupted iterations
fixed_iterations   [  73% ] 500 VUs  03m15.9s/10m0s  073349/100000 iters, 200 per VU

running (03m16.9s), 500/500 VUs, 73719 complete and 0 interrupted iterations
fixed_iterations   [  74% ] 500 VUs  03m16.9s/10m0s  073719/100000 iters, 200 per VU

running (03m17.9s), 500/500 VUs, 74084 complete and 0 interrupted iterations
fixed_iterations   [  74% ] 500 VUs  03m17.9s/10m0s  074084/100000 iters, 200 per VU

running (03m18.9s), 500/500 VUs, 74456 complete and 0 interrupted iterations
fixed_iterations   [  74% ] 500 VUs  03m18.9s/10m0s  074456/100000 iters, 200 per VU

running (03m19.9s), 500/500 VUs, 74828 complete and 0 interrupted iterations
fixed_iterations   [  75% ] 500 VUs  03m19.9s/10m0s  074828/100000 iters, 200 per VU

running (03m20.9s), 500/500 VUs, 75203 complete and 0 interrupted iterations
fixed_iterations   [  75% ] 500 VUs  03m20.9s/10m0s  075203/100000 iters, 200 per VU

running (03m21.9s), 500/500 VUs, 75575 complete and 0 interrupted iterations
fixed_iterations   [  76% ] 500 VUs  03m21.9s/10m0s  075575/100000 iters, 200 per VU

running (03m22.9s), 500/500 VUs, 75940 complete and 0 interrupted iterations
fixed_iterations   [  76% ] 500 VUs  03m22.9s/10m0s  075940/100000 iters, 200 per VU

running (03m23.9s), 500/500 VUs, 76305 complete and 0 interrupted iterations
fixed_iterations   [  76% ] 500 VUs  03m23.9s/10m0s  076305/100000 iters, 200 per VU

running (03m24.9s), 500/500 VUs, 76669 complete and 0 interrupted iterations
fixed_iterations   [  77% ] 500 VUs  03m24.9s/10m0s  076669/100000 iters, 200 per VU

running (03m25.9s), 500/500 VUs, 77041 complete and 0 interrupted iterations
fixed_iterations   [  77% ] 500 VUs  03m25.9s/10m0s  077041/100000 iters, 200 per VU

running (03m26.9s), 500/500 VUs, 77410 complete and 0 interrupted iterations
fixed_iterations   [  77% ] 500 VUs  03m26.9s/10m0s  077410/100000 iters, 200 per VU

running (03m27.9s), 500/500 VUs, 77776 complete and 0 interrupted iterations
fixed_iterations   [  78% ] 500 VUs  03m27.9s/10m0s  077776/100000 iters, 200 per VU

running (03m28.9s), 500/500 VUs, 78158 complete and 0 interrupted iterations
fixed_iterations   [  78% ] 500 VUs  03m28.9s/10m0s  078158/100000 iters, 200 per VU

running (03m29.9s), 500/500 VUs, 78527 complete and 0 interrupted iterations
fixed_iterations   [  79% ] 500 VUs  03m29.9s/10m0s  078527/100000 iters, 200 per VU

running (03m30.9s), 500/500 VUs, 78892 complete and 0 interrupted iterations
fixed_iterations   [  79% ] 500 VUs  03m30.9s/10m0s  078892/100000 iters, 200 per VU

running (03m31.9s), 500/500 VUs, 79266 complete and 0 interrupted iterations
fixed_iterations   [  79% ] 500 VUs  03m31.9s/10m0s  079266/100000 iters, 200 per VU

running (03m32.9s), 500/500 VUs, 79628 complete and 0 interrupted iterations
fixed_iterations   [  80% ] 500 VUs  03m32.9s/10m0s  079628/100000 iters, 200 per VU

running (03m33.9s), 500/500 VUs, 79993 complete and 0 interrupted iterations
fixed_iterations   [  80% ] 500 VUs  03m33.9s/10m0s  079993/100000 iters, 200 per VU

running (03m34.9s), 500/500 VUs, 80356 complete and 0 interrupted iterations
fixed_iterations   [  80% ] 500 VUs  03m34.9s/10m0s  080356/100000 iters, 200 per VU

running (03m35.9s), 500/500 VUs, 80714 complete and 0 interrupted iterations
fixed_iterations   [  81% ] 500 VUs  03m35.9s/10m0s  080714/100000 iters, 200 per VU

running (03m36.9s), 500/500 VUs, 81076 complete and 0 interrupted iterations
fixed_iterations   [  81% ] 500 VUs  03m36.9s/10m0s  081076/100000 iters, 200 per VU

running (03m37.9s), 500/500 VUs, 81445 complete and 0 interrupted iterations
fixed_iterations   [  81% ] 500 VUs  03m37.9s/10m0s  081445/100000 iters, 200 per VU

running (03m38.9s), 500/500 VUs, 81811 complete and 0 interrupted iterations
fixed_iterations   [  82% ] 500 VUs  03m38.9s/10m0s  081811/100000 iters, 200 per VU

running (03m39.9s), 500/500 VUs, 82185 complete and 0 interrupted iterations
fixed_iterations   [  82% ] 500 VUs  03m39.9s/10m0s  082185/100000 iters, 200 per VU

running (03m40.9s), 500/500 VUs, 82559 complete and 0 interrupted iterations
fixed_iterations   [  83% ] 500 VUs  03m40.9s/10m0s  082559/100000 iters, 200 per VU

running (03m41.9s), 500/500 VUs, 82929 complete and 0 interrupted iterations
fixed_iterations   [  83% ] 500 VUs  03m41.9s/10m0s  082929/100000 iters, 200 per VU

running (03m42.9s), 500/500 VUs, 83296 complete and 0 interrupted iterations
fixed_iterations   [  83% ] 500 VUs  03m42.9s/10m0s  083296/100000 iters, 200 per VU

running (03m43.9s), 500/500 VUs, 83657 complete and 0 interrupted iterations
fixed_iterations   [  84% ] 500 VUs  03m43.9s/10m0s  083657/100000 iters, 200 per VU

running (03m44.9s), 500/500 VUs, 84022 complete and 0 interrupted iterations
fixed_iterations   [  84% ] 500 VUs  03m44.9s/10m0s  084022/100000 iters, 200 per VU

running (03m45.9s), 500/500 VUs, 84394 complete and 0 interrupted iterations
fixed_iterations   [  84% ] 500 VUs  03m45.9s/10m0s  084394/100000 iters, 200 per VU

running (03m46.9s), 500/500 VUs, 84742 complete and 0 interrupted iterations
fixed_iterations   [  85% ] 500 VUs  03m46.9s/10m0s  084742/100000 iters, 200 per VU

running (03m47.9s), 500/500 VUs, 85104 complete and 0 interrupted iterations
fixed_iterations   [  85% ] 500 VUs  03m47.9s/10m0s  085104/100000 iters, 200 per VU

running (03m48.9s), 500/500 VUs, 85465 complete and 0 interrupted iterations
fixed_iterations   [  85% ] 500 VUs  03m48.9s/10m0s  085465/100000 iters, 200 per VU

running (03m50.0s), 500/500 VUs, 85838 complete and 0 interrupted iterations
fixed_iterations   [  86% ] 500 VUs  03m50.0s/10m0s  085838/100000 iters, 200 per VU

running (03m50.9s), 500/500 VUs, 86207 complete and 0 interrupted iterations
fixed_iterations   [  86% ] 500 VUs  03m50.9s/10m0s  086207/100000 iters, 200 per VU

running (03m51.9s), 500/500 VUs, 86575 complete and 0 interrupted iterations
fixed_iterations   [  87% ] 500 VUs  03m51.9s/10m0s  086575/100000 iters, 200 per VU

running (03m52.9s), 500/500 VUs, 86934 complete and 0 interrupted iterations
fixed_iterations   [  87% ] 500 VUs  03m52.9s/10m0s  086934/100000 iters, 200 per VU

running (03m53.9s), 500/500 VUs, 87301 complete and 0 interrupted iterations
fixed_iterations   [  87% ] 500 VUs  03m53.9s/10m0s  087301/100000 iters, 200 per VU

running (03m54.9s), 500/500 VUs, 87680 complete and 0 interrupted iterations
fixed_iterations   [  88% ] 500 VUs  03m54.9s/10m0s  087680/100000 iters, 200 per VU

running (03m55.9s), 500/500 VUs, 88048 complete and 0 interrupted iterations
fixed_iterations   [  88% ] 500 VUs  03m55.9s/10m0s  088048/100000 iters, 200 per VU

running (03m56.9s), 500/500 VUs, 88411 complete and 0 interrupted iterations
fixed_iterations   [  88% ] 500 VUs  03m56.9s/10m0s  088411/100000 iters, 200 per VU

running (03m57.9s), 500/500 VUs, 88788 complete and 0 interrupted iterations
fixed_iterations   [  89% ] 500 VUs  03m57.9s/10m0s  088788/100000 iters, 200 per VU

running (03m58.9s), 500/500 VUs, 89172 complete and 0 interrupted iterations
fixed_iterations   [  89% ] 500 VUs  03m58.9s/10m0s  089172/100000 iters, 200 per VU

running (03m59.9s), 500/500 VUs, 89551 complete and 0 interrupted iterations
fixed_iterations   [  90% ] 500 VUs  03m59.9s/10m0s  089551/100000 iters, 200 per VU

running (04m00.9s), 500/500 VUs, 89930 complete and 0 interrupted iterations
fixed_iterations   [  90% ] 500 VUs  04m00.9s/10m0s  089930/100000 iters, 200 per VU

running (04m01.9s), 500/500 VUs, 90294 complete and 0 interrupted iterations
fixed_iterations   [  90% ] 500 VUs  04m01.9s/10m0s  090294/100000 iters, 200 per VU

running (04m02.9s), 500/500 VUs, 90662 complete and 0 interrupted iterations
fixed_iterations   [  91% ] 500 VUs  04m02.9s/10m0s  090662/100000 iters, 200 per VU

running (04m03.9s), 500/500 VUs, 91023 complete and 0 interrupted iterations
fixed_iterations   [  91% ] 500 VUs  04m03.9s/10m0s  091023/100000 iters, 200 per VU

running (04m04.9s), 500/500 VUs, 91395 complete and 0 interrupted iterations
fixed_iterations   [  91% ] 500 VUs  04m04.9s/10m0s  091395/100000 iters, 200 per VU

running (04m05.9s), 500/500 VUs, 91773 complete and 0 interrupted iterations
fixed_iterations   [  92% ] 500 VUs  04m05.9s/10m0s  091773/100000 iters, 200 per VU

running (04m06.9s), 500/500 VUs, 92133 complete and 0 interrupted iterations
fixed_iterations   [  92% ] 500 VUs  04m06.9s/10m0s  092133/100000 iters, 200 per VU

running (04m07.9s), 500/500 VUs, 92512 complete and 0 interrupted iterations
fixed_iterations   [  93% ] 500 VUs  04m07.9s/10m0s  092512/100000 iters, 200 per VU

running (04m08.9s), 500/500 VUs, 92890 complete and 0 interrupted iterations
fixed_iterations   [  93% ] 500 VUs  04m08.9s/10m0s  092890/100000 iters, 200 per VU

running (04m09.9s), 500/500 VUs, 93250 complete and 0 interrupted iterations
fixed_iterations   [  93% ] 500 VUs  04m09.9s/10m0s  093250/100000 iters, 200 per VU

running (04m10.9s), 500/500 VUs, 93621 complete and 0 interrupted iterations
fixed_iterations   [  94% ] 500 VUs  04m10.9s/10m0s  093621/100000 iters, 200 per VU

running (04m11.9s), 500/500 VUs, 93987 complete and 0 interrupted iterations
fixed_iterations   [  94% ] 500 VUs  04m11.9s/10m0s  093987/100000 iters, 200 per VU

running (04m12.9s), 500/500 VUs, 94374 complete and 0 interrupted iterations
fixed_iterations   [  94% ] 500 VUs  04m12.9s/10m0s  094374/100000 iters, 200 per VU

running (04m13.9s), 500/500 VUs, 94756 complete and 0 interrupted iterations
fixed_iterations   [  95% ] 500 VUs  04m13.9s/10m0s  094756/100000 iters, 200 per VU

running (04m14.9s), 500/500 VUs, 95114 complete and 0 interrupted iterations
fixed_iterations   [  95% ] 500 VUs  04m14.9s/10m0s  095114/100000 iters, 200 per VU

running (04m15.9s), 500/500 VUs, 95479 complete and 0 interrupted iterations
fixed_iterations   [  95% ] 500 VUs  04m15.9s/10m0s  095479/100000 iters, 200 per VU

running (04m16.9s), 500/500 VUs, 95852 complete and 0 interrupted iterations
fixed_iterations   [  96% ] 500 VUs  04m16.9s/10m0s  095852/100000 iters, 200 per VU

running (04m17.9s), 500/500 VUs, 96225 complete and 0 interrupted iterations
fixed_iterations   [  96% ] 500 VUs  04m17.9s/10m0s  096225/100000 iters, 200 per VU

running (04m18.9s), 500/500 VUs, 96600 complete and 0 interrupted iterations
fixed_iterations   [  97% ] 500 VUs  04m18.9s/10m0s  096600/100000 iters, 200 per VU

running (04m19.9s), 500/500 VUs, 96950 complete and 0 interrupted iterations
fixed_iterations   [  97% ] 500 VUs  04m19.9s/10m0s  096950/100000 iters, 200 per VU

running (04m20.9s), 500/500 VUs, 97315 complete and 0 interrupted iterations
fixed_iterations   [  97% ] 500 VUs  04m20.9s/10m0s  097315/100000 iters, 200 per VU

running (04m21.9s), 500/500 VUs, 97682 complete and 0 interrupted iterations
fixed_iterations   [  98% ] 500 VUs  04m21.9s/10m0s  097682/100000 iters, 200 per VU

running (04m22.9s), 500/500 VUs, 98045 complete and 0 interrupted iterations
fixed_iterations   [  98% ] 500 VUs  04m22.9s/10m0s  098045/100000 iters, 200 per VU

running (04m23.9s), 500/500 VUs, 98417 complete and 0 interrupted iterations
fixed_iterations   [  98% ] 500 VUs  04m23.9s/10m0s  098417/100000 iters, 200 per VU

running (04m24.9s), 500/500 VUs, 98789 complete and 0 interrupted iterations
fixed_iterations   [  99% ] 500 VUs  04m24.9s/10m0s  098789/100000 iters, 200 per VU

running (04m25.9s), 500/500 VUs, 99153 complete and 0 interrupted iterations
fixed_iterations   [  99% ] 500 VUs  04m25.9s/10m0s  099153/100000 iters, 200 per VU

running (04m26.9s), 460/500 VUs, 99516 complete and 0 interrupted iterations
fixed_iterations   [ 100% ] 500 VUs  04m26.9s/10m0s  099516/100000 iters, 200 per VU

running (04m27.9s), 068/500 VUs, 99932 complete and 0 interrupted iterations
fixed_iterations   [ 100% ] 500 VUs  04m27.9s/10m0s  099932/100000 iters, 200 per VU


  █ TOTAL RESULTS 

    checks_total.......: 100000  372.992387/s
    checks_succeeded...: 100.00% 100000 out of 100000
    checks_failed......: 0.00%   0 out of 100000

    ✓ status is 200

    HTTP
    http_req_duration..............: avg=1.33s min=12.12ms med=1.38s max=1.58s p(90)=1.39s p(95)=1.4s
      { expected_response:true }...: avg=1.33s min=12.12ms med=1.38s max=1.58s p(90)=1.39s p(95)=1.4s
    http_req_failed................: 0.00%  0 out of 100000
    http_reqs......................: 100000 372.992387/s

    EXECUTION
    iteration_duration.............: avg=1.33s min=33.54ms med=1.38s max=1.58s p(90)=1.39s p(95)=1.4s
    iterations.....................: 100000 372.992387/s
    vus............................: 68     min=68          max=500
    vus_max........................: 500    min=500         max=500

    NETWORK
    data_received..................: 22 MB  81 kB/s
    data_sent......................: 14 MB  51 kB/s




running (04m28.1s), 000/500 VUs, 100000 complete and 0 interrupted iterations
fixed_iterations ✓ [ 100% ] 500 VUs  04m28.1s/10m0s  100000/100000 iters, 200 per VU
