
         /\      Grafana   /‾‾/  
    /\  /  \     |\  __   /  /   
   /  \/    \    | |/ /  /   ‾‾\ 
  /          \   |   (  |  (‾)  |
 / __________ \  |_|\_\  \_____/ 

     execution: local
        script: ./script.js
        output: -

     scenarios: (100.00%) 1 scenario, 500 max VUs, 10m30s max duration (incl. graceful stop):
              * fixed_iterations: 200 iterations for each of 500 VUs (maxDuration: 10m0s, gracefulStop: 30s)


running (00m00.9s), 500/500 VUs, 939 complete and 0 interrupted iterations
fixed_iterations   [   1% ] 500 VUs  00m00.9s/10m0s  000939/100000 iters, 200 per VU

running (00m01.9s), 500/500 VUs, 2000 complete and 0 interrupted iterations
fixed_iterations   [   2% ] 500 VUs  00m01.9s/10m0s  002000/100000 iters, 200 per VU

running (00m02.9s), 500/500 VUs, 3040 complete and 0 interrupted iterations
fixed_iterations   [   3% ] 500 VUs  00m02.9s/10m0s  003040/100000 iters, 200 per VU

running (00m03.9s), 500/500 VUs, 4131 complete and 0 interrupted iterations
fixed_iterations   [   4% ] 500 VUs  00m03.9s/10m0s  004131/100000 iters, 200 per VU

running (00m04.9s), 500/500 VUs, 5231 complete and 0 interrupted iterations
fixed_iterations   [   5% ] 500 VUs  00m04.9s/10m0s  005231/100000 iters, 200 per VU

running (00m05.9s), 500/500 VUs, 6293 complete and 0 interrupted iterations
fixed_iterations   [   6% ] 500 VUs  00m05.9s/10m0s  006293/100000 iters, 200 per VU

running (00m06.9s), 500/500 VUs, 7376 complete and 0 interrupted iterations
fixed_iterations   [   7% ] 500 VUs  00m06.9s/10m0s  007376/100000 iters, 200 per VU

running (00m07.9s), 500/500 VUs, 8428 complete and 0 interrupted iterations
fixed_iterations   [   8% ] 500 VUs  00m07.9s/10m0s  008428/100000 iters, 200 per VU

running (00m08.9s), 500/500 VUs, 9505 complete and 0 interrupted iterations
fixed_iterations   [  10% ] 500 VUs  00m08.9s/10m0s  009505/100000 iters, 200 per VU

running (00m09.9s), 500/500 VUs, 10609 complete and 0 interrupted iterations
fixed_iterations   [  11% ] 500 VUs  00m09.9s/10m0s  010609/100000 iters, 200 per VU

running (00m10.9s), 500/500 VUs, 11698 complete and 0 interrupted iterations
fixed_iterations   [  12% ] 500 VUs  00m10.9s/10m0s  011698/100000 iters, 200 per VU

running (00m11.9s), 500/500 VUs, 12733 complete and 0 interrupted iterations
fixed_iterations   [  13% ] 500 VUs  00m11.9s/10m0s  012733/100000 iters, 200 per VU

running (00m12.9s), 500/500 VUs, 13837 complete and 0 interrupted iterations
fixed_iterations   [  14% ] 500 VUs  00m12.9s/10m0s  013837/100000 iters, 200 per VU

running (00m13.9s), 500/500 VUs, 14956 complete and 0 interrupted iterations
fixed_iterations   [  15% ] 500 VUs  00m13.9s/10m0s  014956/100000 iters, 200 per VU

running (00m14.9s), 500/500 VUs, 16066 complete and 0 interrupted iterations
fixed_iterations   [  16% ] 500 VUs  00m14.9s/10m0s  016066/100000 iters, 200 per VU

running (00m15.9s), 500/500 VUs, 17153 complete and 0 interrupted iterations
fixed_iterations   [  17% ] 500 VUs  00m15.9s/10m0s  017153/100000 iters, 200 per VU

running (00m16.9s), 500/500 VUs, 18272 complete and 0 interrupted iterations
fixed_iterations   [  18% ] 500 VUs  00m16.9s/10m0s  018272/100000 iters, 200 per VU

running (00m17.9s), 500/500 VUs, 19384 complete and 0 interrupted iterations
fixed_iterations   [  19% ] 500 VUs  00m17.9s/10m0s  019384/100000 iters, 200 per VU

running (00m18.9s), 500/500 VUs, 20504 complete and 0 interrupted iterations
fixed_iterations   [  21% ] 500 VUs  00m18.9s/10m0s  020504/100000 iters, 200 per VU

running (00m19.9s), 500/500 VUs, 21592 complete and 0 interrupted iterations
fixed_iterations   [  22% ] 500 VUs  00m19.9s/10m0s  021592/100000 iters, 200 per VU

running (00m20.9s), 500/500 VUs, 22078 complete and 0 interrupted iterations
fixed_iterations   [  22% ] 500 VUs  00m20.9s/10m0s  022078/100000 iters, 200 per VU

running (00m21.9s), 500/500 VUs, 22728 complete and 0 interrupted iterations
fixed_iterations   [  23% ] 500 VUs  00m21.9s/10m0s  022728/100000 iters, 200 per VU

running (00m22.9s), 500/500 VUs, 23116 complete and 0 interrupted iterations
fixed_iterations   [  23% ] 500 VUs  00m22.9s/10m0s  023116/100000 iters, 200 per VU

running (00m23.9s), 500/500 VUs, 23678 complete and 0 interrupted iterations
fixed_iterations   [  24% ] 500 VUs  00m23.9s/10m0s  023678/100000 iters, 200 per VU

running (00m24.9s), 500/500 VUs, 24037 complete and 0 interrupted iterations
fixed_iterations   [  24% ] 500 VUs  00m24.9s/10m0s  024037/100000 iters, 200 per VU

running (00m25.9s), 500/500 VUs, 24405 complete and 0 interrupted iterations
fixed_iterations   [  24% ] 500 VUs  00m25.9s/10m0s  024405/100000 iters, 200 per VU

running (00m26.9s), 500/500 VUs, 24949 complete and 0 interrupted iterations
fixed_iterations   [  25% ] 500 VUs  00m26.9s/10m0s  024949/100000 iters, 200 per VU

running (00m27.9s), 500/500 VUs, 25437 complete and 0 interrupted iterations
fixed_iterations   [  25% ] 500 VUs  00m27.9s/10m0s  025437/100000 iters, 200 per VU

running (00m28.9s), 500/500 VUs, 25809 complete and 0 interrupted iterations
fixed_iterations   [  26% ] 500 VUs  00m28.9s/10m0s  025809/100000 iters, 200 per VU

running (00m29.9s), 500/500 VUs, 26487 complete and 0 interrupted iterations
fixed_iterations   [  26% ] 500 VUs  00m29.9s/10m0s  026487/100000 iters, 200 per VU

running (00m30.9s), 500/500 VUs, 26854 complete and 0 interrupted iterations
fixed_iterations   [  27% ] 500 VUs  00m30.9s/10m0s  026854/100000 iters, 200 per VU

running (00m31.9s), 500/500 VUs, 27619 complete and 0 interrupted iterations
fixed_iterations   [  28% ] 500 VUs  00m31.9s/10m0s  027619/100000 iters, 200 per VU

running (00m32.9s), 500/500 VUs, 28091 complete and 0 interrupted iterations
fixed_iterations   [  28% ] 500 VUs  00m32.9s/10m0s  028091/100000 iters, 200 per VU

running (00m33.9s), 500/500 VUs, 28467 complete and 0 interrupted iterations
fixed_iterations   [  28% ] 500 VUs  00m33.9s/10m0s  028467/100000 iters, 200 per VU

running (00m34.9s), 500/500 VUs, 28844 complete and 0 interrupted iterations
fixed_iterations   [  29% ] 500 VUs  00m34.9s/10m0s  028844/100000 iters, 200 per VU

running (00m35.9s), 500/500 VUs, 29757 complete and 0 interrupted iterations
fixed_iterations   [  30% ] 500 VUs  00m35.9s/10m0s  029757/100000 iters, 200 per VU

running (00m36.9s), 500/500 VUs, 30377 complete and 0 interrupted iterations
fixed_iterations   [  30% ] 500 VUs  00m36.9s/10m0s  030377/100000 iters, 200 per VU

running (00m37.9s), 500/500 VUs, 30741 complete and 0 interrupted iterations
fixed_iterations   [  31% ] 500 VUs  00m37.9s/10m0s  030741/100000 iters, 200 per VU

running (00m38.9s), 500/500 VUs, 31099 complete and 0 interrupted iterations
fixed_iterations   [  31% ] 500 VUs  00m38.9s/10m0s  031099/100000 iters, 200 per VU

running (00m39.9s), 500/500 VUs, 31478 complete and 0 interrupted iterations
fixed_iterations   [  31% ] 500 VUs  00m39.9s/10m0s  031478/100000 iters, 200 per VU

running (00m40.9s), 500/500 VUs, 31858 complete and 0 interrupted iterations
fixed_iterations   [  32% ] 500 VUs  00m40.9s/10m0s  031858/100000 iters, 200 per VU

running (00m41.9s), 500/500 VUs, 32461 complete and 0 interrupted iterations
fixed_iterations   [  32% ] 500 VUs  00m41.9s/10m0s  032461/100000 iters, 200 per VU

running (00m42.9s), 500/500 VUs, 32832 complete and 0 interrupted iterations
fixed_iterations   [  33% ] 500 VUs  00m42.9s/10m0s  032832/100000 iters, 200 per VU

running (00m43.9s), 500/500 VUs, 33202 complete and 0 interrupted iterations
fixed_iterations   [  33% ] 500 VUs  00m43.9s/10m0s  033202/100000 iters, 200 per VU

running (00m44.9s), 500/500 VUs, 33770 complete and 0 interrupted iterations
fixed_iterations   [  34% ] 500 VUs  00m44.9s/10m0s  033770/100000 iters, 200 per VU

running (00m45.9s), 500/500 VUs, 34128 complete and 0 interrupted iterations
fixed_iterations   [  34% ] 500 VUs  00m45.9s/10m0s  034128/100000 iters, 200 per VU

running (00m46.9s), 500/500 VUs, 34687 complete and 0 interrupted iterations
fixed_iterations   [  35% ] 500 VUs  00m46.9s/10m0s  034687/100000 iters, 200 per VU

running (00m47.9s), 500/500 VUs, 35129 complete and 0 interrupted iterations
fixed_iterations   [  35% ] 500 VUs  00m47.9s/10m0s  035129/100000 iters, 200 per VU

running (00m48.9s), 500/500 VUs, 36156 complete and 0 interrupted iterations
fixed_iterations   [  36% ] 500 VUs  00m48.9s/10m0s  036156/100000 iters, 200 per VU

running (00m49.9s), 500/500 VUs, 37118 complete and 0 interrupted iterations
fixed_iterations   [  37% ] 500 VUs  00m49.9s/10m0s  037118/100000 iters, 200 per VU

running (00m50.9s), 500/500 VUs, 38073 complete and 0 interrupted iterations
fixed_iterations   [  38% ] 500 VUs  00m50.9s/10m0s  038073/100000 iters, 200 per VU

running (00m51.9s), 500/500 VUs, 39074 complete and 0 interrupted iterations
fixed_iterations   [  39% ] 500 VUs  00m51.9s/10m0s  039074/100000 iters, 200 per VU

running (00m52.9s), 500/500 VUs, 39997 complete and 0 interrupted iterations
fixed_iterations   [  40% ] 500 VUs  00m52.9s/10m0s  039997/100000 iters, 200 per VU

running (00m53.9s), 500/500 VUs, 40449 complete and 0 interrupted iterations
fixed_iterations   [  40% ] 500 VUs  00m53.9s/10m0s  040449/100000 iters, 200 per VU

running (00m54.9s), 500/500 VUs, 41046 complete and 0 interrupted iterations
fixed_iterations   [  41% ] 500 VUs  00m54.9s/10m0s  041046/100000 iters, 200 per VU

running (00m55.9s), 500/500 VUs, 41435 complete and 0 interrupted iterations
fixed_iterations   [  41% ] 500 VUs  00m55.9s/10m0s  041435/100000 iters, 200 per VU

running (00m56.9s), 500/500 VUs, 41952 complete and 0 interrupted iterations
fixed_iterations   [  42% ] 500 VUs  00m56.9s/10m0s  041952/100000 iters, 200 per VU

running (00m57.9s), 500/500 VUs, 42753 complete and 0 interrupted iterations
fixed_iterations   [  43% ] 500 VUs  00m57.9s/10m0s  042753/100000 iters, 200 per VU

running (00m58.9s), 500/500 VUs, 43125 complete and 0 interrupted iterations
fixed_iterations   [  43% ] 500 VUs  00m58.9s/10m0s  043125/100000 iters, 200 per VU

running (00m59.9s), 500/500 VUs, 43497 complete and 0 interrupted iterations
fixed_iterations   [  43% ] 500 VUs  00m59.9s/10m0s  043497/100000 iters, 200 per VU

running (01m00.9s), 500/500 VUs, 44236 complete and 0 interrupted iterations
fixed_iterations   [  44% ] 500 VUs  01m00.9s/10m0s  044236/100000 iters, 200 per VU

running (01m01.9s), 500/500 VUs, 45129 complete and 0 interrupted iterations
fixed_iterations   [  45% ] 500 VUs  01m01.9s/10m0s  045129/100000 iters, 200 per VU

running (01m02.9s), 500/500 VUs, 46154 complete and 0 interrupted iterations
fixed_iterations   [  46% ] 500 VUs  01m02.9s/10m0s  046154/100000 iters, 200 per VU

running (01m03.9s), 500/500 VUs, 47191 complete and 0 interrupted iterations
fixed_iterations   [  47% ] 500 VUs  01m03.9s/10m0s  047191/100000 iters, 200 per VU

running (01m04.9s), 500/500 VUs, 48240 complete and 0 interrupted iterations
fixed_iterations   [  48% ] 500 VUs  01m04.9s/10m0s  048240/100000 iters, 200 per VU

running (01m05.9s), 500/500 VUs, 49316 complete and 0 interrupted iterations
fixed_iterations   [  49% ] 500 VUs  01m05.9s/10m0s  049316/100000 iters, 200 per VU

running (01m06.9s), 500/500 VUs, 50411 complete and 0 interrupted iterations
fixed_iterations   [  50% ] 500 VUs  01m06.9s/10m0s  050411/100000 iters, 200 per VU

running (01m07.9s), 500/500 VUs, 51050 complete and 0 interrupted iterations
fixed_iterations   [  51% ] 500 VUs  01m07.9s/10m0s  051050/100000 iters, 200 per VU

running (01m08.9s), 500/500 VUs, 51419 complete and 0 interrupted iterations
fixed_iterations   [  51% ] 500 VUs  01m08.9s/10m0s  051419/100000 iters, 200 per VU

running (01m09.9s), 500/500 VUs, 52011 complete and 0 interrupted iterations
fixed_iterations   [  52% ] 500 VUs  01m09.9s/10m0s  052011/100000 iters, 200 per VU

running (01m10.9s), 500/500 VUs, 52456 complete and 0 interrupted iterations
fixed_iterations   [  52% ] 500 VUs  01m10.9s/10m0s  052456/100000 iters, 200 per VU

running (01m11.9s), 500/500 VUs, 53151 complete and 0 interrupted iterations
fixed_iterations   [  53% ] 500 VUs  01m11.9s/10m0s  053151/100000 iters, 200 per VU

running (01m12.9s), 500/500 VUs, 53607 complete and 0 interrupted iterations
fixed_iterations   [  54% ] 500 VUs  01m12.9s/10m0s  053607/100000 iters, 200 per VU

running (01m13.9s), 500/500 VUs, 54041 complete and 0 interrupted iterations
fixed_iterations   [  54% ] 500 VUs  01m13.9s/10m0s  054041/100000 iters, 200 per VU

running (01m14.9s), 500/500 VUs, 54416 complete and 0 interrupted iterations
fixed_iterations   [  54% ] 500 VUs  01m14.9s/10m0s  054416/100000 iters, 200 per VU

running (01m15.9s), 500/500 VUs, 54881 complete and 0 interrupted iterations
fixed_iterations   [  55% ] 500 VUs  01m15.9s/10m0s  054881/100000 iters, 200 per VU

running (01m16.9s), 500/500 VUs, 55608 complete and 0 interrupted iterations
fixed_iterations   [  56% ] 500 VUs  01m16.9s/10m0s  055608/100000 iters, 200 per VU

running (01m17.9s), 500/500 VUs, 56003 complete and 0 interrupted iterations
fixed_iterations   [  56% ] 500 VUs  01m17.9s/10m0s  056003/100000 iters, 200 per VU

running (01m18.9s), 500/500 VUs, 56381 complete and 0 interrupted iterations
fixed_iterations   [  56% ] 500 VUs  01m18.9s/10m0s  056381/100000 iters, 200 per VU

running (01m19.9s), 500/500 VUs, 57009 complete and 0 interrupted iterations
fixed_iterations   [  57% ] 500 VUs  01m19.9s/10m0s  057009/100000 iters, 200 per VU

running (01m20.9s), 500/500 VUs, 57376 complete and 0 interrupted iterations
fixed_iterations   [  57% ] 500 VUs  01m20.9s/10m0s  057376/100000 iters, 200 per VU

running (01m21.9s), 500/500 VUs, 58087 complete and 0 interrupted iterations
fixed_iterations   [  58% ] 500 VUs  01m21.9s/10m0s  058087/100000 iters, 200 per VU

running (01m22.9s), 500/500 VUs, 58588 complete and 0 interrupted iterations
fixed_iterations   [  59% ] 500 VUs  01m22.9s/10m0s  058588/100000 iters, 200 per VU

running (01m23.9s), 500/500 VUs, 58966 complete and 0 interrupted iterations
fixed_iterations   [  59% ] 500 VUs  01m23.9s/10m0s  058966/100000 iters, 200 per VU

running (01m24.9s), 500/500 VUs, 59338 complete and 0 interrupted iterations
fixed_iterations   [  59% ] 500 VUs  01m24.9s/10m0s  059338/100000 iters, 200 per VU

running (01m25.9s), 500/500 VUs, 59878 complete and 0 interrupted iterations
fixed_iterations   [  60% ] 500 VUs  01m25.9s/10m0s  059878/100000 iters, 200 per VU

running (01m26.9s), 500/500 VUs, 60369 complete and 0 interrupted iterations
fixed_iterations   [  60% ] 500 VUs  01m26.9s/10m0s  060369/100000 iters, 200 per VU

running (01m27.9s), 500/500 VUs, 60766 complete and 0 interrupted iterations
fixed_iterations   [  61% ] 500 VUs  01m27.9s/10m0s  060766/100000 iters, 200 per VU

running (01m28.9s), 500/500 VUs, 61125 complete and 0 interrupted iterations
fixed_iterations   [  61% ] 500 VUs  01m28.9s/10m0s  061125/100000 iters, 200 per VU

running (01m29.9s), 500/500 VUs, 61480 complete and 0 interrupted iterations
fixed_iterations   [  61% ] 500 VUs  01m29.9s/10m0s  061480/100000 iters, 200 per VU

running (01m30.9s), 500/500 VUs, 61839 complete and 0 interrupted iterations
fixed_iterations   [  62% ] 500 VUs  01m30.9s/10m0s  061839/100000 iters, 200 per VU

running (01m31.9s), 500/500 VUs, 62537 complete and 0 interrupted iterations
fixed_iterations   [  63% ] 500 VUs  01m31.9s/10m0s  062537/100000 iters, 200 per VU

running (01m32.9s), 500/500 VUs, 63038 complete and 0 interrupted iterations
fixed_iterations   [  63% ] 500 VUs  01m32.9s/10m0s  063038/100000 iters, 200 per VU

running (01m33.9s), 500/500 VUs, 63399 complete and 0 interrupted iterations
fixed_iterations   [  63% ] 500 VUs  01m33.9s/10m0s  063399/100000 iters, 200 per VU

running (01m34.9s), 500/500 VUs, 63767 complete and 0 interrupted iterations
fixed_iterations   [  64% ] 500 VUs  01m34.9s/10m0s  063767/100000 iters, 200 per VU

running (01m35.9s), 500/500 VUs, 64123 complete and 0 interrupted iterations
fixed_iterations   [  64% ] 500 VUs  01m35.9s/10m0s  064123/100000 iters, 200 per VU

running (01m36.9s), 500/500 VUs, 64688 complete and 0 interrupted iterations
fixed_iterations   [  65% ] 500 VUs  01m36.9s/10m0s  064688/100000 iters, 200 per VU

running (01m37.9s), 500/500 VUs, 65061 complete and 0 interrupted iterations
fixed_iterations   [  65% ] 500 VUs  01m37.9s/10m0s  065061/100000 iters, 200 per VU

running (01m38.9s), 500/500 VUs, 65424 complete and 0 interrupted iterations
fixed_iterations   [  65% ] 500 VUs  01m38.9s/10m0s  065424/100000 iters, 200 per VU

running (01m39.9s), 500/500 VUs, 65788 complete and 0 interrupted iterations
fixed_iterations   [  66% ] 500 VUs  01m39.9s/10m0s  065788/100000 iters, 200 per VU

running (01m40.9s), 500/500 VUs, 66384 complete and 0 interrupted iterations
fixed_iterations   [  66% ] 500 VUs  01m40.9s/10m0s  066384/100000 iters, 200 per VU

running (01m41.9s), 500/500 VUs, 67336 complete and 0 interrupted iterations
fixed_iterations   [  67% ] 500 VUs  01m41.9s/10m0s  067336/100000 iters, 200 per VU

running (01m42.9s), 500/500 VUs, 67939 complete and 0 interrupted iterations
fixed_iterations   [  68% ] 500 VUs  01m42.9s/10m0s  067939/100000 iters, 200 per VU

running (01m43.9s), 500/500 VUs, 68533 complete and 0 interrupted iterations
fixed_iterations   [  69% ] 500 VUs  01m43.9s/10m0s  068533/100000 iters, 200 per VU

running (01m44.9s), 500/500 VUs, 69128 complete and 0 interrupted iterations
fixed_iterations   [  69% ] 500 VUs  01m44.9s/10m0s  069128/100000 iters, 200 per VU

running (01m45.9s), 500/500 VUs, 69840 complete and 0 interrupted iterations
fixed_iterations   [  70% ] 500 VUs  01m45.9s/10m0s  069840/100000 iters, 200 per VU

running (01m46.9s), 500/500 VUs, 70557 complete and 0 interrupted iterations
fixed_iterations   [  71% ] 500 VUs  01m46.9s/10m0s  070557/100000 iters, 200 per VU

running (01m47.9s), 500/500 VUs, 71046 complete and 0 interrupted iterations
fixed_iterations   [  71% ] 500 VUs  01m47.9s/10m0s  071046/100000 iters, 200 per VU

running (01m48.9s), 500/500 VUs, 71441 complete and 0 interrupted iterations
fixed_iterations   [  71% ] 500 VUs  01m48.9s/10m0s  071441/100000 iters, 200 per VU

running (01m49.9s), 500/500 VUs, 71821 complete and 0 interrupted iterations
fixed_iterations   [  72% ] 500 VUs  01m49.9s/10m0s  071821/100000 iters, 200 per VU

running (01m50.9s), 500/500 VUs, 72422 complete and 0 interrupted iterations
fixed_iterations   [  72% ] 500 VUs  01m50.9s/10m0s  072422/100000 iters, 200 per VU

running (01m51.9s), 500/500 VUs, 73033 complete and 0 interrupted iterations
fixed_iterations   [  73% ] 500 VUs  01m51.9s/10m0s  073033/100000 iters, 200 per VU

running (01m52.9s), 500/500 VUs, 73413 complete and 0 interrupted iterations
fixed_iterations   [  73% ] 500 VUs  01m52.9s/10m0s  073413/100000 iters, 200 per VU

running (01m53.9s), 500/500 VUs, 74207 complete and 0 interrupted iterations
fixed_iterations   [  74% ] 500 VUs  01m53.9s/10m0s  074207/100000 iters, 200 per VU

running (01m54.9s), 500/500 VUs, 75064 complete and 0 interrupted iterations
fixed_iterations   [  75% ] 500 VUs  01m54.9s/10m0s  075064/100000 iters, 200 per VU

running (01m55.9s), 500/500 VUs, 76018 complete and 0 interrupted iterations
fixed_iterations   [  76% ] 500 VUs  01m55.9s/10m0s  076018/100000 iters, 200 per VU

running (01m56.9s), 500/500 VUs, 76878 complete and 0 interrupted iterations
fixed_iterations   [  77% ] 500 VUs  01m56.9s/10m0s  076878/100000 iters, 200 per VU

running (01m57.9s), 500/500 VUs, 77712 complete and 0 interrupted iterations
fixed_iterations   [  78% ] 500 VUs  01m57.9s/10m0s  077712/100000 iters, 200 per VU

running (01m58.9s), 500/500 VUs, 78269 complete and 0 interrupted iterations
fixed_iterations   [  78% ] 500 VUs  01m58.9s/10m0s  078269/100000 iters, 200 per VU

running (01m59.9s), 500/500 VUs, 78995 complete and 0 interrupted iterations
fixed_iterations   [  79% ] 500 VUs  01m59.9s/10m0s  078995/100000 iters, 200 per VU

running (02m00.9s), 500/500 VUs, 79692 complete and 0 interrupted iterations
fixed_iterations   [  80% ] 500 VUs  02m00.9s/10m0s  079692/100000 iters, 200 per VU

running (02m01.9s), 500/500 VUs, 80347 complete and 0 interrupted iterations
fixed_iterations   [  80% ] 500 VUs  02m01.9s/10m0s  080347/100000 iters, 200 per VU

running (02m02.9s), 500/500 VUs, 80911 complete and 0 interrupted iterations
fixed_iterations   [  81% ] 500 VUs  02m02.9s/10m0s  080911/100000 iters, 200 per VU

running (02m03.9s), 500/500 VUs, 81570 complete and 0 interrupted iterations
fixed_iterations   [  82% ] 500 VUs  02m03.9s/10m0s  081570/100000 iters, 200 per VU

running (02m04.9s), 500/500 VUs, 82277 complete and 0 interrupted iterations
fixed_iterations   [  82% ] 500 VUs  02m04.9s/10m0s  082277/100000 iters, 200 per VU

running (02m05.9s), 500/500 VUs, 82799 complete and 0 interrupted iterations
fixed_iterations   [  83% ] 500 VUs  02m05.9s/10m0s  082799/100000 iters, 200 per VU

running (02m06.9s), 500/500 VUs, 83579 complete and 0 interrupted iterations
fixed_iterations   [  84% ] 500 VUs  02m06.9s/10m0s  083579/100000 iters, 200 per VU

running (02m07.9s), 500/500 VUs, 84013 complete and 0 interrupted iterations
fixed_iterations   [  84% ] 500 VUs  02m07.9s/10m0s  084013/100000 iters, 200 per VU

running (02m08.9s), 500/500 VUs, 84460 complete and 0 interrupted iterations
fixed_iterations   [  84% ] 500 VUs  02m08.9s/10m0s  084460/100000 iters, 200 per VU

running (02m09.9s), 500/500 VUs, 84959 complete and 0 interrupted iterations
fixed_iterations   [  85% ] 500 VUs  02m09.9s/10m0s  084959/100000 iters, 200 per VU

running (02m10.9s), 500/500 VUs, 85319 complete and 0 interrupted iterations
fixed_iterations   [  85% ] 500 VUs  02m10.9s/10m0s  085319/100000 iters, 200 per VU

running (02m11.9s), 500/500 VUs, 85984 complete and 0 interrupted iterations
fixed_iterations   [  86% ] 500 VUs  02m11.9s/10m0s  085984/100000 iters, 200 per VU

running (02m12.9s), 500/500 VUs, 86461 complete and 0 interrupted iterations
fixed_iterations   [  86% ] 500 VUs  02m12.9s/10m0s  086461/100000 iters, 200 per VU

running (02m13.9s), 500/500 VUs, 86821 complete and 0 interrupted iterations
fixed_iterations   [  87% ] 500 VUs  02m13.9s/10m0s  086821/100000 iters, 200 per VU

running (02m14.9s), 500/500 VUs, 87231 complete and 0 interrupted iterations
fixed_iterations   [  87% ] 500 VUs  02m14.9s/10m0s  087231/100000 iters, 200 per VU

running (02m15.9s), 500/500 VUs, 87597 complete and 0 interrupted iterations
fixed_iterations   [  88% ] 500 VUs  02m15.9s/10m0s  087597/100000 iters, 200 per VU

running (02m16.9s), 500/500 VUs, 88164 complete and 0 interrupted iterations
fixed_iterations   [  88% ] 500 VUs  02m16.9s/10m0s  088164/100000 iters, 200 per VU

running (02m17.9s), 500/500 VUs, 88516 complete and 0 interrupted iterations
fixed_iterations   [  89% ] 500 VUs  02m17.9s/10m0s  088516/100000 iters, 200 per VU

running (02m18.9s), 500/500 VUs, 88946 complete and 0 interrupted iterations
fixed_iterations   [  89% ] 500 VUs  02m18.9s/10m0s  088946/100000 iters, 200 per VU

running (02m19.9s), 500/500 VUs, 89330 complete and 0 interrupted iterations
fixed_iterations   [  89% ] 500 VUs  02m19.9s/10m0s  089330/100000 iters, 200 per VU

running (02m20.9s), 500/500 VUs, 89713 complete and 0 interrupted iterations
fixed_iterations   [  90% ] 500 VUs  02m20.9s/10m0s  089713/100000 iters, 200 per VU

running (02m21.9s), 500/500 VUs, 90507 complete and 0 interrupted iterations
fixed_iterations   [  91% ] 500 VUs  02m21.9s/10m0s  090507/100000 iters, 200 per VU

running (02m22.9s), 500/500 VUs, 90909 complete and 0 interrupted iterations
fixed_iterations   [  91% ] 500 VUs  02m22.9s/10m0s  090909/100000 iters, 200 per VU

running (02m23.9s), 500/500 VUs, 91266 complete and 0 interrupted iterations
fixed_iterations   [  91% ] 500 VUs  02m23.9s/10m0s  091266/100000 iters, 200 per VU

running (02m24.9s), 500/500 VUs, 91682 complete and 0 interrupted iterations
fixed_iterations   [  92% ] 500 VUs  02m24.9s/10m0s  091682/100000 iters, 200 per VU

running (02m25.9s), 500/500 VUs, 92060 complete and 0 interrupted iterations
fixed_iterations   [  92% ] 500 VUs  02m25.9s/10m0s  092060/100000 iters, 200 per VU

running (02m26.9s), 500/500 VUs, 92560 complete and 0 interrupted iterations
fixed_iterations   [  93% ] 500 VUs  02m26.9s/10m0s  092560/100000 iters, 200 per VU

running (02m27.9s), 500/500 VUs, 93345 complete and 0 interrupted iterations
fixed_iterations   [  93% ] 500 VUs  02m27.9s/10m0s  093345/100000 iters, 200 per VU

running (02m28.9s), 500/500 VUs, 93780 complete and 0 interrupted iterations
fixed_iterations   [  94% ] 500 VUs  02m28.9s/10m0s  093780/100000 iters, 200 per VU

running (02m29.9s), 500/500 VUs, 94143 complete and 0 interrupted iterations
fixed_iterations   [  94% ] 500 VUs  02m29.9s/10m0s  094143/100000 iters, 200 per VU

running (02m30.9s), 500/500 VUs, 94789 complete and 0 interrupted iterations
fixed_iterations   [  95% ] 500 VUs  02m30.9s/10m0s  094789/100000 iters, 200 per VU

running (02m31.9s), 500/500 VUs, 95356 complete and 0 interrupted iterations
fixed_iterations   [  95% ] 500 VUs  02m31.9s/10m0s  095356/100000 iters, 200 per VU

running (02m32.9s), 500/500 VUs, 95801 complete and 0 interrupted iterations
fixed_iterations   [  96% ] 500 VUs  02m32.9s/10m0s  095801/100000 iters, 200 per VU

running (02m33.9s), 500/500 VUs, 96319 complete and 0 interrupted iterations
fixed_iterations   [  96% ] 500 VUs  02m33.9s/10m0s  096319/100000 iters, 200 per VU

running (02m34.9s), 500/500 VUs, 96893 complete and 0 interrupted iterations
fixed_iterations   [  97% ] 500 VUs  02m34.9s/10m0s  096893/100000 iters, 200 per VU

running (02m35.9s), 500/500 VUs, 97267 complete and 0 interrupted iterations
fixed_iterations   [  97% ] 500 VUs  02m35.9s/10m0s  097267/100000 iters, 200 per VU

running (02m36.9s), 500/500 VUs, 97872 complete and 0 interrupted iterations
fixed_iterations   [  98% ] 500 VUs  02m36.9s/10m0s  097872/100000 iters, 200 per VU

running (02m37.9s), 500/500 VUs, 98245 complete and 0 interrupted iterations
fixed_iterations   [  98% ] 500 VUs  02m37.9s/10m0s  098245/100000 iters, 200 per VU

running (02m38.9s), 500/500 VUs, 98614 complete and 0 interrupted iterations
fixed_iterations   [  99% ] 500 VUs  02m38.9s/10m0s  098614/100000 iters, 200 per VU

running (02m39.9s), 495/500 VUs, 98987 complete and 0 interrupted iterations
fixed_iterations   [  99% ] 500 VUs  02m39.9s/10m0s  098987/100000 iters, 200 per VU

running (02m40.9s), 453/500 VUs, 99361 complete and 0 interrupted iterations
fixed_iterations   [  99% ] 500 VUs  02m40.9s/10m0s  099361/100000 iters, 200 per VU

running (02m41.9s), 000/500 VUs, 100000 complete and 0 interrupted iterations
fixed_iterations ✓ [ 100% ] 500 VUs  02m41.9s/10m0s  100000/100000 iters, 200 per VU


  █ TOTAL RESULTS 

    checks_total.......: 100000  617.631233/s
    checks_succeeded...: 100.00% 100000 out of 100000
    checks_failed......: 0.00%   0 out of 100000

    ✓ status is 200

    HTTP
    http_req_duration..............: avg=806.84ms min=1ms    med=786.71ms max=1.48s p(90)=1.3s p(95)=1.38s
      { expected_response:true }...: avg=806.84ms min=1ms    med=786.71ms max=1.48s p(90)=1.3s p(95)=1.38s
    http_req_failed................: 0.00%  0 out of 100000
    http_reqs......................: 100000 617.631233/s

    EXECUTION
    iteration_duration.............: avg=807.24ms min=1.21ms med=787.03ms max=1.49s p(90)=1.3s p(95)=1.38s
    iterations.....................: 100000 617.631233/s
    vus............................: 453    min=453         max=500
    vus_max........................: 500    min=500         max=500

    NETWORK
    data_received..................: 22 MB  133 kB/s
    data_sent......................: 14 MB  84 kB/s




running (02m41.9s), 000/500 VUs, 100000 complete and 0 interrupted iterations
fixed_iterations ✓ [ 100% ] 500 VUs  02m41.9s/10m0s  100000/100000 iters, 200 per VU
