
         /\      Grafana   /‾‾/  
    /\  /  \     |\  __   /  /   
   /  \/    \    | |/ /  /   ‾‾\ 
  /          \   |   (  |  (‾)  |
 / __________ \  |_|\_\  \_____/ 

     execution: local
        script: ./script.js
        output: -

     scenarios: (100.00%) 1 scenario, 500 max VUs, 10m30s max duration (incl. graceful stop):
              * fixed_iterations: 200 iterations for each of 500 VUs (maxDuration: 10m0s, gracefulStop: 30s)


running (00m00.9s), 500/500 VUs, 420 complete and 0 interrupted iterations
fixed_iterations   [   0% ] 500 VUs  00m00.9s/10m0s  000420/100000 iters, 200 per VU

running (00m01.9s), 500/500 VUs, 774 complete and 0 interrupted iterations
fixed_iterations   [   1% ] 500 VUs  00m01.9s/10m0s  000774/100000 iters, 200 per VU

running (00m02.9s), 500/500 VUs, 1122 complete and 0 interrupted iterations
fixed_iterations   [   1% ] 500 VUs  00m02.9s/10m0s  001122/100000 iters, 200 per VU

running (00m03.9s), 500/500 VUs, 1510 complete and 0 interrupted iterations
fixed_iterations   [   2% ] 500 VUs  00m03.9s/10m0s  001510/100000 iters, 200 per VU

running (00m04.9s), 500/500 VUs, 2035 complete and 0 interrupted iterations
fixed_iterations   [   2% ] 500 VUs  00m04.9s/10m0s  002035/100000 iters, 200 per VU

running (00m05.9s), 500/500 VUs, 3139 complete and 0 interrupted iterations
fixed_iterations   [   3% ] 500 VUs  00m05.9s/10m0s  003139/100000 iters, 200 per VU

running (00m06.9s), 500/500 VUs, 4046 complete and 0 interrupted iterations
fixed_iterations   [   4% ] 500 VUs  00m06.9s/10m0s  004046/100000 iters, 200 per VU

running (00m07.9s), 500/500 VUs, 4920 complete and 0 interrupted iterations
fixed_iterations   [   5% ] 500 VUs  00m07.9s/10m0s  004920/100000 iters, 200 per VU

running (00m08.9s), 500/500 VUs, 5653 complete and 0 interrupted iterations
fixed_iterations   [   6% ] 500 VUs  00m08.9s/10m0s  005653/100000 iters, 200 per VU

running (00m09.9s), 500/500 VUs, 6399 complete and 0 interrupted iterations
fixed_iterations   [   6% ] 500 VUs  00m09.9s/10m0s  006399/100000 iters, 200 per VU

running (00m10.9s), 500/500 VUs, 6798 complete and 0 interrupted iterations
fixed_iterations   [   7% ] 500 VUs  00m10.9s/10m0s  006798/100000 iters, 200 per VU

running (00m11.9s), 500/500 VUs, 7368 complete and 0 interrupted iterations
fixed_iterations   [   7% ] 500 VUs  00m11.9s/10m0s  007368/100000 iters, 200 per VU

running (00m12.9s), 500/500 VUs, 7713 complete and 0 interrupted iterations
fixed_iterations   [   8% ] 500 VUs  00m12.9s/10m0s  007713/100000 iters, 200 per VU

running (00m13.9s), 500/500 VUs, 8078 complete and 0 interrupted iterations
fixed_iterations   [   8% ] 500 VUs  00m13.9s/10m0s  008078/100000 iters, 200 per VU

running (00m14.9s), 500/500 VUs, 8743 complete and 0 interrupted iterations
fixed_iterations   [   9% ] 500 VUs  00m14.9s/10m0s  008743/100000 iters, 200 per VU

running (00m15.9s), 500/500 VUs, 9175 complete and 0 interrupted iterations
fixed_iterations   [   9% ] 500 VUs  00m15.9s/10m0s  009175/100000 iters, 200 per VU

running (00m16.9s), 500/500 VUs, 9552 complete and 0 interrupted iterations
fixed_iterations   [  10% ] 500 VUs  00m16.9s/10m0s  009552/100000 iters, 200 per VU

running (00m17.9s), 500/500 VUs, 10345 complete and 0 interrupted iterations
fixed_iterations   [  10% ] 500 VUs  00m17.9s/10m0s  010345/100000 iters, 200 per VU

running (00m18.9s), 500/500 VUs, 10893 complete and 0 interrupted iterations
fixed_iterations   [  11% ] 500 VUs  00m18.9s/10m0s  010893/100000 iters, 200 per VU

running (00m19.9s), 500/500 VUs, 11596 complete and 0 interrupted iterations
fixed_iterations   [  12% ] 500 VUs  00m19.9s/10m0s  011596/100000 iters, 200 per VU

running (00m20.9s), 500/500 VUs, 11957 complete and 0 interrupted iterations
fixed_iterations   [  12% ] 500 VUs  00m20.9s/10m0s  011957/100000 iters, 200 per VU

running (00m21.9s), 500/500 VUs, 12315 complete and 0 interrupted iterations
fixed_iterations   [  12% ] 500 VUs  00m21.9s/10m0s  012315/100000 iters, 200 per VU

running (00m22.9s), 500/500 VUs, 12677 complete and 0 interrupted iterations
fixed_iterations   [  13% ] 500 VUs  00m22.9s/10m0s  012677/100000 iters, 200 per VU

running (00m23.9s), 500/500 VUs, 13161 complete and 0 interrupted iterations
fixed_iterations   [  13% ] 500 VUs  00m23.9s/10m0s  013161/100000 iters, 200 per VU

running (00m24.9s), 500/500 VUs, 13753 complete and 0 interrupted iterations
fixed_iterations   [  14% ] 500 VUs  00m24.9s/10m0s  013753/100000 iters, 200 per VU

running (00m25.9s), 500/500 VUs, 14178 complete and 0 interrupted iterations
fixed_iterations   [  14% ] 500 VUs  00m25.9s/10m0s  014178/100000 iters, 200 per VU

running (00m26.9s), 500/500 VUs, 14785 complete and 0 interrupted iterations
fixed_iterations   [  15% ] 500 VUs  00m26.9s/10m0s  014785/100000 iters, 200 per VU

running (00m27.9s), 500/500 VUs, 15364 complete and 0 interrupted iterations
fixed_iterations   [  15% ] 500 VUs  00m27.9s/10m0s  015364/100000 iters, 200 per VU

running (00m28.9s), 500/500 VUs, 15738 complete and 0 interrupted iterations
fixed_iterations   [  16% ] 500 VUs  00m28.9s/10m0s  015738/100000 iters, 200 per VU

running (00m29.9s), 500/500 VUs, 16359 complete and 0 interrupted iterations
fixed_iterations   [  16% ] 500 VUs  00m29.9s/10m0s  016359/100000 iters, 200 per VU

running (00m30.9s), 500/500 VUs, 16909 complete and 0 interrupted iterations
fixed_iterations   [  17% ] 500 VUs  00m30.9s/10m0s  016909/100000 iters, 200 per VU

running (00m31.9s), 500/500 VUs, 17288 complete and 0 interrupted iterations
fixed_iterations   [  17% ] 500 VUs  00m31.9s/10m0s  017288/100000 iters, 200 per VU

running (00m32.9s), 500/500 VUs, 17660 complete and 0 interrupted iterations
fixed_iterations   [  18% ] 500 VUs  00m32.9s/10m0s  017660/100000 iters, 200 per VU

running (00m33.9s), 500/500 VUs, 18274 complete and 0 interrupted iterations
fixed_iterations   [  18% ] 500 VUs  00m33.9s/10m0s  018274/100000 iters, 200 per VU

running (00m34.9s), 500/500 VUs, 19039 complete and 0 interrupted iterations
fixed_iterations   [  19% ] 500 VUs  00m34.9s/10m0s  019039/100000 iters, 200 per VU

running (00m35.9s), 500/500 VUs, 19407 complete and 0 interrupted iterations
fixed_iterations   [  19% ] 500 VUs  00m35.9s/10m0s  019407/100000 iters, 200 per VU

running (00m36.9s), 500/500 VUs, 19983 complete and 0 interrupted iterations
fixed_iterations   [  20% ] 500 VUs  00m36.9s/10m0s  019983/100000 iters, 200 per VU

running (00m37.9s), 500/500 VUs, 20345 complete and 0 interrupted iterations
fixed_iterations   [  20% ] 500 VUs  00m37.9s/10m0s  020345/100000 iters, 200 per VU

running (00m38.9s), 500/500 VUs, 20713 complete and 0 interrupted iterations
fixed_iterations   [  21% ] 500 VUs  00m38.9s/10m0s  020713/100000 iters, 200 per VU

running (00m39.9s), 500/500 VUs, 21296 complete and 0 interrupted iterations
fixed_iterations   [  21% ] 500 VUs  00m39.9s/10m0s  021296/100000 iters, 200 per VU

running (00m40.9s), 500/500 VUs, 21707 complete and 0 interrupted iterations
fixed_iterations   [  22% ] 500 VUs  00m40.9s/10m0s  021707/100000 iters, 200 per VU

running (00m41.9s), 500/500 VUs, 22082 complete and 0 interrupted iterations
fixed_iterations   [  22% ] 500 VUs  00m41.9s/10m0s  022082/100000 iters, 200 per VU

running (00m42.9s), 500/500 VUs, 22660 complete and 0 interrupted iterations
fixed_iterations   [  23% ] 500 VUs  00m42.9s/10m0s  022660/100000 iters, 200 per VU

running (00m43.9s), 500/500 VUs, 23029 complete and 0 interrupted iterations
fixed_iterations   [  23% ] 500 VUs  00m43.9s/10m0s  023029/100000 iters, 200 per VU

running (00m44.9s), 500/500 VUs, 23642 complete and 0 interrupted iterations
fixed_iterations   [  24% ] 500 VUs  00m44.9s/10m0s  023642/100000 iters, 200 per VU

running (00m45.9s), 500/500 VUs, 24009 complete and 0 interrupted iterations
fixed_iterations   [  24% ] 500 VUs  00m45.9s/10m0s  024009/100000 iters, 200 per VU

running (00m46.9s), 500/500 VUs, 24562 complete and 0 interrupted iterations
fixed_iterations   [  25% ] 500 VUs  00m46.9s/10m0s  024562/100000 iters, 200 per VU

running (00m47.1s), 500/500 VUs, 24661 complete and 0 interrupted iterations
fixed_iterations   [  25% ] 500 VUs  00m47.1s/10m0s  024661/100000 iters, 200 per VU

running (00m47.9s), 500/500 VUs, 24947 complete and 0 interrupted iterations
fixed_iterations   [  25% ] 500 VUs  00m47.9s/10m0s  024947/100000 iters, 200 per VU

running (00m48.9s), 500/500 VUs, 25312 complete and 0 interrupted iterations
fixed_iterations   [  25% ] 500 VUs  00m48.9s/10m0s  025312/100000 iters, 200 per VU

running (00m49.9s), 500/500 VUs, 25827 complete and 0 interrupted iterations
fixed_iterations   [  26% ] 500 VUs  00m49.9s/10m0s  025827/100000 iters, 200 per VU

running (00m50.9s), 500/500 VUs, 26208 complete and 0 interrupted iterations
fixed_iterations   [  26% ] 500 VUs  00m50.9s/10m0s  026208/100000 iters, 200 per VU

running (00m51.9s), 500/500 VUs, 26593 complete and 0 interrupted iterations
fixed_iterations   [  27% ] 500 VUs  00m51.9s/10m0s  026593/100000 iters, 200 per VU

running (00m52.9s), 500/500 VUs, 26980 complete and 0 interrupted iterations
fixed_iterations   [  27% ] 500 VUs  00m52.9s/10m0s  026980/100000 iters, 200 per VU

running (00m53.9s), 500/500 VUs, 27355 complete and 0 interrupted iterations
fixed_iterations   [  27% ] 500 VUs  00m53.9s/10m0s  027355/100000 iters, 200 per VU

running (00m54.9s), 500/500 VUs, 27896 complete and 0 interrupted iterations
fixed_iterations   [  28% ] 500 VUs  00m54.9s/10m0s  027896/100000 iters, 200 per VU

running (00m55.9s), 500/500 VUs, 28274 complete and 0 interrupted iterations
fixed_iterations   [  28% ] 500 VUs  00m55.9s/10m0s  028274/100000 iters, 200 per VU

running (00m56.9s), 500/500 VUs, 28646 complete and 0 interrupted iterations
fixed_iterations   [  29% ] 500 VUs  00m56.9s/10m0s  028646/100000 iters, 200 per VU

running (00m57.9s), 500/500 VUs, 29031 complete and 0 interrupted iterations
fixed_iterations   [  29% ] 500 VUs  00m57.9s/10m0s  029031/100000 iters, 200 per VU

running (00m58.9s), 500/500 VUs, 29412 complete and 0 interrupted iterations
fixed_iterations   [  29% ] 500 VUs  00m58.9s/10m0s  029412/100000 iters, 200 per VU

running (00m59.9s), 500/500 VUs, 29933 complete and 0 interrupted iterations
fixed_iterations   [  30% ] 500 VUs  00m59.9s/10m0s  029933/100000 iters, 200 per VU

running (01m00.9s), 500/500 VUs, 30319 complete and 0 interrupted iterations
fixed_iterations   [  30% ] 500 VUs  01m00.9s/10m0s  030319/100000 iters, 200 per VU

running (01m01.9s), 500/500 VUs, 30691 complete and 0 interrupted iterations
fixed_iterations   [  31% ] 500 VUs  01m01.9s/10m0s  030691/100000 iters, 200 per VU

running (01m02.9s), 500/500 VUs, 31066 complete and 0 interrupted iterations
fixed_iterations   [  31% ] 500 VUs  01m02.9s/10m0s  031066/100000 iters, 200 per VU

running (01m03.9s), 500/500 VUs, 31449 complete and 0 interrupted iterations
fixed_iterations   [  31% ] 500 VUs  01m03.9s/10m0s  031449/100000 iters, 200 per VU

running (01m04.9s), 500/500 VUs, 31975 complete and 0 interrupted iterations
fixed_iterations   [  32% ] 500 VUs  01m04.9s/10m0s  031975/100000 iters, 200 per VU

running (01m05.9s), 500/500 VUs, 32351 complete and 0 interrupted iterations
fixed_iterations   [  32% ] 500 VUs  01m05.9s/10m0s  032351/100000 iters, 200 per VU

running (01m06.9s), 500/500 VUs, 32735 complete and 0 interrupted iterations
fixed_iterations   [  33% ] 500 VUs  01m06.9s/10m0s  032735/100000 iters, 200 per VU

running (01m07.9s), 500/500 VUs, 33101 complete and 0 interrupted iterations
fixed_iterations   [  33% ] 500 VUs  01m07.9s/10m0s  033101/100000 iters, 200 per VU

running (01m08.9s), 500/500 VUs, 33490 complete and 0 interrupted iterations
fixed_iterations   [  33% ] 500 VUs  01m08.9s/10m0s  033490/100000 iters, 200 per VU

running (01m09.9s), 500/500 VUs, 34065 complete and 0 interrupted iterations
fixed_iterations   [  34% ] 500 VUs  01m09.9s/10m0s  034065/100000 iters, 200 per VU

running (01m10.9s), 500/500 VUs, 34448 complete and 0 interrupted iterations
fixed_iterations   [  34% ] 500 VUs  01m10.9s/10m0s  034448/100000 iters, 200 per VU

running (01m11.9s), 500/500 VUs, 34833 complete and 0 interrupted iterations
fixed_iterations   [  35% ] 500 VUs  01m11.9s/10m0s  034833/100000 iters, 200 per VU

running (01m12.9s), 500/500 VUs, 35204 complete and 0 interrupted iterations
fixed_iterations   [  35% ] 500 VUs  01m12.9s/10m0s  035204/100000 iters, 200 per VU

running (01m13.9s), 500/500 VUs, 35580 complete and 0 interrupted iterations
fixed_iterations   [  36% ] 500 VUs  01m13.9s/10m0s  035580/100000 iters, 200 per VU

running (01m14.9s), 500/500 VUs, 36103 complete and 0 interrupted iterations
fixed_iterations   [  36% ] 500 VUs  01m14.9s/10m0s  036103/100000 iters, 200 per VU

running (01m15.9s), 500/500 VUs, 36468 complete and 0 interrupted iterations
fixed_iterations   [  36% ] 500 VUs  01m15.9s/10m0s  036468/100000 iters, 200 per VU

running (01m16.9s), 500/500 VUs, 36837 complete and 0 interrupted iterations
fixed_iterations   [  37% ] 500 VUs  01m16.9s/10m0s  036837/100000 iters, 200 per VU

running (01m17.9s), 500/500 VUs, 37215 complete and 0 interrupted iterations
fixed_iterations   [  37% ] 500 VUs  01m17.9s/10m0s  037215/100000 iters, 200 per VU

running (01m18.9s), 500/500 VUs, 37586 complete and 0 interrupted iterations
fixed_iterations   [  38% ] 500 VUs  01m18.9s/10m0s  037586/100000 iters, 200 per VU

running (01m19.9s), 500/500 VUs, 38088 complete and 0 interrupted iterations
fixed_iterations   [  38% ] 500 VUs  01m19.9s/10m0s  038088/100000 iters, 200 per VU

running (01m20.9s), 500/500 VUs, 38547 complete and 0 interrupted iterations
fixed_iterations   [  39% ] 500 VUs  01m20.9s/10m0s  038547/100000 iters, 200 per VU

running (01m21.9s), 500/500 VUs, 38934 complete and 0 interrupted iterations
fixed_iterations   [  39% ] 500 VUs  01m21.9s/10m0s  038934/100000 iters, 200 per VU

running (01m22.9s), 500/500 VUs, 39422 complete and 0 interrupted iterations
fixed_iterations   [  39% ] 500 VUs  01m22.9s/10m0s  039422/100000 iters, 200 per VU

running (01m23.9s), 500/500 VUs, 39880 complete and 0 interrupted iterations
fixed_iterations   [  40% ] 500 VUs  01m23.9s/10m0s  039880/100000 iters, 200 per VU

running (01m24.9s), 500/500 VUs, 40420 complete and 0 interrupted iterations
fixed_iterations   [  40% ] 500 VUs  01m24.9s/10m0s  040420/100000 iters, 200 per VU

running (01m25.9s), 500/500 VUs, 40854 complete and 0 interrupted iterations
fixed_iterations   [  41% ] 500 VUs  01m25.9s/10m0s  040854/100000 iters, 200 per VU

running (01m26.9s), 500/500 VUs, 41372 complete and 0 interrupted iterations
fixed_iterations   [  41% ] 500 VUs  01m26.9s/10m0s  041372/100000 iters, 200 per VU

running (01m27.9s), 500/500 VUs, 41707 complete and 0 interrupted iterations
fixed_iterations   [  42% ] 500 VUs  01m27.9s/10m0s  041707/100000 iters, 200 per VU

running (01m28.9s), 500/500 VUs, 42071 complete and 0 interrupted iterations
fixed_iterations   [  42% ] 500 VUs  01m28.9s/10m0s  042071/100000 iters, 200 per VU

running (01m29.9s), 500/500 VUs, 42750 complete and 0 interrupted iterations
fixed_iterations   [  43% ] 500 VUs  01m29.9s/10m0s  042750/100000 iters, 200 per VU

running (01m30.9s), 500/500 VUs, 43284 complete and 0 interrupted iterations
fixed_iterations   [  43% ] 500 VUs  01m30.9s/10m0s  043284/100000 iters, 200 per VU

running (01m31.9s), 500/500 VUs, 43706 complete and 0 interrupted iterations
fixed_iterations   [  44% ] 500 VUs  01m31.9s/10m0s  043706/100000 iters, 200 per VU

running (01m32.9s), 500/500 VUs, 44142 complete and 0 interrupted iterations
fixed_iterations   [  44% ] 500 VUs  01m32.9s/10m0s  044142/100000 iters, 200 per VU

running (01m33.9s), 500/500 VUs, 44738 complete and 0 interrupted iterations
fixed_iterations   [  45% ] 500 VUs  01m33.9s/10m0s  044738/100000 iters, 200 per VU

running (01m34.9s), 500/500 VUs, 45454 complete and 0 interrupted iterations
fixed_iterations   [  45% ] 500 VUs  01m34.9s/10m0s  045454/100000 iters, 200 per VU

running (01m35.9s), 500/500 VUs, 45959 complete and 0 interrupted iterations
fixed_iterations   [  46% ] 500 VUs  01m35.9s/10m0s  045959/100000 iters, 200 per VU

running (01m36.9s), 500/500 VUs, 46499 complete and 0 interrupted iterations
fixed_iterations   [  46% ] 500 VUs  01m36.9s/10m0s  046499/100000 iters, 200 per VU

running (01m37.9s), 500/500 VUs, 46887 complete and 0 interrupted iterations
fixed_iterations   [  47% ] 500 VUs  01m37.9s/10m0s  046887/100000 iters, 200 per VU

running (01m38.9s), 500/500 VUs, 47336 complete and 0 interrupted iterations
fixed_iterations   [  47% ] 500 VUs  01m38.9s/10m0s  047336/100000 iters, 200 per VU

running (01m39.9s), 500/500 VUs, 47898 complete and 0 interrupted iterations
fixed_iterations   [  48% ] 500 VUs  01m39.9s/10m0s  047898/100000 iters, 200 per VU

running (01m40.9s), 500/500 VUs, 48303 complete and 0 interrupted iterations
fixed_iterations   [  48% ] 500 VUs  01m40.9s/10m0s  048303/100000 iters, 200 per VU

running (01m41.9s), 500/500 VUs, 48856 complete and 0 interrupted iterations
fixed_iterations   [  49% ] 500 VUs  01m41.9s/10m0s  048856/100000 iters, 200 per VU

running (01m42.9s), 500/500 VUs, 49267 complete and 0 interrupted iterations
fixed_iterations   [  49% ] 500 VUs  01m42.9s/10m0s  049267/100000 iters, 200 per VU

running (01m43.9s), 500/500 VUs, 49660 complete and 0 interrupted iterations
fixed_iterations   [  50% ] 500 VUs  01m43.9s/10m0s  049660/100000 iters, 200 per VU

running (01m44.9s), 500/500 VUs, 50260 complete and 0 interrupted iterations
fixed_iterations   [  50% ] 500 VUs  01m44.9s/10m0s  050260/100000 iters, 200 per VU

running (01m45.9s), 500/500 VUs, 50661 complete and 0 interrupted iterations
fixed_iterations   [  51% ] 500 VUs  01m45.9s/10m0s  050661/100000 iters, 200 per VU

running (01m46.9s), 500/500 VUs, 51107 complete and 0 interrupted iterations
fixed_iterations   [  51% ] 500 VUs  01m46.9s/10m0s  051107/100000 iters, 200 per VU

running (01m47.9s), 500/500 VUs, 51666 complete and 0 interrupted iterations
fixed_iterations   [  52% ] 500 VUs  01m47.9s/10m0s  051666/100000 iters, 200 per VU

running (01m48.9s), 500/500 VUs, 52086 complete and 0 interrupted iterations
fixed_iterations   [  52% ] 500 VUs  01m48.9s/10m0s  052086/100000 iters, 200 per VU

running (01m49.9s), 500/500 VUs, 52632 complete and 0 interrupted iterations
fixed_iterations   [  53% ] 500 VUs  01m49.9s/10m0s  052632/100000 iters, 200 per VU

running (01m50.9s), 500/500 VUs, 53034 complete and 0 interrupted iterations
fixed_iterations   [  53% ] 500 VUs  01m50.9s/10m0s  053034/100000 iters, 200 per VU

running (01m51.9s), 500/500 VUs, 53443 complete and 0 interrupted iterations
fixed_iterations   [  53% ] 500 VUs  01m51.9s/10m0s  053443/100000 iters, 200 per VU

running (01m52.9s), 500/500 VUs, 53846 complete and 0 interrupted iterations
fixed_iterations   [  54% ] 500 VUs  01m52.9s/10m0s  053846/100000 iters, 200 per VU

running (01m53.9s), 500/500 VUs, 54248 complete and 0 interrupted iterations
fixed_iterations   [  54% ] 500 VUs  01m53.9s/10m0s  054248/100000 iters, 200 per VU

running (01m54.9s), 500/500 VUs, 54824 complete and 0 interrupted iterations
fixed_iterations   [  55% ] 500 VUs  01m54.9s/10m0s  054824/100000 iters, 200 per VU

running (01m55.9s), 500/500 VUs, 55223 complete and 0 interrupted iterations
fixed_iterations   [  55% ] 500 VUs  01m55.9s/10m0s  055223/100000 iters, 200 per VU

running (01m56.9s), 500/500 VUs, 55619 complete and 0 interrupted iterations
fixed_iterations   [  56% ] 500 VUs  01m56.9s/10m0s  055619/100000 iters, 200 per VU

running (01m57.9s), 500/500 VUs, 56039 complete and 0 interrupted iterations
fixed_iterations   [  56% ] 500 VUs  01m57.9s/10m0s  056039/100000 iters, 200 per VU

running (01m58.9s), 500/500 VUs, 56445 complete and 0 interrupted iterations
fixed_iterations   [  56% ] 500 VUs  01m58.9s/10m0s  056445/100000 iters, 200 per VU

running (01m59.9s), 500/500 VUs, 57010 complete and 0 interrupted iterations
fixed_iterations   [  57% ] 500 VUs  01m59.9s/10m0s  057010/100000 iters, 200 per VU

running (02m00.9s), 500/500 VUs, 57561 complete and 0 interrupted iterations
fixed_iterations   [  58% ] 500 VUs  02m00.9s/10m0s  057561/100000 iters, 200 per VU

running (02m01.9s), 500/500 VUs, 57962 complete and 0 interrupted iterations
fixed_iterations   [  58% ] 500 VUs  02m01.9s/10m0s  057962/100000 iters, 200 per VU

running (02m02.9s), 500/500 VUs, 58373 complete and 0 interrupted iterations
fixed_iterations   [  58% ] 500 VUs  02m02.9s/10m0s  058373/100000 iters, 200 per VU

running (02m03.9s), 500/500 VUs, 58783 complete and 0 interrupted iterations
fixed_iterations   [  59% ] 500 VUs  02m03.9s/10m0s  058783/100000 iters, 200 per VU

running (02m04.9s), 500/500 VUs, 59337 complete and 0 interrupted iterations
fixed_iterations   [  59% ] 500 VUs  02m04.9s/10m0s  059337/100000 iters, 200 per VU

running (02m05.9s), 500/500 VUs, 59734 complete and 0 interrupted iterations
fixed_iterations   [  60% ] 500 VUs  02m05.9s/10m0s  059734/100000 iters, 200 per VU

running (02m06.9s), 500/500 VUs, 60192 complete and 0 interrupted iterations
fixed_iterations   [  60% ] 500 VUs  02m06.9s/10m0s  060192/100000 iters, 200 per VU

running (02m07.9s), 500/500 VUs, 60556 complete and 0 interrupted iterations
fixed_iterations   [  61% ] 500 VUs  02m07.9s/10m0s  060556/100000 iters, 200 per VU

running (02m08.9s), 500/500 VUs, 61052 complete and 0 interrupted iterations
fixed_iterations   [  61% ] 500 VUs  02m08.9s/10m0s  061052/100000 iters, 200 per VU

running (02m09.9s), 500/500 VUs, 61587 complete and 0 interrupted iterations
fixed_iterations   [  62% ] 500 VUs  02m09.9s/10m0s  061587/100000 iters, 200 per VU

running (02m10.9s), 500/500 VUs, 61987 complete and 0 interrupted iterations
fixed_iterations   [  62% ] 500 VUs  02m10.9s/10m0s  061987/100000 iters, 200 per VU

running (02m11.9s), 500/500 VUs, 62458 complete and 0 interrupted iterations
fixed_iterations   [  62% ] 500 VUs  02m11.9s/10m0s  062458/100000 iters, 200 per VU

running (02m12.9s), 500/500 VUs, 62875 complete and 0 interrupted iterations
fixed_iterations   [  63% ] 500 VUs  02m12.9s/10m0s  062875/100000 iters, 200 per VU

running (02m13.9s), 500/500 VUs, 63269 complete and 0 interrupted iterations
fixed_iterations   [  63% ] 500 VUs  02m13.9s/10m0s  063269/100000 iters, 200 per VU

running (02m14.9s), 500/500 VUs, 63871 complete and 0 interrupted iterations
fixed_iterations   [  64% ] 500 VUs  02m14.9s/10m0s  063871/100000 iters, 200 per VU

running (02m15.9s), 500/500 VUs, 64273 complete and 0 interrupted iterations
fixed_iterations   [  64% ] 500 VUs  02m15.9s/10m0s  064273/100000 iters, 200 per VU

running (02m16.9s), 500/500 VUs, 64701 complete and 0 interrupted iterations
fixed_iterations   [  65% ] 500 VUs  02m16.9s/10m0s  064701/100000 iters, 200 per VU

running (02m17.9s), 500/500 VUs, 65088 complete and 0 interrupted iterations
fixed_iterations   [  65% ] 500 VUs  02m17.9s/10m0s  065088/100000 iters, 200 per VU

running (02m18.9s), 500/500 VUs, 65495 complete and 0 interrupted iterations
fixed_iterations   [  65% ] 500 VUs  02m18.9s/10m0s  065495/100000 iters, 200 per VU

running (02m19.9s), 500/500 VUs, 66295 complete and 0 interrupted iterations
fixed_iterations   [  66% ] 500 VUs  02m19.9s/10m0s  066295/100000 iters, 200 per VU

running (02m20.9s), 500/500 VUs, 66762 complete and 0 interrupted iterations
fixed_iterations   [  67% ] 500 VUs  02m20.9s/10m0s  066762/100000 iters, 200 per VU

running (02m21.9s), 500/500 VUs, 67229 complete and 0 interrupted iterations
fixed_iterations   [  67% ] 500 VUs  02m21.9s/10m0s  067229/100000 iters, 200 per VU

running (02m22.9s), 500/500 VUs, 67641 complete and 0 interrupted iterations
fixed_iterations   [  68% ] 500 VUs  02m22.9s/10m0s  067641/100000 iters, 200 per VU

running (02m23.9s), 500/500 VUs, 68035 complete and 0 interrupted iterations
fixed_iterations   [  68% ] 500 VUs  02m23.9s/10m0s  068035/100000 iters, 200 per VU

running (02m24.9s), 500/500 VUs, 68561 complete and 0 interrupted iterations
fixed_iterations   [  69% ] 500 VUs  02m24.9s/10m0s  068561/100000 iters, 200 per VU

running (02m25.9s), 500/500 VUs, 69023 complete and 0 interrupted iterations
fixed_iterations   [  69% ] 500 VUs  02m25.9s/10m0s  069023/100000 iters, 200 per VU

running (02m26.9s), 500/500 VUs, 69428 complete and 0 interrupted iterations
fixed_iterations   [  69% ] 500 VUs  02m26.9s/10m0s  069428/100000 iters, 200 per VU

running (02m27.9s), 500/500 VUs, 69863 complete and 0 interrupted iterations
fixed_iterations   [  70% ] 500 VUs  02m27.9s/10m0s  069863/100000 iters, 200 per VU

running (02m28.9s), 500/500 VUs, 70265 complete and 0 interrupted iterations
fixed_iterations   [  70% ] 500 VUs  02m28.9s/10m0s  070265/100000 iters, 200 per VU

running (02m29.9s), 500/500 VUs, 70989 complete and 0 interrupted iterations
fixed_iterations   [  71% ] 500 VUs  02m29.9s/10m0s  070989/100000 iters, 200 per VU

running (02m30.9s), 500/500 VUs, 71395 complete and 0 interrupted iterations
fixed_iterations   [  71% ] 500 VUs  02m30.9s/10m0s  071395/100000 iters, 200 per VU

running (02m31.9s), 500/500 VUs, 71783 complete and 0 interrupted iterations
fixed_iterations   [  72% ] 500 VUs  02m31.9s/10m0s  071783/100000 iters, 200 per VU

running (02m32.9s), 500/500 VUs, 72254 complete and 0 interrupted iterations
fixed_iterations   [  72% ] 500 VUs  02m32.9s/10m0s  072254/100000 iters, 200 per VU

running (02m33.9s), 500/500 VUs, 72658 complete and 0 interrupted iterations
fixed_iterations   [  73% ] 500 VUs  02m33.9s/10m0s  072658/100000 iters, 200 per VU

running (02m34.9s), 500/500 VUs, 73320 complete and 0 interrupted iterations
fixed_iterations   [  73% ] 500 VUs  02m34.9s/10m0s  073320/100000 iters, 200 per VU

running (02m35.9s), 500/500 VUs, 73706 complete and 0 interrupted iterations
fixed_iterations   [  74% ] 500 VUs  02m35.9s/10m0s  073706/100000 iters, 200 per VU

running (02m36.9s), 500/500 VUs, 74104 complete and 0 interrupted iterations
fixed_iterations   [  74% ] 500 VUs  02m36.9s/10m0s  074104/100000 iters, 200 per VU

running (02m37.9s), 500/500 VUs, 74535 complete and 0 interrupted iterations
fixed_iterations   [  75% ] 500 VUs  02m37.9s/10m0s  074535/100000 iters, 200 per VU

running (02m38.9s), 500/500 VUs, 74936 complete and 0 interrupted iterations
fixed_iterations   [  75% ] 500 VUs  02m38.9s/10m0s  074936/100000 iters, 200 per VU

running (02m39.9s), 500/500 VUs, 75473 complete and 0 interrupted iterations
fixed_iterations   [  75% ] 500 VUs  02m39.9s/10m0s  075473/100000 iters, 200 per VU

running (02m40.9s), 500/500 VUs, 75876 complete and 0 interrupted iterations
fixed_iterations   [  76% ] 500 VUs  02m40.9s/10m0s  075876/100000 iters, 200 per VU

running (02m41.9s), 500/500 VUs, 76369 complete and 0 interrupted iterations
fixed_iterations   [  76% ] 500 VUs  02m41.9s/10m0s  076369/100000 iters, 200 per VU

running (02m42.9s), 500/500 VUs, 76830 complete and 0 interrupted iterations
fixed_iterations   [  77% ] 500 VUs  02m42.9s/10m0s  076830/100000 iters, 200 per VU

running (02m43.9s), 500/500 VUs, 77230 complete and 0 interrupted iterations
fixed_iterations   [  77% ] 500 VUs  02m43.9s/10m0s  077230/100000 iters, 200 per VU

running (02m44.9s), 500/500 VUs, 77764 complete and 0 interrupted iterations
fixed_iterations   [  78% ] 500 VUs  02m44.9s/10m0s  077764/100000 iters, 200 per VU

running (02m45.9s), 500/500 VUs, 78164 complete and 0 interrupted iterations
fixed_iterations   [  78% ] 500 VUs  02m45.9s/10m0s  078164/100000 iters, 200 per VU

running (02m46.9s), 500/500 VUs, 78560 complete and 0 interrupted iterations
fixed_iterations   [  79% ] 500 VUs  02m46.9s/10m0s  078560/100000 iters, 200 per VU

running (02m47.9s), 500/500 VUs, 78995 complete and 0 interrupted iterations
fixed_iterations   [  79% ] 500 VUs  02m47.9s/10m0s  078995/100000 iters, 200 per VU

running (02m48.9s), 500/500 VUs, 79404 complete and 0 interrupted iterations
fixed_iterations   [  79% ] 500 VUs  02m48.9s/10m0s  079404/100000 iters, 200 per VU

running (02m49.9s), 500/500 VUs, 79955 complete and 0 interrupted iterations
fixed_iterations   [  80% ] 500 VUs  02m49.9s/10m0s  079955/100000 iters, 200 per VU

running (02m50.9s), 500/500 VUs, 80363 complete and 0 interrupted iterations
fixed_iterations   [  80% ] 500 VUs  02m50.9s/10m0s  080363/100000 iters, 200 per VU

running (02m51.9s), 500/500 VUs, 80764 complete and 0 interrupted iterations
fixed_iterations   [  81% ] 500 VUs  02m51.9s/10m0s  080764/100000 iters, 200 per VU

running (02m52.9s), 500/500 VUs, 81246 complete and 0 interrupted iterations
fixed_iterations   [  81% ] 500 VUs  02m52.9s/10m0s  081246/100000 iters, 200 per VU

running (02m53.9s), 500/500 VUs, 81648 complete and 0 interrupted iterations
fixed_iterations   [  82% ] 500 VUs  02m53.9s/10m0s  081648/100000 iters, 200 per VU

running (02m54.9s), 500/500 VUs, 82220 complete and 0 interrupted iterations
fixed_iterations   [  82% ] 500 VUs  02m54.9s/10m0s  082220/100000 iters, 200 per VU

running (02m55.9s), 500/500 VUs, 82623 complete and 0 interrupted iterations
fixed_iterations   [  83% ] 500 VUs  02m55.9s/10m0s  082623/100000 iters, 200 per VU

running (02m56.9s), 500/500 VUs, 83033 complete and 0 interrupted iterations
fixed_iterations   [  83% ] 500 VUs  02m56.9s/10m0s  083033/100000 iters, 200 per VU

running (02m57.9s), 500/500 VUs, 83441 complete and 0 interrupted iterations
fixed_iterations   [  83% ] 500 VUs  02m57.9s/10m0s  083441/100000 iters, 200 per VU

running (02m58.9s), 500/500 VUs, 83837 complete and 0 interrupted iterations
fixed_iterations   [  84% ] 500 VUs  02m58.9s/10m0s  083837/100000 iters, 200 per VU

running (02m59.9s), 500/500 VUs, 84390 complete and 0 interrupted iterations
fixed_iterations   [  84% ] 500 VUs  02m59.9s/10m0s  084390/100000 iters, 200 per VU

running (03m00.9s), 500/500 VUs, 84795 complete and 0 interrupted iterations
fixed_iterations   [  85% ] 500 VUs  03m00.9s/10m0s  084795/100000 iters, 200 per VU

running (03m01.9s), 500/500 VUs, 85191 complete and 0 interrupted iterations
fixed_iterations   [  85% ] 500 VUs  03m01.9s/10m0s  085191/100000 iters, 200 per VU

running (03m02.9s), 500/500 VUs, 85598 complete and 0 interrupted iterations
fixed_iterations   [  86% ] 500 VUs  03m02.9s/10m0s  085598/100000 iters, 200 per VU

running (03m03.9s), 500/500 VUs, 86216 complete and 0 interrupted iterations
fixed_iterations   [  86% ] 500 VUs  03m03.9s/10m0s  086216/100000 iters, 200 per VU

running (03m04.9s), 500/500 VUs, 86778 complete and 0 interrupted iterations
fixed_iterations   [  87% ] 500 VUs  03m04.9s/10m0s  086778/100000 iters, 200 per VU

running (03m05.9s), 500/500 VUs, 87196 complete and 0 interrupted iterations
fixed_iterations   [  87% ] 500 VUs  03m05.9s/10m0s  087196/100000 iters, 200 per VU

running (03m06.9s), 500/500 VUs, 87600 complete and 0 interrupted iterations
fixed_iterations   [  88% ] 500 VUs  03m06.9s/10m0s  087600/100000 iters, 200 per VU

running (03m07.9s), 500/500 VUs, 87991 complete and 0 interrupted iterations
fixed_iterations   [  88% ] 500 VUs  03m07.9s/10m0s  087991/100000 iters, 200 per VU

running (03m08.9s), 500/500 VUs, 88388 complete and 0 interrupted iterations
fixed_iterations   [  88% ] 500 VUs  03m08.9s/10m0s  088388/100000 iters, 200 per VU

running (03m09.9s), 500/500 VUs, 88919 complete and 0 interrupted iterations
fixed_iterations   [  89% ] 500 VUs  03m09.9s/10m0s  088919/100000 iters, 200 per VU

running (03m10.9s), 500/500 VUs, 89325 complete and 0 interrupted iterations
fixed_iterations   [  89% ] 500 VUs  03m10.9s/10m0s  089325/100000 iters, 200 per VU

running (03m11.9s), 500/500 VUs, 89720 complete and 0 interrupted iterations
fixed_iterations   [  90% ] 500 VUs  03m11.9s/10m0s  089720/100000 iters, 200 per VU

running (03m12.9s), 500/500 VUs, 90126 complete and 0 interrupted iterations
fixed_iterations   [  90% ] 500 VUs  03m12.9s/10m0s  090126/100000 iters, 200 per VU

running (03m13.9s), 500/500 VUs, 90521 complete and 0 interrupted iterations
fixed_iterations   [  91% ] 500 VUs  03m13.9s/10m0s  090521/100000 iters, 200 per VU

running (03m14.9s), 500/500 VUs, 91141 complete and 0 interrupted iterations
fixed_iterations   [  91% ] 500 VUs  03m14.9s/10m0s  091141/100000 iters, 200 per VU

running (03m15.9s), 500/500 VUs, 91762 complete and 0 interrupted iterations
fixed_iterations   [  92% ] 500 VUs  03m15.9s/10m0s  091762/100000 iters, 200 per VU

running (03m16.9s), 500/500 VUs, 92177 complete and 0 interrupted iterations
fixed_iterations   [  92% ] 500 VUs  03m16.9s/10m0s  092177/100000 iters, 200 per VU

running (03m17.9s), 500/500 VUs, 92579 complete and 0 interrupted iterations
fixed_iterations   [  93% ] 500 VUs  03m17.9s/10m0s  092579/100000 iters, 200 per VU

running (03m18.9s), 500/500 VUs, 93035 complete and 0 interrupted iterations
fixed_iterations   [  93% ] 500 VUs  03m18.9s/10m0s  093035/100000 iters, 200 per VU

running (03m19.9s), 500/500 VUs, 93588 complete and 0 interrupted iterations
fixed_iterations   [  94% ] 500 VUs  03m19.9s/10m0s  093588/100000 iters, 200 per VU

running (03m20.9s), 500/500 VUs, 94053 complete and 0 interrupted iterations
fixed_iterations   [  94% ] 500 VUs  03m20.9s/10m0s  094053/100000 iters, 200 per VU

running (03m21.9s), 500/500 VUs, 94451 complete and 0 interrupted iterations
fixed_iterations   [  94% ] 500 VUs  03m21.9s/10m0s  094451/100000 iters, 200 per VU

running (03m22.9s), 500/500 VUs, 94857 complete and 0 interrupted iterations
fixed_iterations   [  95% ] 500 VUs  03m22.9s/10m0s  094857/100000 iters, 200 per VU

running (03m23.9s), 500/500 VUs, 95308 complete and 0 interrupted iterations
fixed_iterations   [  95% ] 500 VUs  03m23.9s/10m0s  095308/100000 iters, 200 per VU

running (03m24.9s), 500/500 VUs, 95855 complete and 0 interrupted iterations
fixed_iterations   [  96% ] 500 VUs  03m24.9s/10m0s  095855/100000 iters, 200 per VU

running (03m25.9s), 500/500 VUs, 96258 complete and 0 interrupted iterations
fixed_iterations   [  96% ] 500 VUs  03m25.9s/10m0s  096258/100000 iters, 200 per VU

running (03m26.9s), 500/500 VUs, 96661 complete and 0 interrupted iterations
fixed_iterations   [  97% ] 500 VUs  03m26.9s/10m0s  096661/100000 iters, 200 per VU

running (03m27.9s), 500/500 VUs, 97126 complete and 0 interrupted iterations
fixed_iterations   [  97% ] 500 VUs  03m27.9s/10m0s  097126/100000 iters, 200 per VU

running (03m28.9s), 500/500 VUs, 97551 complete and 0 interrupted iterations
fixed_iterations   [  98% ] 500 VUs  03m28.9s/10m0s  097551/100000 iters, 200 per VU

running (03m29.9s), 500/500 VUs, 98063 complete and 0 interrupted iterations
fixed_iterations   [  98% ] 500 VUs  03m29.9s/10m0s  098063/100000 iters, 200 per VU

running (03m30.9s), 500/500 VUs, 98478 complete and 0 interrupted iterations
fixed_iterations   [  98% ] 500 VUs  03m30.9s/10m0s  098478/100000 iters, 200 per VU

running (03m31.9s), 500/500 VUs, 98874 complete and 0 interrupted iterations
fixed_iterations   [  99% ] 500 VUs  03m31.9s/10m0s  098874/100000 iters, 200 per VU

running (03m32.9s), 473/500 VUs, 99285 complete and 0 interrupted iterations
fixed_iterations   [  99% ] 500 VUs  03m32.9s/10m0s  099285/100000 iters, 200 per VU

running (03m33.9s), 244/500 VUs, 99737 complete and 0 interrupted iterations
fixed_iterations   [ 100% ] 500 VUs  03m33.9s/10m0s  099737/100000 iters, 200 per VU


  █ TOTAL RESULTS 

    checks_total.......: 100000  466.4517/s
    checks_succeeded...: 100.00% 100000 out of 100000
    checks_failed......: 0.00%   0 out of 100000

    ✓ status is 200

    HTTP
    http_req_duration..............: avg=1.06s min=11.25ms med=1.1s max=1.5s p(90)=1.3s p(95)=1.38s
      { expected_response:true }...: avg=1.06s min=11.25ms med=1.1s max=1.5s p(90)=1.3s p(95)=1.38s
    http_req_failed................: 0.00%  0 out of 100000
    http_reqs......................: 100000 466.4517/s

    EXECUTION
    iteration_duration.............: avg=1.06s min=19.85ms med=1.1s max=1.5s p(90)=1.3s p(95)=1.38s
    iterations.....................: 100000 466.4517/s
    vus............................: 244    min=244         max=500
    vus_max........................: 500    min=500         max=500

    NETWORK
    data_received..................: 22 MB  101 kB/s
    data_sent......................: 14 MB  63 kB/s




running (03m34.4s), 000/500 VUs, 100000 complete and 0 interrupted iterations
fixed_iterations ✓ [ 100% ] 500 VUs  03m34.4s/10m0s  100000/100000 iters, 200 per VU
